author_name,rating,text,relative_time_description,reviewer_total_reviews,reviewer_profile_url
Phua Hh,5,"🟨 Dr Keith Ong is always detailed in giving explanations whenever I ask him on the state of my teeth.

🟦 I go to him for teeth cleaning regularly every 6 months. He is very patient and kind and is also a skilled and experienced dentist.

🔷️ Kaylee, the receptionist, is always cheerful & friendly. 🙏🏻All in all, my experiences are good here.🔷️I highly recommended this dental clinic.",6 months ago,,https://www.google.com/maps/contrib/102381074513494763902/reviews
Cecilia Han,5,"I chanced upon A Dental Clinic @ Clementi Central. The receptionist was polite and helpful to ""squeeze"" me into an available time slot despite not making prior appointment ( I walked in with another lady as we went to another dental clinic and were told it was closed though it stated it was opened half day).
Dr Keith Ong was very patient with me as as I kept asking same repeated query. He is experienced and skilled dentist I have ever seen. I am glad to visit this clinic.",a month ago,,https://www.google.com/maps/contrib/102486435916947342283/reviews
Joanne Loi,5,Great experience with friendly receptionist. Dr Keith Ong is skilled with extraction of my tooth. Waiting time with appointment is timely. Starting my journey with straits up smile aligners. Hope all is well.,3 months ago,,https://www.google.com/maps/contrib/102299483277712093521/reviews
Florence Leow,5,"🔵I have been seeing Dr Keith Ong for teeth cleaning and other dentistry issues since 2008.

🟢 When he moved to this Clementi clinic, I followed him to his new workplace. I go to him regularly for general teeth cleaning twice a year.

🟨 Dr Ong is very patient, kind and detailed in his work. He has a very good positive attitude and will explain things nicely if you ask him about certain issues.

🟦 The receptionist, Kaylee, is cheerful and efficient in her duties too.",6 months ago,,https://www.google.com/maps/contrib/102656561598060120185/reviews
Clara Chen,1,"The two times I visited this dental clinic left such a bad mark in my memory that I have to warn others if they are even considering coming here for services. The male dentist is quite rough and poorly skilled, plus the dental and clinic assistants are also inexperienced and helpless; both times I leave the dental clinic traumatized.

My first visit was for x-ray and dental impression for my aligners. The appointment was pre-arranged and I was quoted a rate for this appointment. As we got started, I laid on the dental chair when the dentist announced he will be doing scaling & polishing too. When we were done, the bill was ~$100 more than the original quote I got beforehand. I found out that was to cover the scaling & polishing service, whose cost he failed to inform me of before he commenced the scaling & polishing.

Regardless, I accepted it as a misunderstanding and returned later to get my aligners bonded.

My next appointment was for bonding the new aligners & shaving my teeth. He kept hurting my gums even though he knew they are sensitive; like I said earlier, the dental assistant was helpless. He shoved dental floss on my gums so they hurt & even bled a little - to which he said to just let it stop on its own. While shaving my teeth to fit, on the dentist’s instructions, the dental assistant used a mirror to press against my tongue to “protect” it. However when he started the shaving process - which was terrifying due to the sound, smell, and vibrations on my gums - the dental assistant made space for him and removed any protection for my tongue so it was left dangerously hanging in the air while the shaving is being done.

All this time, I made uncomfortable sounds, fidgeting in the dental chair and asked him to stop at times. So he was fully aware of my discomfort.

At the reception when I got my bill, I asked the clinic assistant if it’s supposed to be $50 less as I recalled I was quoted a fewer amount. She was snappy and said it couldn’t be. I checked the original quote and discovered she was right - so I apologized for my oversight. She replied with a snide remark that no one would offer to do this for a lower price.

When I got back and checked my teeth; the dentist had left a sharp edge on one tooth when shaving and it looked like he had done it halfway. And my gums continued to bleed.

I seldom give a bad rating but given this terrifying experience, I do not recommend you visiting this dental clinic. Try their neighbours instead - there are two others next to them which are reputable and value for money.",9 months ago,,https://www.google.com/maps/contrib/101332623571636986122/reviews
