author_name,rating,text,relative_time_description,reviewer_total_reviews,reviewer_profile_url
Tay JY,5,Our coach YeKai is an awesome coach for our first trial lesson. Very welcoming and give off very comfortable learning vibe for new sports.,3 years ago,,https://www.google.com/maps/contrib/118342710101289714569/reviews
Keren Yang,5,It’s a great choice for enriching kids’ experience and also help to enforce their body strength and flexibility. ABS provides a quite professional support on the training and competitions. We are very glad that we joined the club.,2 years ago,,https://www.google.com/maps/contrib/110741698659102140629/reviews
Judy Goh,5,"Welcoming and enthusiastic fencing club. The coaches are very professional.

Coach WenYing gave my son an excellent introduction to fencing and made him appreciate the grace and the strength of the sport.
Coach Daniel is a driven, dedicated and passionate coach, making sure to focus on every detail and explains things in a way that every fencer can understand.
Also the kids favourite Coach YeKai, with him around always make the lessons with so much fun and laughters.

The ABF community is very friendly and closely knit, and have great camaraderie during trainings and have been an incredible club in every way. Would highly recommend for both experienced and beginner fencers alike.",2 years ago,,https://www.google.com/maps/contrib/110761965757448234958/reviews
Mi Chelle,5,"My child is an introvert who does not like outdoor sports, as such we decided to introduce fencing to her when we chanced upon ABF. We knew very little of this sport and alot of uncertainties and unfamiliarities set in when we decided to let her join ABF. We were impressed by Coach Ye Kai during the trial lesson because he guided my child with confidence and explained patiently throughout the trial lesson. We signed up with ABF after the trial. Since then, Coach Ye Kai has been very encouraging, my child becomes more confident and more interested in sports. We realised that fencing is not only about complex physical manoeuvre, it also requires mental discipline to perform properly and well. Taking this opportunity,  we would like to thank Coach Wenying and Coach Daniel too, for guiding our child during the Minime competition. She was extremely nervous on that day and made so many mistakes. We thought that she would be daunted by the competition. However, the coaches at ABF went through a post competition debrief session with her and it turned out to be an enriching experience with positive takeaways. Kudos to all ABF Coaches! Thank you for your passion in guiding the little kids to fence! You have made fencing into a safe and fun sport for the young ones to learn!! Many thanks 😊",2 years ago,,https://www.google.com/maps/contrib/111635384951032730744/reviews
Jeremy Ong,5,Coaches are dedicated and knowledgeable. They nurture talent and potential. Training space and facilities are new and plentiful.,a year ago,,https://www.google.com/maps/contrib/117309489803968533374/reviews
