author_name,rating,text,relative_time_description,reviewer_total_reviews,reviewer_profile_url
norasikin marican,4,Did you closed on Saturday?many people queue outside clinic but still no open yet,a month ago,,https://www.google.com/maps/contrib/110725559470822102340/reviews
Naimul Hasan,1,"They open the clinic 09:00am close at 10:00am ,are not their funny ?Its because of PCP /ST Andrew community hospital.",5 months ago,,https://www.google.com/maps/contrib/105204518473741326479/reviews
Suili Lee,1,"Although it says it opens at 8 o'clock, it's not actually open. I lined up early in the morning, but the door wasn't even open. I almost fainted at the door.",a week ago,,https://www.google.com/maps/contrib/106992916200529368137/reviews
BORN IN 1987,1,"Everytime only 1 doctor and cannot attend more than 15 patients
I sit dehydrated there I started Q up 5pm end up consulting doctor 8.50pm
Every time after long Q chase the patients away to another clinic

The given 1 star is charity because no option to give zero star",2 months ago,,https://www.google.com/maps/contrib/112183311706184731888/reviews
MrA,4,Brought my mum for ART and PCR tests. Everything was very orderly. The Indian doctor and his staff were very helpful and courteous despite their hectic schedule. The entire duration took 45 minutes but it’s understandable. I think this clinic deserves a thumbs up! 👍,3 years ago,,https://www.google.com/maps/contrib/112008289267740134602/reviews
