author_name,rating,text,relative_time_description,reviewer_total_reviews,reviewer_profile_url
Itz Ray,1,"Lol, i wanted to return a pair of shirt cuz when i bought it i didnt know it was torn and i haven't.even wear it, so the staff told me i will need to buy a new one instead of getting my refund back or give me a new pair!!! Terrible service i recommend not coming here.",9 months ago,,https://www.google.com/maps/contrib/100004357999737335546/reviews
Tom Jones,4,"I need some one from this store to contact me. I brought a pair of Adidas Sambas a couple yesterday, i tried them on and one is a UK size 10 and one is a UK size 9.5! I did not check in store but i need to return! Can somebody help me as i LOVE these sneakers and really want a matching pair :)",5 years ago,,https://www.google.com/maps/contrib/112904036774919719925/reviews
Henrik Frisk,4,Good service!,5 years ago,,https://www.google.com/maps/contrib/105070642020874631130/reviews
gurdeep singh,4,Great,7 years ago,,https://www.google.com/maps/contrib/110071375600348654900/reviews
moto0316,4,"I knew about that, the product lineup at this store and Japan was different, so I bought it without checking the price. Singapore Changi Airport, which takes 14 hours to transit, seems to have a different product lineup than Japan. I thought it would be luggage, but I ended up doing this without even looking at the price tag 😅",2 years ago,,https://www.google.com/maps/contrib/108455570094792228695/reviews
