author_name,rating,text,relative_time_description,reviewer_total_reviews,reviewer_profile_url
Justin Tan,5,"April 2025: I had just finished a 10 km hike and was craving for wantan noodles.  There were 15 people waiting ahead of me even though I came at 1115 hrs. When it was my turn, I ordered the char siew wantan noodle $5 and a bowl of dumpling soup for $5. I asked for 1 piece of chicken feet and paid an extra $1.50. Maybe I was polite, and the owners gave me an extra piece. The soup was delicious,  full of anchovy flavours.  The dumplings have pieces of prawns in them. The char siew was moist, but I wished that they could have been fattier. The wantans were delicious.  The noodles were springy but had a bicarbonate soda taste, which disappeared when mixed with the chilli sauce. This is certainly a favourite stall of mine, even though I don't like the food centre, a bit warm and small. It closes on Monday,  Thursday, and Friday. There's a bubble tea stall almost close to it, and the drinks were refreshing and cheap.",a month ago,,https://www.google.com/maps/contrib/115739474329491912284/reviews
Nick Koh,5,"Had Char Siew wanton noodles and 1 pax set meal (prawn mushroom hor fun, oyster sauce vegetables, dumplings). Paid via QR code",2 weeks ago,,https://www.google.com/maps/contrib/109956087041534450854/reviews
Shaolin Leong,4,"Good old fashioned Cantonese style hofan & noodles. Good wanton & dumplings! Braised chicken feet & mushrooms is nice too ! Soup is light & sweet. Home made charsiew is tasty and not fattening.
Always long queue. Reasonably priced. Most popular stall in the center. Closed on Monday.
Updated 23th Nov 2024
Tried their wanton hofun soup with chicken feet today !!!! Nice !!! 🥰😘👍😍
I prefer their soup rather than dry noodles and hofan .
They sell frozen dumplings and wanton too ! (Last pic.)
To avoid long queuing time come after 2pm.

15 April 2025 just came back from holiday really missed it ! Came at 1:30pm no queue quickly ordered a big bowl of horfun soup ! Nice !! Unfortunately no more chicken feet !",a month ago,,https://www.google.com/maps/contrib/116211953093285724040/reviews
James ZGQing,5,"Highly recommended by friends and I’m totally satisfied for my first try. Distinctive Cantonese flavour, generous servings and most importantly, hand made Wanton and Shrimp dumplings is heavenly made! Spoke to the owner and he is very courteous and pleasant. Can’t give full marks for atmosphere as it’s a typical hawker centre. Do note the limited opening days and timings if u wish to try! Will certainly return for more!",a year ago,,https://www.google.com/maps/contrib/118107462477704203742/reviews
Tee Yongnan,5,"I ordered their Char Siew and Wanton Noodle ($5) , accompanied by a serving of Dumpling Soup for an additional $5 which comes with 5 huge pieces .

The noodles, famed for their authentic Hong Kong-style preparation, boast a satisfying springiness and are generously coated in a harmonious blend of sauces. The char siew topping is expertly charred to perfection, with thick slices showcasing a gradient of dark to light hues.

Complementing the noodles are plump and succulent handmade dumplings, generously filled with a flavorful mixture of minced pork, shrimp, and black fungus. The thin dumpling skin provides a delightful contrast to the rich filling, resulting in an explosion of flavors with each bite. And let's not forget about the wantons—they're insanely good too, adding an extra layer of deliciousness to this already stellar dish.

This offering from Ah Wing's Wanton Mee is a definite must-try, delivering a perfect harmony of taste and texture.

---Pro Tip---
Queue: There's a queue formed before opening hour but it moves fast once it opens.

Payment: QR code payments and cash available.

Takeaway: Frozen wantons and dumplings are available for purchase.",a year ago,,https://www.google.com/maps/contrib/103655670304784447170/reviews
