author_name,rating,text,relative_time_description,reviewer_total_reviews,reviewer_profile_url
Thisen Rau,5,Best Mori in town at lorong 22 geylang for One Dollar only! Must try street food if you’re in Singapore!,2 years ago,,https://www.google.com/maps/contrib/105675727170698684832/reviews
Manikandan Periyasamy,5,Very Good Grocery Store at reasonable Prices.,a year ago,,https://www.google.com/maps/contrib/100291642698325548754/reviews
Bigfaheem playz,5,You can get mutton thare,3 years ago,,https://www.google.com/maps/contrib/105993423412906875020/reviews
Roman Hossain,5,Very good,2 years ago,,https://www.google.com/maps/contrib/104054000444413963060/reviews
Tony Lu,5,Friendly staff despite a rough look,5 years ago,,https://www.google.com/maps/contrib/112424921846400232486/reviews
