author_name,rating,text,relative_time_description,reviewer_total_reviews,reviewer_profile_url
varna arun,5,"Dr. Harvard Lin is truly an outstanding physician. From my very first visit, I was impressed by the way he took the time to explain my condition in detail, outlining all possible options with complete clarity. He patiently answered all my questions with full transparency, ensuring that I felt informed and confident in my decisions. His approach made a huge difference in my experience, and I deeply appreciate him.

Beyond Dr. Lin’s expertise, his staff is equally excellent—prompt, professional, and always making each visit smooth and pleasant. I highly recommend Dr. Lin to anyone looking for a doctor who genuinely cares and takes the time to provide the best possible care",a month ago,,https://www.google.com/maps/contrib/111377751081797953538/reviews
Zi Xiang Ong,5,"Many thanks to Dr Harvard for his professionalism and care for my wife’s recent surgery. I felt very at ease that my wife was under his care and I no need to worry so much. Also very appreciative of Hanah who picked up the call in the late night when my wife had to go the A&E due to her intense pain and she was attended shortly after.

Very glad that my wife is much better now and thanks to everyone in the clinic.",in the last week,,https://www.google.com/maps/contrib/109697404710168318183/reviews
Celeste Yap,5,"I would like to express my gratitude, appreciation and thanks to Dr Harvard and the clinic nurses Hanah and Kelly.

Dr Harvard was very kind, helpful and patient in explaining the issue that I was facing for the past 1 month and the procedure went smoothly. He listens to my problems and I am very glad the issue had resolved and am able to be back to my normal energy as before.

To Hanah & Kelly: Thanks for being patient and very responsive in answering my queries despite being busy with your other clinic patients and other administrative work. I'm also very thankful they you all were very understanding that I'm also very busy with my own work and helped me with the insurance process for my procedure.

Thanks alot!! 😍😍😍",a month ago,,https://www.google.com/maps/contrib/107065561655536597905/reviews
Marilyn Sim,5,"Many thanks and appreciation to Dr. Harvard and his team of nurses. Dr. Harvard is very patience in explaining every detail. After procedure, he will also be following up closely on my condition to ensure I can move forward to my next treatment. Also, thanks to Hanah for the prompt feedback. Although I have queries over the weekend, I can receive her reply within the day. She is also very supportive and providing comfort for me during this hard time. Thank you so much!",2 months ago,,https://www.google.com/maps/contrib/115884911138126623703/reviews
Carina Athwal,5,"Dr. Harvard Lin is the most fabulous doctor I have ever met! He is incredibly gentle, kind, and truly listens to his patients. From the very first consultation, he took the time to explain everything thoroughly and made sure I felt comfortable with all my options.

Throughout my treatment, he was extremely caring and attentive. He explained each step in detail, ensuring I understood what to expect. His level of care is exceptional—he consistently checks in on his patients and is always available to address any concerns.

Not only is Dr. Lin an exceptional doctor, but his staff are also so sweet and kind. They are always warm, welcoming, and go the extra mile to make patients feel at ease.

I am beyond grateful for Dr. Lin’s professionalism, patience, and genuine concern for his patients. If you are looking for a doctor who truly goes above and beyond, I highly recommend Dr. Harvard Lin and his amazing team!",3 months ago,,https://www.google.com/maps/contrib/109411684333052990820/reviews
