author_name,rating,text,relative_time_description,reviewer_total_reviews,reviewer_profile_url
Juliet Raj,5,"This place is known for big events before Covid strike..And it was closed (for good) for almost 3yrs i guess..Now, the new management has taken over and the Clubhouse has reopened it’s door to all. Great…and mind you there’s LIVE BAND on weekend😉",2 years ago,,https://www.google.com/maps/contrib/110805010733537948080/reviews
Andrew Tan,4,"Went there for lunch on a weekend. Apparently the cafe is closed on the weekdays.. Operates only from Fri to Sun. Food is pretty good and the price is reasonable. Its a nice place to gather for the folks staying in Leisure Farm. For outsiders, it might be difficult to get in as it gated and guarded.",3 years ago,,https://www.google.com/maps/contrib/106045881259095839533/reviews
Leonard Teo,4,"Great facilities such as the field (where we play softball on Sundays), pool. The restaurant has a cosy atmosphere but changes hands very frequently.",2 years ago,,https://www.google.com/maps/contrib/108378507127098537837/reviews
Darshenth The beast,5,The service there is super great the food is soooo dam good credits to the head chef for the great spectacular food and its great to hang out by the pool side and if u want to celebrate any birthday u can do it here.,2 years ago,,https://www.google.com/maps/contrib/110180900990877322972/reviews
Von bryan Bejemino,5,Nice place to hang out.,3 years ago,,https://www.google.com/maps/contrib/104087510771032851112/reviews
