author_name,rating,text,relative_time_description,reviewer_total_reviews,reviewer_profile_url
Ryuhei Ikeda,5,Junko san is super nice!,a year ago,,https://www.google.com/maps/contrib/103446583635924921415/reviews
Ken Yasui,5,My favorite bar in Singapore.,2 years ago,,https://www.google.com/maps/contrib/112797008485041588196/reviews
新野禅,5,Good bar,6 years ago,,https://www.google.com/maps/contrib/108360067384112228809/reviews
K H,4,The atmosphere is very calm and you can spend a relaxing time here. I want to go again.,3 years ago,,https://www.google.com/maps/contrib/110963557332569053893/reviews
Eng-Kian Koh,5,,2 years ago,,https://www.google.com/maps/contrib/111929465845723592530/reviews
