author_name,rating,text,relative_time_description,reviewer_total_reviews,reviewer_profile_url
M L,5,"Among all the outlets, I prefer the one at the airport at T3. The staff, Cin Pin, is very polite, helpful and efficient. The dessert served is well balanced, especially the cookie butter where the portion is just right. My children and I visit this outlet almost every other week!",a year ago,,https://www.google.com/maps/contrib/103968549533723654891/reviews
Taylor,1,This place may or may not be great but one thing I can say is that it is NOT where google says it should be. After going round and round in circles I eventually had to give it up for a lost cause because it was nowhere in sight.,a year ago,,https://www.google.com/maps/contrib/108141643277664008672/reviews
michelle ng,5,best outlet !! will come back :) pls give them business 😭😭,a year ago,,https://www.google.com/maps/contrib/116345867679479194428/reviews
Dickson Tan,1,"wasted trip, please update your operating hours!",a year ago,,https://www.google.com/maps/contrib/101700751510735023721/reviews
kong my,5,The food is delicious. The lady is very polite and patiently explains the products. Highly recommended!,a year ago,,https://www.google.com/maps/contrib/103540996653446921828/reviews
