author_name,rating,text,relative_time_description,reviewer_total_reviews,reviewer_profile_url
Preeti Jhans,5,"BITC is good collage where I learnt numerous things regarding study. As we know it's baking collage so I attended pastry baking and culinary skills classes and learnt about cooking and so on.

Here I met such a smart and hardworking teachers like Hans sir, Sulo ma'am and learnt multifarious things and gain alots of knowledge.

Additionally, in BITC I did so many activities and enjoyed .",11 months ago,,https://www.google.com/maps/contrib/105978781495068467468/reviews
Tracy Wang,1,"SUPER LOUSY SCHOOL WITH LAZY IRRESPONSIBLE STAFF
FIRSTLY, NOBODY TOLD ME THE COURSE DETAILS OR CONTACTED ME OR GIVE ME ADDRESS AFTER I SIGNED UP AND PAID. Then blamed me on first lesson for not wearing covered shoes.

Then on 3rd lesson right now, I am so enraged writing this review halfway through my Advanced Peranakan ASSESSMENT DAY on 7 Jan 2024 at 3.15pm. HOW CAN SIMPLE THINGS LIKE SESAME OIL BE OUT OF STOCK WHEN IT IS REQUIRED ON MY ASSESSMENT DAY? I have to storm to office to scold people and everyone is so laid back. How can ingredients be used up and not be stocked at all? Super NOT WELL EQUIPPED, dirty, no system and the class can even be like 1-2 students. Shows how bad their planning is! WORST SCHOOL I EVER I HAVE EVER ATTENDED COMPARED TO ABC BAKING STUDIO AND BELLS!",a year ago,,https://www.google.com/maps/contrib/108672976274036682540/reviews
sweswe maung,5,"BITC International College is located near MRT and Bus station. Addition, our teacher “Ms Sulo is very fair and wonderful teacher. I,m happy to see you all friends.",11 months ago,,https://www.google.com/maps/contrib/100205457562581623004/reviews
Divyesh Mangukiya,5,"Such a smart teacher Sulochana near the train stetion fun classmates with lots of happiness
Aircon
Fees is reasonable
Alot of activities
Free food at the temple near by
Walking distance to bus stop and train stetion.
Hawker food at reasonable price.
Happy to be in bitc college.",11 months ago,,https://www.google.com/maps/contrib/101503429781110410680/reviews
Jainil Prajapati,5,"Ms,Sulochana is my teacher.
Good teaching.
College provide support.
Near train station
Friends good
Amazing experience",9 months ago,,https://www.google.com/maps/contrib/103342105998321588800/reviews
