author_name,rating,text,relative_time_description,reviewer_total_reviews,reviewer_profile_url
Cloudi Jay,1,"I waited for over an hour for my pre-ordered medication, which is both unreasonable and unacceptable. While you ask for our respect, it is equally important to respect our time. The situation is concerning, as my attempts to contact via phone went unanswered. Despite empty counters, numerous patients are left waiting, which raises serious concerns.",a year ago,,https://www.google.com/maps/contrib/113601107366475734138/reviews
Lit C Seow,1,"Insanely long queue on a Tues afternoon at 3pm. Long q at registration counter and medicine collection. I thot ttsh is worse, i think sgh is worse in this case.",2 weeks ago,,https://www.google.com/maps/contrib/109854756551899116367/reviews
Ml Chiang,2,"There are many countet staff not doing anything for 5 minutes or more. Not dispensing medicine, while the crowd of patients grows. What are the counter staff waiting for? Is the back end packing of meds too slow. SGH needs to review its system to make the pharmacy more efficient. I've waited 30 mins already.",10 months ago,,https://www.google.com/maps/contrib/107343935217242110807/reviews
M,1,"Generally staffs are nice and efficient but I got a wrong person's queue number when I registered. And I only realized it when try to collect, then they started to prepare my medicine. In the end I waited for 70min. Please train all staffs to check patient's name and IC.",2 years ago,,https://www.google.com/maps/contrib/108690669939130884731/reviews
Fab C,4,"Long wait, but has good supply if medicines and fills outside prescriptions too.",5 years ago,,https://www.google.com/maps/contrib/107660703838315074541/reviews
