author_name,rating,text,relative_time_description,reviewer_total_reviews,reviewer_profile_url
Nurul Nadiah,5,Its a newly renovated canteen with 2 muslim stall selling variety of food and my favourite is nasi tomato. But they do sell nasi ayam and nasi ayam penyet as well. Do support them when you have the chance!!,a month ago,,https://www.google.com/maps/contrib/104811259450086876055/reviews
Fml Prince,5,"The nasi ayam penyet stall is the best, it is so nice that when others wants to order it is sold out. The cleanliness is tip top. And they are nice,sincere and funny. Do support, AYAM PENYET STALL☺️🙏🏼.

The dishes
Nasi ayam, nasi tomato ,nasi sambal goreng. Sometimes there are mini breakfast prepared like currypuff and etc.",a month ago,,https://www.google.com/maps/contrib/113564634855456470946/reviews
Rosita Sarmadi,5,"This canteen has changed owner last year and now sells Halal and Non-Halal food.

I love to eat their mee siam with telur mata lembu 😍.  You can also get fried rice, mee rebus and soto etc.  They have some kueh-kueh for breakfast too.

The next stall is nasi padang and I usually get the acar timun, beef rendang and kentang goreng 🥰. They also sell nasi lemak daily and nasi briyani on Fridays.",a month ago,,https://www.google.com/maps/contrib/115891943949522853133/reviews
Reila Ayami,5,"Clean and aircon canteen. There are Malay Nasi Padang, and every Friday there will be Nasi Bryani.

Another malay stall have nasi ayam, nasi ayam penyet and on Friday, Nasi Sambal Goreng - either chicken or Paru. They do have mee rebus, mee soto, soto ayam, mee siam and kuih-kuih.

Then have Chinese chicken rice stall. The queue always long especially the soup. Don't take my words, you need to come and try it out.

And drink stalls too with friendly owner.",a month ago,,https://www.google.com/maps/contrib/101645460158571513612/reviews
Sha 15,5,"Everything about the nasi padang is nice , the details of the nasi padang is perfectly done . It tasted nice & never regret eating the nasi pandang , highly recommended.",a month ago,,https://www.google.com/maps/contrib/100725854613485139230/reviews
