author_name,rating,text,relative_time_description,reviewer_total_reviews,reviewer_profile_url
clement NG,3,"Run down, poorly maintained. Not recommended",3 months ago,,https://www.google.com/maps/contrib/110776515446331200965/reviews
Hossain Md Amir,5,Very clean and cheap price,4 months ago,,https://www.google.com/maps/contrib/107832915471616970174/reviews
ruzaini rohaizat,5,Peaceful neighbourhood with beautiful views of the city. Conveniently located near shopping malls in Novena & Balestier. 7 mins drive from Orchard Road.,7 years ago,,https://www.google.com/maps/contrib/113888144553438578866/reviews
Badarau Oana Paula,5,Cozy place to sit and do some work. Great variety of drinks and the staff is lovely.,6 years ago,,https://www.google.com/maps/contrib/116293538893603496670/reviews
Aohan Li,5,My wife lives there.,7 years ago,,https://www.google.com/maps/contrib/104988256347661537863/reviews
