author_name,rating,text,relative_time_description,reviewer_total_reviews,reviewer_profile_url
Johnny Phua,4,"Place wise not bad, so far Malay, Indian, this Chinese and another roasted chicken rice stall are good. Long Q if you are after 1130am but still plenty of seats. Down side is not much parking lots.",7 months ago,,https://www.google.com/maps/contrib/102638783176408540768/reviews
Satish Murti,1,"The drinks shop owner is super rude. I don't understand how can she scold customers when asked to repeat the price of drinks. The tables are dirty. There's only one cleaner and the tables are rarely wiped clean. Thank god for the good food, especially the chicken rice and the Indian stall. Best option would be to tapau and go.",2 months ago,,https://www.google.com/maps/contrib/109570647344939363960/reviews
AR Lin,2,Xing Xing mixed curry rice very expensive. 3 ingredients charge $5. Won’t buy from this store again.,3 months ago,,https://www.google.com/maps/contrib/106685472774916276817/reviews
Zamzani Juhair,5,"Had my pack lunch from Authentic Nasi Padang, Lots of dishes to choose from. Nice and it's value for money",9 months ago,,https://www.google.com/maps/contrib/100258220502618911246/reviews
Marc Wong,5,"Revisited this place after 15yrs. New Malay stall, nasi lemak was good. Xingxing chap chai rice good as well. Used to buy from them everyday veggie etc to bring home to feed my boys. The boss and his sisters have always been very kind.",5 months ago,,https://www.google.com/maps/contrib/107851285003539324024/reviews
