author_name,rating,text,relative_time_description,reviewer_total_reviews,reviewer_profile_url
S F,1,Overcrowded bus stop especially peak hours in the evening. Thanks to the new residential Clementi North Arc along Clementi Ave 6. We don’t need 8-10millions population. Six million is already suffocating.,2 months ago,,https://www.google.com/maps/contrib/104470256631229083623/reviews
P P,2,"Super crowded venue, LTA need to relook the infrastructure again, is different level of crowd compare to 5 years ago! A lot of buses can be choked in the rear during peak hours during evening!",a month ago,,https://www.google.com/maps/contrib/114287699144482695290/reviews
Chris Walton,1,Do not use google maps for the bus here. Will reroute you to other nearby stations in a horribly inefficient manner. Bus stop itself is fine.,10 months ago,,https://www.google.com/maps/contrib/103990521887627370069/reviews
K a l 1 S S,2,"Review: January 2022
Bus stop should be properly named as its at the Clementi Mall side
LTA poor performance in the naming of the bus stop & that confusion is only ascertain by walking all the way to this signage.",3 years ago,,https://www.google.com/maps/contrib/100679182423591505301/reviews
zxcvbnm,4,crowded but convenient,3 years ago,,https://www.google.com/maps/contrib/108343415434756553709/reviews
