author_name,rating,text,relative_time_description,reviewer_total_reviews,reviewer_profile_url
Dean Loh,5,"For the information of those who are not from Singapore, our coffee shops usually have multiple food stalls, each managed by different individuals. My review is based on my overall experience, although I will still highlight some stalls that I particularly enjoy.

The coffee shop has recently undergone renovations. I am unsure if there has been a change in ownership, but the service has definitely improved. For instance, even though it is a self-service establishment, the staff at the coffee stall still make the effort to go around and take orders for the convenience of customers. The prices of their drinks are also very reasonable. My son especially loves their ""Frappuccino-style"" Ice Milo.

In terms of food, my personal favorites are the mixed rice stall (or what Singaporeans call it ""cai fan stall"") and the curry noodle stall.

The zhir char (cooked-to-order) and prawn noodle stalls are also worth trying. As for the other stalls, I believe it depends on individual preferences. After all, one person's favorite may not be another person's cup of tea.

Overall, this coffee shop is a great option for breakfast, lunch, and dinner.",5 months ago,,https://www.google.com/maps/contrib/101526612593517384616/reviews
Alvin Lim,4,"Update 27 Dec 2024

Tried caifan-not too bad tasting

Tried wanton mee-portions are generous and edible

The prawn noodles soup put up a signage to inform that they are closed for 1 month!

Update 13 Dec  2024

This is the new name of the former Kopi Tarik, under new management and with new tenants (save for the zichar Hongkong Street Cheng Zi which is still there).

Some new  stalls look interesting (especially the porky prawn noodles) but yet to try.

Previous:

Renovated hdb kopi tiam under new name and new  management  with new stalls (about 11 or so)  save for the same old Hong Kong Street Cheng Ji Zi Char stall serving up their signature delicious  fish soup and bee hoon as well as dishes like prawn paste chicken and curry fish head.

Have also tried the new cai fan stall (they have value meals of 2veg 1 meat for $2.80 but only if u pick designated dishes) which is rather decent considering the price.

Also tried the guo tie (fried dumplings) which is fairly decent as well.

The Indian rojak stall is quite good as the fried items taste ""fresh"" and the rojak gravy is quite nice.

Overall, nice makeover and the place is clean and bright and as always, bustling with many beer drinkers in the evening.",4 months ago,,https://www.google.com/maps/contrib/106394450808200270399/reviews
Cindy Ho,5,"There is a new wanton noodles stall. Noodles is springy and it taste really good. Wanton is not small, packed with meat filling and tastes nice and fresh. The portion I shown is $4 and it is not too small, just nice. It is better than other franchise wanton mee stalls whose portion is pathetic and wanton as just a smear of meat filling. Do try out this stall and support the lovely ladies.

There is also an Indian food stall that serves really good prata, dosa and briyani. Prata is crispy and soft, not chewy. Do try out the stall if you are nearby.",6 months ago,,https://www.google.com/maps/contrib/111285134472906893604/reviews
Alvin Li,4,"Zui Xiang Wanton Mee

There was a major renewal of tenants some time between end October and early November 2024.

Current stalls include: economical rice, pop piah, drink stall, seafood BBQ, Ipoh Curry Mee (moved to 155 Bukit Batok Street 11), BB Corner, wanton mee, soup, prawn noodles, zi char, Muslim food. Fishball noodles is coming in January 2025.

There is a new initiative for elderly in the neighbourhood that started on 20 December. Order a cup of kopi/teh o kosong for 70¢.

This is currently my favourite wanton mee in the neighbourhood now. The stall is manned by two petite ladies who work hard to churn out delicious bowls of wanton mee. Add on some fermented fried pork or a side of fried dumplings and wanton to zhng your meal.",5 months ago,,https://www.google.com/maps/contrib/101636040394390892825/reviews
BCW MOTORRAD,5,Had Fish head bee Hoon @ HK street Cheng Ji. Delicious and ample fish meat @ $7 a bowl. Worth coming back next time,4 months ago,,https://www.google.com/maps/contrib/117651874255575944558/reviews
