author_name,rating,text,relative_time_description,reviewer_total_reviews,reviewer_profile_url
Chong KV,3,"Star rated doesn't mean anything here, but this hospital was well kept and security was strict. Clean and quite place.",3 years ago,,https://www.google.com/maps/contrib/114047288472149349381/reviews
Wai Hong Tang,1,I respect security but this person I encountered is another level at CDC security post.,3 months ago,,https://www.google.com/maps/contrib/106110549992837814728/reviews
JoJo Anne,4,"This is a Palliative Ward of Tan Tock Seng Hospital. Patients in this ward receive the best care till their end days. My mother was transferred to Ward 83 till her final days 18.07.2019 where she passed away peacefully at 7.30pm. Thank you and appreciate the attending doctors Dr. Ang, Dr. Lim and Dr. Koh and nurses who have been there taking care of mom and also not to mention the staffers of Tan Tock Seng Hospital.",5 years ago,,https://www.google.com/maps/contrib/104844553047016135430/reviews
Andrew,4,"Great palliative care amenities for patients. Lots of greenery surrounding the premises. However, I think a more suitable name change for this hosptial wing should be made.",4 years ago,,https://www.google.com/maps/contrib/109380856098782856951/reviews
Daryl T,5,Used mainly as a palliative and recovery site for patients. The building name is misleading and patients with diseases are not located here unless there are widespread outbreaks.,4 years ago,,https://www.google.com/maps/contrib/114900308871505526439/reviews
