author_name,rating,text,relative_time_description,reviewer_total_reviews,reviewer_profile_url
Suzane Ca,5,"Jessie provided excellent service even during a busy time. She was friendly, attentive, and handled everything with professionalism and a smile. Truly appreciated her effort! 👍🏻 will be back again ☺️",2 weeks ago,,https://www.google.com/maps/contrib/105587649844101109486/reviews
Phobe N.,5,"First time trying the outlet as there’s a promotion going on. Get a free Margarita pizza with any purchase of a pizza. (Every Monday)
It’s really very worth as the size and taste is really very good. Would patronise again if there’s a chance.",3 weeks ago,,https://www.google.com/maps/contrib/101218056141206229292/reviews
Cheok Olivia,5,"Chill and relaxed place to have brunch and chat with friends. Yummy food. Eg. Basil pesto focaccia, croissants. Lots of hot drink options (coffee, tea, non-caffienated). Friendly service. You can order and pay using the QR code on the table.",4 months ago,,https://www.google.com/maps/contrib/102626143264279184348/reviews
shi ying,5,"I would like to extend my heartfelt appreciation to Dave, Jessie, and Helmy for making my experience at Gastronomania truly exceptional. From the moment I arrived, they welcomed my friends and me with such warmth and genuine hospitality, instantly setting a positive tone for our visit. Throughout our time here, they were incredibly attentive, consistently checking in on us to ensure that everything was perfect, from the food to the overall dining experience.

Not only did they provide outstanding customer service, but they also took the time to suggest a variety of fantastic menu recommendations, which we thoroughly enjoyed. Their deep knowledge of the menu and their passion for delivering an unforgettable experience really stood out. Every interaction with them felt sincere and thoughtful, making us feel truly valued as guests.

On top of the amazing service, the food at Gastronomania was absolutely delicious, and the atmosphere was welcoming and lively. Thanks to Dave, Jessie, and Helmy, my visit was nothing short of delightful, and I am already looking forward to coming back again. Thank you for making my time here so memorable!",3 weeks ago,,https://www.google.com/maps/contrib/103671600951242592852/reviews
Devy Pribadi,4,"Came here for coffee break, weekdays not so many people as weekend, managed to get a table. Ordered regular Hot Skinny Cappuccinno and Raisin Cinnamon Bread. Coffee was okay, but seems they have changed to the smaller cup now for the regular size. Bread was okay and got reheated too, served with butter and jam.
On the other day I came and ordered their Cranberry Cornflakes Scone and Hot Skinny Cappuccino. But this time the scone served was not warm, I would say it was still cold even though I’ve asked it to be reheated. It didn’t taste as good, because it’s cold.
Environment and service is okay. They provided plain water too.",a year ago,,https://www.google.com/maps/contrib/101827903087596800354/reviews
