author_name,rating,text,relative_time_description,reviewer_total_reviews,reviewer_profile_url
Yee Yieng,5,"LOVED THIS SO MUCH! I could taste how each ingredient was made with care, and everything just tasted so good. I ordered the lasagna and pappardelle di spadino—superb! 😍 I will definitely revisit to try other pastas and desserts!

The restaurant owners personally came by to check if everything was okay, which felt so warm and welcoming! Also, the restaurant is incredibly clean, and they are very particular about hygiene and cleanliness!",2 months ago,,https://www.google.com/maps/contrib/104727597473372656990/reviews
Eski Teague,5,"Quaint and not too flashy, just the way I like it. We ordered the Christmas special chicken, lasagne and calamari.

My goodness, to start, I was thoroughly impressed and FLOORED by the lasagne. It was DELICIOUS and one of the best lasagnes I have ever had. The calamari was fresh and the accompanying sauce was a great coalescence of flavor.

I would highly recommend trying the lasagne and the calamari!",5 months ago,,https://www.google.com/maps/contrib/112902925656014827173/reviews
Anonymous WSushi4413,5,"This place is amazing! I went there on my birthday . For starters, the menu is very simple.10/10 for service . The lady was very welcoming and patient. We even received a complimentary dish! It was delicious. Next, 10/10 for food. The portions is worth it for the price and the taste is really good . Would recommend the seafood risotto. Lastly, 10/10 atmosphere , it  was really cozy and there were paintings painted on the wall of the views you would see in Italy.Pretty and cute decorations too! The chef is the mother and she was really pretty and friendly. She came out to talk to the customers. We were given a cake which was a special Italy cake, should be on the menu. Overall would definitely recommend and I will definitely be coming again from Singapore.",10 months ago,,https://www.google.com/maps/contrib/116067676733748570726/reviews
Shane Wang,5,"We had an exceptional dining experience at this charming Italian restaurant. The food was outstanding, with the pasta and main course standing out as particular highlights. The staff added to our delightful evening with their warm hospitality and friendliness, making us feel right at home. Highly recommended for anyone looking to enjoy Italian cuisine in a welcoming atmosphere!",9 months ago,,https://www.google.com/maps/contrib/109731227066204220826/reviews
Boon Leong,5,"Made a reservation on WhatsApp for a table on Friday night.
It was a farewell meal 🥘 & I think we are a little boisterous playing some game.
There are other customers having meals & the staffs are kind to accommodate us.
We got a complimentary appetizer 👍
As for the food 🥘, feedback from colleagues it was sumptuous.
Plates are cleaned up 😁",5 months ago,,https://www.google.com/maps/contrib/118439101019407877742/reviews
