author_name,rating,text,relative_time_description,reviewer_total_reviews,reviewer_profile_url
Rick Tan,5,"Had my first appointment at the clinic today with my dentist (Dr. Tan) from the previous clinic. The service provided here was definitely much better than the previous clinic that I had visited. Friendly front desk staff and Dental Assistant. They even have a television for patients to indulge in Netflix during the dental treatment process, making it not only a less stressful environment, but also a pleasant one.

Will be back for my follow up appointments.

Update:
I came back again, this time round for my wisdom tooth extraction. I remember feeling extremely nervous and my legs were shaking tremendously even before I stepped into the clinic. But Dr Tan and her assistant were gentle, patient, and reassuring throughout the whole procedure, helping me to feel more comfortable with dental visits. Even after the procedure, the swelling and pain were not that bad. They can be well managed with the painkillers provided.

Just 3 days after my tooth removal, I was able to return the gym and mats for my training.

Huge thank you and Kudos to the team! 💯🙏",4 months ago,,https://www.google.com/maps/contrib/114551867167480133467/reviews
Diana Lai,5,Dr Ray Tang is an excellent dentist. He took the time to explain every procedure he was doing. His charges are very reasonable given his extensive experiences of 20 years. I would recommend Dr Ray to everyone. He is the best dentist I have ever had.,a year ago,,https://www.google.com/maps/contrib/108206585799933229972/reviews
Belle.Beauty_,5,"I started my braces journey with Dr Ray Tang, I am grateful to have him as my dentist. He made the process as painless for me as possible. Thank you Dr Ray🙂🙂🙂",8 months ago,,https://www.google.com/maps/contrib/103594920815928928525/reviews
Ethan Tang,5,Dr Tang is a fantastic dentist. Does so much more than take care of my family’s teeth. Does a full cost breakdown before undergoing treatment as well as offering the most cost effective treatment. Am extremely grateful to him for his service !,a year ago,,https://www.google.com/maps/contrib/100611331867162170977/reviews
Magdalene Chia,5,"I had a really bad toothache and had been seeking various consultations from different dentists, and it just felt like there wasn’t a “solution” until I came across a referral to Dr Ray Tang. Having had bad experiences from 2 diff wisdom tooth extractions with different dental clinics(and never going back there) I’m grateful to have came across Dental Werks, Dr Ray Tang.

I extracted a total of 3 teeth with him in one day, 1 surgical for a impacted molar and 2 normal extraction - and it only took an hour(for all 3) compared to other dental clinics that usually take about an hour per tooth(base on my past experience)

He will also ask questions in-between the extraction - if any pain is felt and will preempt you of what you would possibly feel during the extraction process.
His costs are reasonable for the experience and care you’d get. Definitely in line with Dental Werks mission/vision aims of making quality dental care available to the masses at affordable rates.

Post extraction care: He had predicted(& managed my expectations) I may have some problems healing (as I didn’t bleed enough for my suture to close up properly) and was ready to help affix the problem 3 days post surgery.

Definitely my choice of dentist that I trust and will go back to - and although I live quite a distance away from his clinic, I will travel for his amazing expertise.

Thank you Dental Werks and Doctor Ray Tang for the amazing dental work.",3 years ago,,https://www.google.com/maps/contrib/105548099947660489455/reviews
