author_name,rating,text,relative_time_description,reviewer_total_reviews,reviewer_profile_url
Michael Titheridge,4,Decent coffee for Singapore. Had to throw in an extra shot into a small latte to get the coffee feels,6 years ago,,https://www.google.com/maps/contrib/113058724510110514241/reviews
Dinyar Ghyara,5,"Nice cozy little coffee shop for a quick chat or a business meeting. It's getting more popular now at certain times, so can be a bit noisy. The coffee is good and they have good food options. Generally easy to get a seat. It's tucked away at the back of the building.",7 years ago,,https://www.google.com/maps/contrib/111237300519444918304/reviews
Moosan Kittiwat,4,"I often have Iced latte there. Nice coffee and good service.
However, just realized from my colleague that they have loyalty card to collect stamp. Once you get the certain stamps, you will get a free coffee. However, My colleague had to ask them for that card. Otherwise, she would never get it. So would I!!",5 years ago,,https://www.google.com/maps/contrib/106419693256753277314/reviews
Steven Pike,3,"Busy coffee shop at bottom of Keppel Tower selling Australian grown coffee. I missed the lunch time rush but was still busy and it did look somewhat under staffed with only 2 employees working. Was limited food left when I arrived as all had been sold out. I did have the banana and walnut muffin which was heated in the microwave to the point of almost melting… if in the building again, I would probably just have a coffee.",2 years ago,,https://www.google.com/maps/contrib/110081426531414951449/reviews
Clement Andre,5,Nice place Abit on tbe expensive side. The girls behind the counter are all Filipinos who serve the majority of the white trash with more happiness than locals. Food wise the  chicken mayo is nice. But overall ex.,7 years ago,,https://www.google.com/maps/contrib/109579920245119037894/reviews
