author_name,rating,text,relative_time_description,reviewer_total_reviews,reviewer_profile_url
Tim Goh,1,I reach this clinic at 7pm the women register me and I’m first time here she put me in the queue my number is 19 then she ask me to go n eat or drink outside the coffee shop after 35 minutes I return to the clinic and she told me that doctor cannot see cause already full this kind of clinic can treat patient like choosing vegetables,4 months ago,,https://www.google.com/maps/contrib/102935056963883597965/reviews
Lim Choonnguan,1,"If you have a cough or fever, the doctor doesn't want to see you. If that is the case, then should put up a notice board to remind the public. And better not open the clinic.",a year ago,,https://www.google.com/maps/contrib/116944994231531991934/reviews
Chester lin,1,"Doc is always not around. was chased out by the auntie and ask me to go other clinic instead. Maybe better time to visit is around afternoon 1 pm. If doc is not around, pls don’t open the clinic. What’s the point of opening the clinic then.",2 years ago,,https://www.google.com/maps/contrib/110496788524087542120/reviews
Iris Sng,5,Dr Soh is a very good doctor. Ethical and professional.,6 months ago,,https://www.google.com/maps/contrib/112646025782854698294/reviews
Thomas John,1,Don't give mc to students. Give a lot of excuse. Suppose to open at 11am but comes strolling in at 1130am. Like to tolak cases and didnt even bother checking me,7 years ago,,https://www.google.com/maps/contrib/103819538050906415352/reviews
