author_name,rating,text,relative_time_description,reviewer_total_reviews,reviewer_profile_url
JAY RULZ,4,"It is a porsh area but not everything are pricey there. You still can find affordable shops and reasonable pricing stores too.
The whole area is built in a European concept",2 weeks ago,,https://www.google.com/maps/contrib/103520824626997280051/reviews
Andy Lee,4,Not really central but enough food and shop options. Banquet party too. But I still prefer the f&b options along the street.,2 months ago,,https://www.google.com/maps/contrib/113937067165127510810/reviews
Pom Pomnid,5,"New and beautiful layout mall, however upscale restaurant and retail merchandise would be much appreciated. Upper floors are still much available.",11 months ago,,https://www.google.com/maps/contrib/118297179225570304062/reviews
S L,5,"Nice place to eat, shop and stay. Ate at  Toast House Cafe. The lady boss is so polite and sweet. She recommended their speciality and waited patiently for us to order. She also acceded to our special request of less salt and oil. Will visit again soon.",2 months ago,,https://www.google.com/maps/contrib/101832595569327415745/reviews
David Kang,4,"The area is a good place for food, bars, services and some education centres.

Really busy during peak hours and weekends. Hence, parking can be challenging but most people don't they can park in the Eco Galleria area.",2 years ago,,https://www.google.com/maps/contrib/101491048347910863905/reviews
