author_name,rating,text,relative_time_description,reviewer_total_reviews,reviewer_profile_url
Sherry Faezah,5,"“Emzee Football Club is an exceptional organization that truly embodies the spirit of the game. From their dedicated coaches to their passionate players, every aspect of the club exudes professionalism and a commitment to excellence. Whether you’re a seasoned player or just starting out, Emzee FC provides a welcoming environment for everyone to enjoy the beautiful game. I highly recommend this club to anyone looking for top-notch coaching, a supportive community, and unforgettable experiences on the field.”",7 months ago,,https://www.google.com/maps/contrib/116935787469414047229/reviews
Rahmani Rome,1,I’m a soccer player playing in Pakistan I want to join your football club in Malaysia,a week ago,,https://www.google.com/maps/contrib/115033141525645377265/reviews
Ida,4,"The Coach is a dedicated and passionate person. He is personable & approachable with his players. He motivates the players about positive attitude, always give the best efforts and team work.
Work hard Play hard EmzeeFC 💪",2 years ago,,https://www.google.com/maps/contrib/105578176698876729186/reviews
Marilyn Benjamin,5,Emzee FC is  brilliant for young people to develop their love and passion for football.  They also develop good team and leadership skills which helps them in life,4 years ago,,https://www.google.com/maps/contrib/116080067931926815154/reviews
Mufidah MB,5,Good team spirit. A great and very dedicated coach. Youths are in good hands under the club.,2 years ago,,https://www.google.com/maps/contrib/113915018687714567209/reviews
