author_name,rating,text,relative_time_description,reviewer_total_reviews,reviewer_profile_url
Ekim Mike,5,"I recently had the pleasure of staying at Equarius Villa, and it was an exceptional experience from start to finish. The villa was beautifully designed, offering a perfect blend of luxury and comfort. The private setting provided a serene and relaxing atmosphere, making it an ideal escape from the hustle and bustle of daily life.

The butler service was outstanding—every staff member was attentive, friendly, and went above and beyond to ensure our stay was memorable. The amenities were top-notch, with a spacious and well-appointed room, a stunning private jacuzzi pool, that truly enhanced the experience.

The location was fantastic especially for honeymooners, offering both privacy and tranquility. Please expect a distance walk from the reception and other vicinities. However the villa offers private buggy to bring you to these places.

I recommend Equarius Villa to anyone looking for a luxurious and peaceful retreat. Of course all these come with a big price tag 😉",2 months ago,,https://www.google.com/maps/contrib/109570058113780516477/reviews
samiah23,1,"I stayed 3 nights at Equarius Villas in the aquarium suites where I had a view of the wildlife in the aquarium in the townhouses that included butler service. Everything was fine until the butlers stole my jewelry!! I realized I had left them in my room upon checkout, but was already at the airport. I asked if it was possible if they could mail them home to me. I had arranged a mail courier service, as per the butler's request that I had to pay for, to arrange pick up of my jewelry. I tried to organize pick up with them, but they stopped taking my phone calls and stopped answering my emails. The butlers involved were Monica (Suklaing H.) and Jason (Liu Yidu). On top of that, I was never refunded my deposit!! Be careful of your belongings and check your credit card!!!",a week ago,,https://www.google.com/maps/contrib/109890691401726223385/reviews
Ariel Wei,5,"Highly recommend this villa. Second time visiting it, as service is impeccable. Nice Room, prompt and good service. Especially out butler and person riding the buggy, so welcoming and friendly. Will definitely visit again!",6 months ago,,https://www.google.com/maps/contrib/113903605391918209145/reviews
Vike Esmeralda,5,"The price you pay is expensive but it's WORTH EVERY PENNY! Excellent service from the team (Front desk, Concierge, Housekeeping, Butler service, Maintenance team).
LOVED the view and we feared for mosquitoes at night but we encountered NONE!
The beddings are comfortable and we definitely experienced the baby sleep.
Thanks to the cheerful team always readily available to assist!",9 months ago,,https://www.google.com/maps/contrib/109486564284780888478/reviews
Achel T,5,"We have an enjoyable celebration and stay in the villa. The room is lovely and luxurious. Feel so relax watching the fishes. The service staffs are welcoming and helpful, they show us around the villas and explain how to use the control. They go extra miles to decorate the room with balloons since is a birthday celebration. The club car drove us to the shopping mall and pick us up upon giving them a call. Excellent service standard! Really worth staying.",a year ago,,https://www.google.com/maps/contrib/103221294580508539488/reviews
