author_name,rating,text,relative_time_description,reviewer_total_reviews,reviewer_profile_url
Hou M,5,"Nice location and near to Holland Road MRT with a bus stop in front! Holland Village is walking distance. Also, because of low density it is private and quiet. It has a small pool and gym too.",2 years ago,,https://www.google.com/maps/contrib/117294046738506769280/reviews
Saan Choy,5,"Convenient location with Bus outside, MRT walking distance. Botanic Gardens, wet market, amenities nearby. Small cozy development with no noisy kids because it does not have a playground.",7 years ago,,https://www.google.com/maps/contrib/115809574088017942800/reviews
iussoe,5,Good location..nice environment..bus stop is in the in front of the building..quite far from MRT station,7 years ago,,https://www.google.com/maps/contrib/118185974490655355316/reviews
rajesh sharma,3,Okay! The security workers are amicable. Manager can be better.,3 years ago,,https://www.google.com/maps/contrib/112533618553419755592/reviews
EJ Ong,3,Great location,7 years ago,,https://www.google.com/maps/contrib/117558317722344632132/reviews
