author_name,rating,text,relative_time_description,reviewer_total_reviews,reviewer_profile_url
Dawn Kamleiter,5,A great place to call home! Well maintained and easy to access. Far enough away from the madding crowd but still within reach of all amenities.,4 years ago,,https://www.google.com/maps/contrib/105126046217285089000/reviews
Dr Reviews,4,Nice and spacious with good views.,6 months ago,,https://www.google.com/maps/contrib/112747621045786494145/reviews
Chia K,5,Beautiful views of the Reservoirs and Nature. Large units bigger than 1600sqft.. 400m to MRT. Rare to find!,a year ago,,https://www.google.com/maps/contrib/115331585470834129829/reviews
Shilpi,5,"Beautiful, spacious apartments",a year ago,,https://www.google.com/maps/contrib/104934433511930948250/reviews
Michele Chang,5,Breezy property with a great view,5 years ago,,https://www.google.com/maps/contrib/115997180946306816945/reviews
