author_name,rating,text,relative_time_description,reviewer_total_reviews,reviewer_profile_url
Ern恩,1,"My application was rejected but they didn't even send a notice to me until I called their helpline. I went to this branch several times and all they know is to ""help me check first"" and then nothing else. Basically solve nothing at all and they have a very low efficiency in operating things.",a year ago,,https://www.google.com/maps/contrib/109088960859019740965/reviews
pao phuwit,1,"Hi, I called from oversea and no one picked up at all.

I need help that your useless faq cannot solve.

Since I got a problem and could not log in.
the only solution is to call and I call from oversea.

Not a single soul picked up my call for 30 mins on hold???

I am truly impressed",a year ago,,https://www.google.com/maps/contrib/117655276579992683308/reviews
E Wong,1,"The customer service hotline is not helpful so I came down to the branch, but there's no staff here, at 3pm! It's not even lunch time and there's no staff. Do you only have 1 staff at each branch? Or haven't you heard about staggering lunch hours?",3 years ago,,https://www.google.com/maps/contrib/117927234559079101177/reviews
VIJAY KUMAR SHARMA,1,This branch is unable to perform most tasks.,3 months ago,,https://www.google.com/maps/contrib/113262269033228244014/reviews
Seby Goh,5,I went there to apply for a ocbc frank student card! The service was exquisite!! Nicolette was really helpful would recommend to anyone who doesn't know what's going on!!,3 years ago,,https://www.google.com/maps/contrib/108408336037361233252/reviews
