author_name,rating,text,relative_time_description,reviewer_total_reviews,reviewer_profile_url
Suhaida Sazali,5,great place to chill👍👍👍,a week ago,,https://www.google.com/maps/contrib/104517280309175573251/reviews
Joseph Tan,5,"One of the earliest commercial building that houses the earliest Tech, Media and Research organisations comparing from both the Public and Private sectors.
Have quite a handful of food and beverages options and some retails shops located at the same premises.",2 years ago,,https://www.google.com/maps/contrib/107647977206488364157/reviews
Janet Ho,4,"Big facility with swimming pool and leisure area. 2 studios for classes. Clean changing room with steam room. Friendly staffs. Easy access with MRT station and carpark right below the building. Plenty foodcourts, restaurants and supermarket at the same building.",2 years ago,,https://www.google.com/maps/contrib/102172931891811234722/reviews
LX,5,"Modern building with office towers and many F&B outlets located in basement levels.

Directly connected to the subway Metro station.",a year ago,,https://www.google.com/maps/contrib/100995343414757723970/reviews
Leong,4,Office cum retail outlets cater to the office workers.,2 years ago,,https://www.google.com/maps/contrib/100885947654573301748/reviews
