author_name,rating,text,relative_time_description,reviewer_total_reviews,reviewer_profile_url
Lim Xiang Long,5,FusionWorls showcases a wide variety of innovation and science research. The atmosphere there is really surreal and interesting as it has different kinds of technology which help to boost Singapore in different sectors such as healthcare and transport. Dont worry too much as there is a guided tour to explain all those technologies. The staff there is really kind and welcoming too.😁,6 years ago,,https://www.google.com/maps/contrib/112449595722086972837/reviews
Johnny YAP,5,Great place to discover SINGAPORE invented products and services...,6 years ago,,https://www.google.com/maps/contrib/100260314899642751399/reviews
P Ho,5,Showcases nifty new technologies by ASTAR,7 years ago,,https://www.google.com/maps/contrib/100240188385041711666/reviews
Ngoc Linh Cao,5,Nice,6 years ago,,https://www.google.com/maps/contrib/106014597135224626367/reviews
Ng Joo Geng,4,,a year ago,,https://www.google.com/maps/contrib/116683347316821891210/reviews
