author_name,rating,text,relative_time_description,reviewer_total_reviews,reviewer_profile_url
Maningthui Newmai,5,"GEA Institute a place where I gained confidence and upgrade my skills. Enjoyed every course without doubt one of the best investments I have made it myself and for sure it will reap one day.
The teachers were absolutely professional and supportive.Still more days to go as I enrolled for 36 months just last may I have done my first ever research presentation it was great experience and looking forward for more exciting events to come. Thank you GEA Institute.",2 years ago,,https://www.google.com/maps/contrib/102082984495513480434/reviews
Sisilia Bili,5,"I have been join GEA Institute since June 2021, I have learned many things here. Everyone is friendly, have campus class and zoom class and flexible learning. I will be here for the next 2 years as I’m taking the 36 months programme.

Update:
I just did my research Symposium on 29 May 2022, it was an excellent experience. Waiting for the upcoming event for my research. That would be exciting.",2 years ago,,https://www.google.com/maps/contrib/116850888184395322330/reviews
Dwi Liana,5,"I had a dream to continue my study in higher level and here I am, since joint with GEA Institute can make my dreams come true. I get more knowledge and great experience with my project research that I never had before. highly recommend for everyone who wants to make their dreams come true.",2 years ago,,https://www.google.com/maps/contrib/105899579804478307348/reviews
Jay Jay,1,"Just completed the course  . It was quite fast and officiant when it comes to study.
It was a hospitality  executive program with ""job placement"" after that. I was surprised  duo to the covid19 satiation   that ""job placement is even possible"".
Seems like I was right. After the study part was over, ""job placement"" is postponed till future noticed with regards to the current situation ""

I'm fine with the online study course  but  the other half deserves 0.
Since I did ask regarding the job placement in July when I was enrolling on!

Cheers",3 years ago,,https://www.google.com/maps/contrib/117860624340210599098/reviews
Teng Sun,5,"I have been studying with GEA since  Oct, 2009. I have learnt a lot of things. Especially during the covid-19. I saw so many classmates were active to learn, It motivate me to keep forward to my dream.
Now the technology makes me to learn any time, I am ready. Because of my work time is so different and longer. Most time I have to learn on LMS and zoom.
The research project helps me to find my passion. I will continue to grow with GEA to find my way to succeed!",2 years ago,,https://www.google.com/maps/contrib/106485163922266274249/reviews
