author_name,rating,text,relative_time_description,reviewer_total_reviews,reviewer_profile_url
Sharon Goh,5,"GUG Preschool @ Katong has been an absolute blessing for our family! Sending my three kids there has been the best decision we've made. The teachers are incredibly welcoming and approachable, creating a warm and nurturing environment for the children. The variety of activities offered, from water play to yoga, cooking, and even robotics, ensuring that there's always something exciting happening. What's truly remarkable is how they've sparked my kids' interest in Chinese through engaging experiments, delightful songs, and captivating stories. It's truly an awesome place where learning knows no bounds!",a year ago,,https://www.google.com/maps/contrib/105483377478438604466/reviews
Rick Hunter,5,"This pre-school is the best choice in the East for your toddler if you value quality care, good teaching techniques, staff members that really care for the well being of your precious ones over branding and fancy marketing. I really appreciate the years of taking great care of my kid by the principal Evelyn and the entire team. Kudos and my strong endorsement.",7 months ago,,https://www.google.com/maps/contrib/115788765277197707542/reviews
houldy,5,"We transferred Javier to GUG Katong from another childcare center at the start of his K2 year and he adapted very well to the new environment very quickly.

Ms Yvelyn’s, the in-charge, commitment to early education and her belief in influencing the correct values to young children gave us confidence that our child is in good hands. The center teachers are patient and encouraging. My child’s favorite teacher was张老师.

My boy made some close friends fairly quickly and loved the center so much that he balled his eyes out on his last day with the center in Dec 2023.

Thank you GUG for giving Javier a wonderful K2 year. 👍",10 months ago,,https://www.google.com/maps/contrib/108731260934281171669/reviews
C C,5,"My 1st preschool for my child and I must say that it's really a great time with the school. This is like a big family to my daughter and myself. Everyone is so closely knitted, teachers, principal, director and all staff are so loving, dedicated and caring.  My child used to be very shy and quiet, under the teacher's encouragement, she has opened up alot and is more expressive now.
Excellent literacy and numeracy syllabus. The foundation in building their skills is excellent. She has no problem in coping with Primary 1 academically.

Big thank you to Ms Zhang, Ms Yvelyn, 张老师，Teacher Siti, Teacher Mochi & all the staff in GUG. Thank you for making my child 's preschool journey a memorable one with many sweet memories to remember.",a year ago,,https://www.google.com/maps/contrib/111340476592304164178/reviews
Ray Lim,5,"If you are looking for a preschool in the katong/marine parade/mountbatten area, GUG Preschool Katong should be one of your choices. The principal and teachers there are nurturing and caring. The feedback given during parent meet teacher session is constructive and not just paying lip service. I thought the curriculum was very challenging but it will provide a basis for your child to enter primary school. One of the downsides of the school is that it is located indoors within a mall, hence they do not have an outdoor area for kids to play or explore. However, this is compensated by the periodic activities which the school organises and brings the students on excursions. My child enjoyed the dancing, singing, cooking and robotic classes which are conducted in school. They are not the cheapest in the area but definitely not ridiculously priced. My child thoroughly enjoyed the school experience.",a year ago,,https://www.google.com/maps/contrib/117269898982507683735/reviews
