author_name,rating,text,relative_time_description,reviewer_total_reviews,reviewer_profile_url
Vinsel,4,"The coffee is aromatic, thick and nice. Suits local coffee drinkers. I was around the area and went there to get my coffee based on its ratings. Luckily it didn't disappoint me and I think it deserves a four stars at least.",a year ago,,https://www.google.com/maps/contrib/106544523090355139944/reviews
Esther Chng,3,Coffee not that thick. Quite disappointing.,5 months ago,,https://www.google.com/maps/contrib/103835816502832600201/reviews
Lex Lim,3,"Nice boss and son team.
Unfortunately tea too diluted, not my cup of tea",a year ago,,https://www.google.com/maps/contrib/102051889920028907509/reviews
mohd latiffee,5,Coffee price is cheap and nice. The hawker is friendly and efficient in service 👍👍👍,2 years ago,,https://www.google.com/maps/contrib/110157496019255044518/reviews
Carol Teo,5,Super nice coffee.  Smooth and fragrant taste,2 years ago,,https://www.google.com/maps/contrib/118215136586236032243/reviews
