author_name,rating,text,relative_time_description,reviewer_total_reviews,reviewer_profile_url
James Xie,3,Pretty normal coffeeshop to go if nearby. Had the prawn noodles.  price is slightly expensive and nothing special.,4 years ago,,https://www.google.com/maps/contrib/101949940079070812431/reviews
Isaac Chong,5,A good place for breakfast as all the stalls will be open. A good mix off different cuisines to choose from!,5 years ago,,https://www.google.com/maps/contrib/107942795425211769313/reviews
azman sardi,5,The food is very delicious and worth for money 💰,2 years ago,,https://www.google.com/maps/contrib/116460484438362584705/reviews
J C,2,Not many good good. At night time too many alcohol drinkers.,6 years ago,,https://www.google.com/maps/contrib/103350458517389055177/reviews
Eng Kiat Poh,4,"Cosy kopi shop with lay back ambient
Quier and cooling",3 years ago,,https://www.google.com/maps/contrib/112160727471762883305/reviews
