author_name,rating,text,relative_time_description,reviewer_total_reviews,reviewer_profile_url
CL,1,"Female dr on afternoon duty was not empathetic and meticulous. Just felt that she was rushing through the consult and didn't even inform what medications she intends to prescribe for me. Had to tell her my medication request and needed to clarify if she will issue MC. She even told me to wait outside for clinic assistant who will tell me more, dude is that what to expect from a Dr? I paid $40 for her to tell me to wait outside for more instructions from the clinic assistant. Was out in less than 3 minutes. As a patient, I don't feel heard and assured on my symptoms/ concerns about my medical condition.

The Dr prescribed me with Xepagan 5 Elixir which she stated for cough suppresant, Ive went to google and none of the website online states that it is for cough but itch, nausea and hay fever. Seriously, did the Dr just prescribe a WRONG MEDICATION???

Have previously seen Dr John before who was way better and professional as a Dr. He was patient to hear me out and was clear about my diagnosis and prescribed medications, suggest to avoid if Dr John is not on duty.",a month ago,,https://www.google.com/maps/contrib/101663035125576353358/reviews
Harriet Dias,1,"I went in to do a urine analysis for my life insurance. (FWD insurance)  They kept me waiting for a long time and then told me that they are not sure whether they can accept the letter as they will have to check with the corporate office. In fact I had called up & checked with them earlier & they said you can just walk in for the test.  Why waste my time when I have to go to work? Why tell me to come in if they don’t know?
How can the service staff be so ignorant? They are on the list of the insurance company for people to come & do their tests. I had also taken a letter of authority from the insurance company. They definitely need training as Singapore is known for it’s customer service.
Instead of wasting my time, they could have told me this from the start itself.
I have always encountered such prompt service in other clinics & I am extremely disappointed with the attitude & service of the staff. There was no remorse for wasting my time & when I said I will be going to another clinic, they said ok as if they were waiting to get rid of me & continue chatting.
Please avoid going to this place for any tests related yo insurance.  They are better clinics out there with exceptional staff as well as service.",5 months ago,,https://www.google.com/maps/contrib/102667408461637782768/reviews
Nancy Lobo,1,"Terrible experience with the lady doctor on duty on 27Dec. After telling her I’m suffering from vertigo for 3 weeks. She refused to listen and just prescribed the similar medicine I had already been taking. Totally miserable and inexperienced. Just referred me to a specialist to get more referral commission perhaps.waiting for my ear to get infected and probably fall while I’m suffering from vertigo. Totally impractical and strange person.
Better avoid if Dr John is not there anymore.",4 months ago,,https://www.google.com/maps/contrib/109592428680709869454/reviews
Harith Azaif,1,rude staff . my wife got rejected from register for medical checkup at 1150 and your guy said come back at 2pm . thats not even close to your break lunch and close at 12 open back at 2pm!!! 2hours i need to wait . waste so much time 👎🏼,a month ago,,https://www.google.com/maps/contrib/101859753660650042950/reviews
Chun Y. Chua,5,"I saw Dr John Cheng who was very smart, clear, kind, up-to-date with info and caring. I did a walk in and the nurses were very helpful and quick, even there were many patients, they were smooth and efficient and polite. I highly recommend and this place will be my preferred doctor & clinic now on.",3 years ago,,https://www.google.com/maps/contrib/107734404694595139427/reviews
