author_name,rating,text,relative_time_description,reviewer_total_reviews,reviewer_profile_url
Faith,5,"Overall a nice place, service is nice and food is served fast. Food quality isn’t bad and it’s considered affordable for a bar setting. God vibes but the music can be very loud.",3 months ago,,https://www.google.com/maps/contrib/116899979553818556489/reviews
Roselyn goh,5,"Great place to hang with friends with good tasting and affordable drinks, good music too!
Provides free dice to play simple games.",in the last week,,https://www.google.com/maps/contrib/118370558239384011315/reviews
V,5,"Helen’s offers a diverse menu, providing options for various tastes and dietary preferences. The restaurant has a warm and inviting ambience, ideal for casual dining or special occasions. The staff is generally attentive and helpful, enhancing the dining experience. The food quality can vary, with some dishes lacking flavor or proper seasoning. Service may be slow, particularly during busy periods, leading to long waits. The restaurant can feel cramped, making it less comfortable, especially during peak times.",8 months ago,,https://www.google.com/maps/contrib/116970933591903079390/reviews
Dr. Alexander Bergfeld,5,Nice little hidden gem. opens til late. Audience is in their early 20s.,a week ago,,https://www.google.com/maps/contrib/102912999571446022488/reviews
katherine ang,5,Good place to chill and gathering plus point the waiter here very friendly and handsome,a week ago,,https://www.google.com/maps/contrib/110119205143503549336/reviews
