author_name,rating,text,relative_time_description,reviewer_total_reviews,reviewer_profile_url
Xin Hao,4,"A very decent destination for F&B, amenities, grocery or to bring your dogs out to walkabout. I will not really call it a mall per se, but more of a community area located within the lush greenery of Hillview. It’s about 7mins walk from Hillview MRT so it’s pretty convenient but when it rains i will expect footfall to be even lesser. Carpark is really poorly designed in my opinion - spaces are not maximized and the lots are just simply not sufficient. Turning radiuses are also very tight at certain corners. That said, I do enjoy the breeze and serenity around the area. There’s also a couple of really good Italian and Korean options within this establishment.  A 24/7 Anytime Fitness is also located here to cater to the residents in the area.",a year ago,,https://www.google.com/maps/contrib/101038177603319548234/reviews
Megan Lee,2,"This is a good place to gather with friends to chitchat after eating as there are benches around . However, there isn't an atm in this mall which is very inconvenient.

The nearest atm only at Hillview CC. There should be more ATM (POSB&OCBC) within this mall to provide convenience for patrons and staffs who works there.",2 weeks ago,,https://www.google.com/maps/contrib/102300404088824157436/reviews
Nur Iman Rostam,5,"HillV2 Free Shuttle Bus is an amazing social corporate responsibility (CSR) from the Far East Organization that was launched in 2015 when HillV2 was established to create a bus link between the residential areas of Hillview, Bukit Batok East and Bukit Gombak (into Pavilion Estate, along Bukit Batok Road).

By 2024, along with the support of local Grassroots Organizations, the HillV2 Free Shuttle Bus has become a prominent service that runs parallel with present public bus operators enhancing the connectivity in the communities served; linking residents with the realm of quiet shopping alleys of HillV2, mass movements to nearest MRT stations on North-South and Downtown Lines as well as opening up accessibilities to address the importance of getting from point to point with ease and comfort.

Starting with 18 stops on a rotation loop service, HillV2 has been able to increase to 22 to allow capabilities and capacities of buses, private or public, to serve the basic need of commuting which makes a big part of the transportation network to get goods and people across streets that can be hard to navigate on big mass buses.

There are banners located at the served Bus stops of HillV2 Free Shuttle Service. You can download their bus schedule by scanning their QR code or surfing their website. One can also download Citymapper Singapore and click on 'Shuttle button to gain access to real time arrival and departure.",2 months ago,,https://www.google.com/maps/contrib/110287485091231667131/reviews
Gregory Athanasius,5,"Discover the charm of HillV2, a community mall that offers a unique blend of dining and service amenities set against a backdrop of lush greenery. 🌿 Nestled in Hillview Rise, near Upper Bukit Timah and just a stone's throw from Hillview MRT station, HillV2 is not just a shopping destination but a lifestyle experience.

Indulge in a culinary journey with a diverse range of F&B outlets. From the authentic flavors of IO Italian Osteria to the aromatic spices of Tandoori Culture, and the exquisite selection at Wine Connection Bistro, there's something to satisfy every palate.

HillV2 stands out as a tranquil oasis in the bustling city of Singapore, perfect for those who appreciate the finer things in life. Whether you're looking to dine, shop, or simply unwind, HillV2 is the place to be.",a year ago,,https://www.google.com/maps/contrib/101240389824842882822/reviews
Cassidy Chew,3,"Find it lacking in the crowd pulling effect like other malls. Maybe due to the size.  The management is doing something right by having live performance which my wife thought was good. The Christmas decoration was good too.
Keep up the good work but more could be done to pull in the crowd.",5 years ago,,https://www.google.com/maps/contrib/114136979141574665107/reviews
