author_name,rating,text,relative_time_description,reviewer_total_reviews,reviewer_profile_url
isham harun,5,"Can order through WhatsApp if you know the part number, paynow and wait to collect your order when it arrives. Good service and friendly staff",a month ago,,https://www.google.com/maps/contrib/105872495871350607884/reviews
Poh QiWen,5,Best of the best place to come .  Prompt reply . Friendly boss ❤️. Brought the coolant here !,2 months ago,,https://www.google.com/maps/contrib/110447987088420616155/reviews
Naem Rohman,5,My place for original BMW parts. Helpful staff at the counter every time.,3 months ago,,https://www.google.com/maps/contrib/102687354688786627305/reviews
Toyota Partshop,5,can you shiping to indonesia,a year ago,,https://www.google.com/maps/contrib/105261856211258948487/reviews
peter chua,5,Great place to get your BMW parts at the best price!,6 years ago,,https://www.google.com/maps/contrib/113077756880593977858/reviews
