author_name,rating,text,relative_time_description,reviewer_total_reviews,reviewer_profile_url
S W,1,"Received horrible service from stall. Inexperienced staff in registering heya sim card. When returned with the new Sim card for assistance, denied service and I was left with a forfeited unused sim card.",a year ago,,https://www.google.com/maps/contrib/112933509178129819027/reviews
Mavis Tan,1,Horrible service. Very rude woman at the cashier. Do not patronize this stall at all. More Expensive then other stalls,a year ago,,https://www.google.com/maps/contrib/104562547457176777921/reviews
Shakiree,1,"Stupid auntie bad service, ask how much she also want be rude and complain should close down",a year ago,,https://www.google.com/maps/contrib/112186596062531837088/reviews
Gemini Gemini,1,horrible service and was treated by very rude staff. also very unreasonable pricing,a year ago,,https://www.google.com/maps/contrib/105895386208759009409/reviews
Insyirah Batrisyia,1,"Lie not responsible. Better close your shop .

Shop scam",a year ago,,https://www.google.com/maps/contrib/109112719902048104002/reviews
