author_name,rating,text,relative_time_description,reviewer_total_reviews,reviewer_profile_url
Peter Rock Steady,4,The donuts are the ones that brought us here. Coupled with Hazelnut Latte. Perfect.,2 weeks ago,,https://www.google.com/maps/contrib/112735098010851642789/reviews
Indra Isnato,4,"Favorite coffee, in Malaysia, Indonesia and Singapore always come to enjoy this brand's products. The place is also cute, very good for taking photos, good for updating on social media. There are lots of delicious donuts. Americano my fav. IG: @Indra_Isnato",10 months ago,,https://www.google.com/maps/contrib/102686841764520258864/reviews
Katherine Happiest,4,"It’s a nice space conveniently located right next to PL station

I find the donuts pretty good
Big variety and very reasonably priced for the quality

My girls enjoy these donuts a lot

Service is quick. Only wish is for service staff to smile a little more",9 months ago,,https://www.google.com/maps/contrib/103056298337699105255/reviews
Adrianne Bernardo,5,"Damn! The donuts were super fresh! Soft! Not too sweet but just moderate sweetness! I love it! I both tried iced and hot drinks and both taste good. The jco cafe is the best donut cafe in Singapore because they serve freshly baked donuts, soft and delicious and it's cheaper hence quality of donut is great. I just wish they have more seats, wider dining area so that people can sit and dine, my advice for improvement and for better service.",2 years ago,,https://www.google.com/maps/contrib/112854354066959885734/reviews
Yan,5,Best donuts in town! Love their cream donuts and fillings. Would recommend Tiramisu and the chocolate creamy variants.,a month ago,,https://www.google.com/maps/contrib/118426666292019553039/reviews
