author_name,rating,text,relative_time_description,reviewer_total_reviews,reviewer_profile_url
Noah J.,5,"Been getting my party supplies here.
It was easy liaising via WhatsApp with the kind owner who always help to ensure that my event will look great and amazing no matter if its a family birthday or company event.

Always coming back here !",3 months ago,,https://www.google.com/maps/contrib/100009607813816017704/reviews
Celia Wong,5,"Went to get balloons for my girl birthday and served by Yoko, she is a patient and nice young lady. She also recommended the design for me to choose . Price is reasonable.",9 months ago,,https://www.google.com/maps/contrib/104929427083395721502/reviews
Andrea Richards,5,"• Service: 5 out of 5
• Varieties: 5 out of 5

This pop up store is like a gem in this place. Really great for parties, events and gathering. They have almost anything but it is good for you to come in advance in case you need to order anything, or else, you can just grab whatever options they have there which is fairly quite a lot of options too!",11 months ago,,https://www.google.com/maps/contrib/112192588115508709230/reviews
lsm lsm,5,"Seller is friendly, nice & responsive. Whatever request she will do her best to fulfill your requirements. Will go back to her again. Highly recommended 👍",4 years ago,,https://www.google.com/maps/contrib/113850080263632061059/reviews
Aloysius Choo,5,Very good service with good advice and suggestions on colour matching with your party themes. Friendly staff who are patient in helping to make the perfect choice for the party! Would come again in future for party ideas!,5 years ago,,https://www.google.com/maps/contrib/105138943298006056700/reviews
