author_name,rating,text,relative_time_description,reviewer_total_reviews,reviewer_profile_url
Nico,5,General hardware shop better stocked than some at Pioneer. Helpful staffs.,11 months ago,,https://www.google.com/maps/contrib/112242219012308499236/reviews
Harris Chan,4,"The staff were helpful and can't get into the shop to view what needed. Maybe in future, would want to have a good look around inside the shop.",4 years ago,,https://www.google.com/maps/contrib/110249575348670855764/reviews
Koh Wei Jian,4,"Variety of goods, also good service. Can be crowded at times.",2 years ago,,https://www.google.com/maps/contrib/106547602335215109385/reviews
Tan Yeh Hong Joseph,3,Wide range of products sold here. Pretty good quality from King Tony.,5 years ago,,https://www.google.com/maps/contrib/103942756251437892976/reviews
Min Han,4,One stop hardware shop for your need at Tuas far most area...,3 years ago,,https://www.google.com/maps/contrib/106412247427102455590/reviews
