author_name,rating,text,relative_time_description,reviewer_total_reviews,reviewer_profile_url
Thivyah Mahendran,5,"I usually enjoy visiting this establishment for its delicious latte and mac and cheese. The coffee and most menu items are consistently excellent. However, my experience today was disappointing.

I decided to try the Teriyaki Garlic Cream Pasta, but unfortunately, the chicken was not fresh, which affected the overall flavor of the dish. Even after avoiding the chicken, the pasta itself had an unpleasant taste likely due to its preparation alongside the chicken.

Additionally, I’ve noticed that one of the servers tends to provide portions smaller than expected, which can be a bit disheartening given the usual quality of service.

Despite today’s experience, I appreciate the quality of the coffee and other menu offerings and hope these concerns can be addressed to maintain the high standards I’ve come to expect here.",4 months ago,,https://www.google.com/maps/contrib/117657129333890779516/reviews
Fairy,5,"A great café for a quick bite before an event at the National Stadium.

Both the beef bacon and mushroom melt sandwich and the blueberry scone are delicious. The sandwich bun is warm and soft, while the blueberry scone is also heated.",4 months ago,,https://www.google.com/maps/contrib/110707374703256523409/reviews
SS Tan,5,"Visited on a Sunday afternoon, about 40% occupied . Their latte art have make my day! We order Manuka honey latte and flat white, with panda cake. The cake is too sweet for us. Beverages are perfectly done :)
Pls continue with creative latte art, I love them so much!",6 months ago,,https://www.google.com/maps/contrib/114094078643326050926/reviews
Patrick Goh,3,"Super crowded on a raining Sunday morning, crew overwhelmed with fully packed seats but barrister still took trouble to serve drinking water despite not regular service item.
Food were generally good except portion wanting, accompanied toast was thinly sliced 🤨",10 months ago,,https://www.google.com/maps/contrib/105723423860642238828/reviews
Irene Lim,3,"Not so crowded Saturday late morning but short of manpower, so the place was quite dirty.
Scrambled eggs was tasteless, croissant doesn’t have butter taste.
Coffee was ok.",10 months ago,,https://www.google.com/maps/contrib/105804445185126817371/reviews
