author_name,rating,text,relative_time_description,reviewer_total_reviews,reviewer_profile_url
Mun yong Lee,1,"Had an unpleasant experience at this wonton mee stall. The vietnamese staff were quite rude and occupied tables for an extended period during the busy lunch hour, making it difficult for other customers to find seats. I seated the table of 8 sitting they came to me confronted me that this table is reserved by them. When I asked how many people they were reserving it for, they said four yet it was an eight-seater with two tables combined. In a shared dining environment, it would be great if the foreign staff could be more accommodating and understand local dining norms to create a better experience for all customers. Hope the management can address this issue.",a month ago,,https://www.google.com/maps/contrib/117786871966074945045/reviews
Viliam Ji,5,I came to buy 5 portions of noodles to take home today. A male employee was very attentive and packed green chili for me. A noodle shop that is worth eating god 👍,a month ago,,https://www.google.com/maps/contrib/101534325804022034859/reviews
Mihwa Lee,3,"Comes in 2 style options. The dark sauce version or regular version.
Noodles were springy and firm.
Sauce seasoning was tasty, not too spicy.
Charsiew was generous. A little dry for me.
Wanton was so so.",9 months ago,,https://www.google.com/maps/contrib/110254254438157902425/reviews
YH J,4,New wanton noodles stall at kopitiam,a year ago,,https://www.google.com/maps/contrib/110082210226531439831/reviews
