author_name,rating,text,relative_time_description,reviewer_total_reviews,reviewer_profile_url
Priscilla Yeo,5,"Don’t let the run-down coffeeshop fool you 😉, this humble spot is home to one of the best Mee Hoon Kueh I’ve had in a long time. Despite the limited number of stalls, this particular vendor truly stands out with his authentic, handmade kueh that’s cooked to perfection.

The broth itself is a throwback to old-school flavors… it’s comforting, rich, and full of that nostalgic, homely taste you just don’t come by easily anymore. You can tell a lot of heart and effort goes into every bowl.

It’s rare to find Mee Hoon Kueh that reminds you of the ones our elders used to make, and this stall really nails it. A true hidden gem that’s worth the visit if you’re craving something honest, simple, and absolutely delicious.

Highly recommend supporting this hardworking vendor!",2 months ago,,https://www.google.com/maps/contrib/105121579671399385873/reviews
Matthew Phang,5,"Kim San Leng coffeeshop here at Blk 138 Tampines Street 11 operates from 6am-10:30pm daily. Stalls here offers a decent variety of food.

• Thai Tee Dat -  operated by a Thai couple selling authentic Thai dishes accommodated to our local taste.

• Popular Briyani - Indian Muslim cuisine selling various dishes on their menu.

• 138 Prawn Noodles - Pork Ribs, Pork trotters,pig's tail, big prawns with noodles in prawn broth or dry chilli version. Our local all time favourite comfort dish.

• S.S.G - Muslim Stall offer our local favourites like nasi lemak, mee siam, mee rebus, lontong and many more.

• Aziz Goreng Pisang - Old timer here with good old Goreng pisang taste.

• Granny Pancakes - Freshly made coconut, red bean or peanut pancakes  . With over 25 years of experience making this, be early to grab them as the queue is long and they sell out quickly.

• Halal Chee Chong Fun - Original or with prawns served with their own homemade sauce and chilli.",7 months ago,,https://www.google.com/maps/contrib/116828649080542336777/reviews
Ivan Teh,4,"Lontong Sayur Lodeh (SGD $4) @ S.S.G. Barokah.
.
Established in October 2020, this stall is operated by Abdul Rahman Bin Aziz and family, who also owns the adjacent Aziz Goreng Pisang Salai stall. Completely off the radar, with no online presence.
.
Their unique rendition feels like a Thai green curry, with a creamy thick texture to the sweet savoury spice broth, and the use of pea egglants, tender with vegetal earthy sweet flavour.
.
The dense compressed rice cakes are firm chewy with grainy sweet flavour, while the stewed vegetables (cabbage, string breans, carrots, jicama turnip) are soft with vegetal sweet spice earthy flavour.
.
A bouncy hard boiled egg with eggy sweet flavour, spongy tofu bean curd with grainy sweet flavour, and crumbly kerisik / toasted grated coconut with earthy nutty sweet flavour, completes.",9 months ago,,https://www.google.com/maps/contrib/114332345573544911646/reviews
Dennis N,5,"Pancakes here are so professional and well made! Toppings are sure to be filled to the brim and the pancakes itself is also large, soft and fluffy enough to counter the large overflowing amount of peanuts!

Do get the peanut butter one if you are a fan of peanut butter, it’s in good quality and goes really well with the regular powered peanuts. Damn amazing 🤩👍🏻",2 years ago,,https://www.google.com/maps/contrib/104988888938292694772/reviews
Robin AGPC,4,This kopitiam does not have many stalls. But the peanut pancakes n Prata are very good!!! Worth a try. The Prata stall is new.,3 months ago,,https://www.google.com/maps/contrib/107706864360659116775/reviews
