author_name,rating,text,relative_time_description,reviewer_total_reviews,reviewer_profile_url
Darren Seah,1,"Barbaric place. Serves only their ""kind"" first even when there is a queue.

Maybe you will get a better experience if you are ""same"" as them.

Anyway their food comes raw. Ordered curry fishhead and only the outside was cooked. Internals were mucky and yucky. Sent back to the kitchen 2 times but still raw... Come on, you had morning until lunch time to defrost your fish.",6 years ago,,https://www.google.com/maps/contrib/111642358161115225790/reviews
Yousef K,3,One of the  average Indian restaurant in jurong island,6 years ago,,https://www.google.com/maps/contrib/111677385768595741687/reviews
Terence Tan,1,"Discriminant pricing. 3 of us buy ice cream, each of us charged different for the same type and brand of ice creaming. Found out after we talked among ourselves!",7 years ago,,https://www.google.com/maps/contrib/112559378433988012189/reviews
Eddie Yap,1,Black chicken soup is very weak... Cost $6.50.. Not worth the price.,a year ago,,https://www.google.com/maps/contrib/117116672190649887381/reviews
Laxman Gouda,1,"Food delivery  no god

Not on time",a year ago,,https://www.google.com/maps/contrib/115460131965142146541/reviews
