author_name,rating,text,relative_time_description,reviewer_total_reviews,reviewer_profile_url
LH Goh,5,awesome tasting ingredients with bee hoon. will definitely come back in future. opens early.,4 months ago,,https://www.google.com/maps/contrib/102188671674038600035/reviews
James Chua,5,"Delicious bee hoon, chicken wings n 鱼柳。 super friendly and hardworking couple. Say hi to them.",a year ago,,https://www.google.com/maps/contrib/111304023861084512303/reviews
Kia Guan Ng,5,I like the hot and crispy chicken wing and ikan bilis. The chilli goes well with the nasi lemak. The price of $3.50 is very reasonable as the chicken wing is quite big and meaty.,a year ago,,https://www.google.com/maps/contrib/108972979221461010763/reviews
Koh Wei Jian,5,"Tasted nice, good attitude, cheap and fast service. It is rare to see other breakfast stall like this elsewhere.",2 years ago,,https://www.google.com/maps/contrib/106547602335215109385/reviews
rettsufied,5,in my opinion the best econ mee in singapore,a year ago,,https://www.google.com/maps/contrib/111999148860039133331/reviews
