author_name,rating,text,relative_time_description,reviewer_total_reviews,reviewer_profile_url
Tan Meng Geok,5,Sin Hock Heng Teo Chew Porridge. Yummy Food. Must Try Foodies.,6 months ago,,https://www.google.com/maps/contrib/110470542297110258623/reviews
J,5,came here for the JB mee hoon kueh that newly opened. comfort food!!,11 months ago,,https://www.google.com/maps/contrib/104115444934486971569/reviews
Amanda,5,Update: Penang heng heng noodles are moving to to west coast! Called the boss and he said they are moving to 120603,a year ago,,https://www.google.com/maps/contrib/100301920057666111214/reviews
Violet Lum,4,Wanton noodles is very good. Cost $5 each. Not much parking lots.,a year ago,,https://www.google.com/maps/contrib/117069903621220244873/reviews
Wai Foong Liew,1,"That fish soup is only half as good as it looks
Service is half and half
As for the soup, I don’t think it tastes good enough.
When I tasted the shrimp and chicken sauce, I didn't think it was marinated by myself.
Suitable for the elderly
Come on one",11 months ago,,https://www.google.com/maps/contrib/117977221799371349764/reviews
