author_name,rating,text,relative_time_description,reviewer_total_reviews,reviewer_profile_url
Kenny Hau,5,"Celebrating my birthday and I have amazing experience at KT’s grill. Staffs are friendly and give good recommendation for food and monetary value.

Food are nice 10/10. Ambiance is great but due to aircon leakage, my rating is 8/10.

Highly recommended and will go back again 🎶🎵",a month ago,,https://www.google.com/maps/contrib/117548908293580961688/reviews
Srd G Bains,5,"Good choice of food
Evening easy accessible to view the parade if u can grab the place at this restaurant outside
Staff is friendly and understanding n
Able to serve with patience",a month ago,,https://www.google.com/maps/contrib/100632680324370910290/reviews
Silvia Yeat,5,The food is great and the staff are very friendly and helpful! Great option if you are looking for a comfortable restaurant to dine at in USS!,4 months ago,,https://www.google.com/maps/contrib/104423500691606228543/reviews
Beverly Morata Grafton,4,"The service is wonderful, especially Ada, who was very attentive and polite. Everyone had a smile on their faces and when serving my steak, they made sure I checked to see if the doneness was to my liking before leaving the table.

The watermelon juice was sweet and icy cold, and with the juicy sweet large slice of fresh watermelon that topped the drink off, it really was such a delectable experience.

The only thing I'm not impressed with was the lack of seasoning. I struggled to finish my steak, partly because I can't eat a large portion at one go anymore but also because there's barely any salt. I did enjoy the rosemary brown sauce they added on the side but I truly was expecting better flavor on the meat.

That being said, this would be beneficial for those who need to maintain a salt-free diet. And that's just not for me

On the whole, I would eat here again but next time, I'm going to ask for the salt.",2 months ago,,https://www.google.com/maps/contrib/105342588386583327667/reviews
Charlene Kong,5,"The food was absolutely delicious. What made our experience even more special was the exceptional service. The staff were warm, attentive, and went above and beyond to make our visit memorable.

It was my son’s birthday that day, and the team surprised us with a birthday cake and sang a birthday song for him. We were truly touched by their thoughtful gesture, and my son had a birthday he will always remember.

Thank you, San, Jenny, Eryan and Nandar, for such a wonderful experience! If we have the chance, we will definitely choose to dine here again. Highly recommend it to anyone who loves great food and excellent service!",5 months ago,,https://www.google.com/maps/contrib/105739358383345233674/reviews
