author_name,rating,text,relative_time_description,reviewer_total_reviews,reviewer_profile_url
Bitamin C,4,Got the takeaway unagi bento at $9.90. Delicious even without reheating. Service and food on par with Japanese standards 👏,6 years ago,,https://www.google.com/maps/contrib/100701342518529319450/reviews
Yang,4,"Like the title, market that sell Japanese food stuff, sauce, seasoning, etc.

Hotate Teriyaki($5)
Round, heavy and big. Chilled and fresh. Simple tasty.

Yuzu Umeshu($12.80)
Yet to try.",4 years ago,,https://www.google.com/maps/contrib/103078870952547064508/reviews
ふらはん,5,I chose this market shop to grab my simple regular bentos before or after work sometimes. They are ok. おいしい！,3 years ago,,https://www.google.com/maps/contrib/105422362996678743211/reviews
吳嘉豐,5,Many thanks to the counter staff SK. Very kind and friendly.  Completed my order very quickly.,2 years ago,,https://www.google.com/maps/contrib/117683736911614426565/reviews
Boon Siong Ng,4,Nice food with reasonable price,6 years ago,,https://www.google.com/maps/contrib/108311152782287320258/reviews
