author_name,rating,text,relative_time_description,reviewer_total_reviews,reviewer_profile_url
Forest BK,3,"Standing at a barely noticeable place at the Park, the Labrador Obelisk marks the western limit of Keppel Harbour.
This tall Obelisk probably would have been a iconic landmark structure for the passing ships in the past.",a year ago,,https://www.google.com/maps/contrib/116448453673911455728/reviews
Red Barker,4,"Hidden behind a forested area which wraps around the Battery fortifications beside the park.

As other adventurers have mentioned, a sign with some contextual information and history would be useful. Not much to see or note currently.",2 months ago,,https://www.google.com/maps/contrib/102466876071032297959/reviews
Desmond Koh,5,"A white obelisk stands at this spot known as Tanjong Berlayar Point.

The obelisk had a very different purpose to being a grand monument to the past. It is used to mark the southernmost end of Asian continent.

The obelisk would have been painted white and its height would have made it easy to be seen by passing ships.",2 years ago,,https://www.google.com/maps/contrib/117297111931730200169/reviews
B,5,The Labrador Obelisk demarcates the original Western Harbour limit. It served as a reference point for seafarers to identify specific areas within the harbour.,6 years ago,,https://www.google.com/maps/contrib/107347858650648848850/reviews
Adam N,4,A sign for the obelisk would be nice. I see many confused people not know its purpose.,3 years ago,,https://www.google.com/maps/contrib/100371715791420867743/reviews
