author_name,rating,text,relative_time_description,reviewer_total_reviews,reviewer_profile_url
Weng Yue Siew,5,Attended a briefing of products offered during Industrial Transformation event recently. The person who attended to me was knowledgeable and was able to share details well. Products are in line with catering to the latest needs in the industry.,7 months ago,,https://www.google.com/maps/contrib/102950497315866144591/reviews
Jolin Quek,5,"Cool place with cool robots the tour guide also knows what he's talking about, a good place for someone who is interested in robots and ai",10 months ago,,https://www.google.com/maps/contrib/104022858865858155683/reviews
hugo hentz,5,I was impressed by LHK Precicon booth’s demonstration today at ITAP in Singapore. The staff was very friendly and knew how to explain their cybersecurity and sustainability applications in details. I was especially proud to see the Schneider Electric solution showcased there. Thanks for showing your work to me!,7 months ago,,https://www.google.com/maps/contrib/101097982304288537487/reviews
Shamsul Arefin,5,"One groups of Ngee Ann Polytechnic Common Engineering Programme (CEP) Students Visited on 10 May 2023. Exposure to automation solution is great, staff are very cordial! Thank you all Omron staff helped in this learning journey!",2 years ago,,https://www.google.com/maps/contrib/110340246911049407186/reviews
Kit Wong,5,Great introduction on the products functionality.,7 months ago,,https://www.google.com/maps/contrib/113697565846301058982/reviews
