author_name,rating,text,relative_time_description,reviewer_total_reviews,reviewer_profile_url
Matthew Lee,5,"So I came here with my PRC wife Emily Xia to support her homegrown brand. I was pleasantly surprised at how good Luckin Coffee is compared to Starbucks.

Luckin Coffee is as good, if not even better than its aforementioned rival in all aspects including app UX, quality of drinks, store ambience, etc.

For new app users, there is the $0.99 among other amazing promos.

I highly recommend Luckin Coffee for all looking for good drinks and food to enjoy while socializing with their friends.

Edit: Me and my wife Emily Xia Jing at Luckin Coffee again with the results of our ravenous hunger 😺 See 3rd photo",4 months ago,,https://www.google.com/maps/contrib/103085852239067801925/reviews
Yuki Christie,5,Great coffee and nice cool environment. The air con is a good breakfast from hot humid weather. Had iced coconut latte and happy with my coffee.,2 weeks ago,,https://www.google.com/maps/contrib/101874487624799077719/reviews
YC Ng,5,"One of the few Luckin outlets with seats, and coupled with a 60% discount voucher made this a great place to hang out!

Though the indoor seats in front of the counter were too cold for comfort..",5 months ago,,https://www.google.com/maps/contrib/114616404937921117862/reviews
WR X (Toujiang),5,"I didn’t realize heartland customer service could be as good as in the city. Seriously, it’s a gem! Keep it up!",a month ago,,https://www.google.com/maps/contrib/106628219080086132384/reviews
Kayden Choo,5,"My usual order of Hot Velvet Latte, I like it very much. Enjoyed the fragrance of the coffee.

Tried the Oat Milk Latte before, personally did not like it. The taste of the Oat Milk was too strong for me.",5 months ago,,https://www.google.com/maps/contrib/111046245288496998971/reviews
