author_name,rating,text,relative_time_description,reviewer_total_reviews,reviewer_profile_url
Diya C,5,"I'm very grateful to be taught by Ms Janice throughout Sec 4. I joined her in Sec 3 (after my end of year exams) and have been with her for a year. I jumped from getting a C5-C6 to attaining a B3 in my O-levels! Ms Janice is an incredibly dedicated, humorous and kind teacher everyone wishes for! She will always encourage you to do your best and her lessons are never boring :) I always looked forward to going for her tuitions. Honestly, it was her faith in me that kept me going and motivated me to work even harder to improve my English. Thank you so much for teaching me Ms Janice!! :))",3 months ago,,https://www.google.com/maps/contrib/108926015459146832511/reviews
Kae Pheng Ng,5,"Mrs. Chung is an incredibly dedicated tutor who takes a proactive approach to her students' learning. Her engaging teaching style, combined with a great sense of humor, makes her lessons both enjoyable and effective. My son looked forward to attending her classes and performed exceptionally well in his PSLE. Thank you for inspiring him to enjoy learning English and for making such a positive impact on his education!",5 months ago,,https://www.google.com/maps/contrib/118403097833802346980/reviews
Chan Wai Yan,5,"I'm grateful to have had Teacher Janice twice, in Primary 4-6 and Secondary 3. Her English classes are engaging, fun, and motivating. In primary school, her quizzes and games made learning enjoyable. Reuniting in Secondary 3, her guidance helped me improve my English grade from B3 in Secondary 2 to A1 in Secondary 3!!! Teacher Janice's teaching style, materials, and encouragement gave me confidence and motivation to work harder. I'm thankful for her dedication and passion 😻🔥😋",6 months ago,,https://www.google.com/maps/contrib/100028254974767807453/reviews
Megann123 Tan,5,"I am the 2024 batch of P6s, Megann. When I first joined Mckaylan (p5) I was weak in English and scored AL 4, I also failed the tests I took at the centre. However, after much effort I had put in, as well as the materials that teacher Janice had provided for her students, I managed to score AL 2 for the Primary School Leaving Examination. I found that the worksheets I had revised from Mckaylan were very useful and interesting, helping me in remembering more of the grammar rules and the spelling of difficult words. Thank you teacher Janice for your guidance and support!",6 months ago,,https://www.google.com/maps/contrib/106229283087847267740/reviews
Nah Li Ching,5,"My eldest boy has been with Mckaylan since P3 and now he is Sec 4. This year his younger brother joins him. Both of them enjoy every lesson there and look forward to attending class every week. Ms Janice has a creative way of engaging the students, making teaching fun, and at the same time imparting knowledge to them. She is also patient and approachable, and motivates my boys beyond study. I am grateful to her for teaching and helping my boys especially my eldest boy through these years.",8 months ago,,https://www.google.com/maps/contrib/115602378659464925425/reviews
