author_name,rating,text,relative_time_description,reviewer_total_reviews,reviewer_profile_url
Sad Potato,5,Free Entrance make sure to familiarise with the map before you visit if you planning to see the whole garden,a month ago,,https://www.google.com/maps/contrib/115300093361533105771/reviews
Sharon,5,Another part of Singapore Botanic Garden for one to explore.,4 years ago,,https://www.google.com/maps/contrib/114048260274174260190/reviews
Raymond Tan,3,Cameras here.. no parking by road side,3 years ago,,https://www.google.com/maps/contrib/105909991513415718154/reviews
linchen xu,5,"Its botanic garden. Lots of trees and plants, fresh air and spacious. Great place for running or walking or picnic, theres lockers and vending machines near the toilet.

Theres also shops selling food nearby.
Excellent experience",2 years ago,,https://www.google.com/maps/contrib/107572065082252664496/reviews
Arjun Trivedi,5,Its a convenient way to enter the lower half of the Botanic Gardens and has a point where you can also park your bicycle!,3 years ago,,https://www.google.com/maps/contrib/113275233418214513328/reviews
