author_name,rating,text,relative_time_description,reviewer_total_reviews,reviewer_profile_url
The Five Magic Beans,5,"Mindchamps @ Mapletree Business City is a GREAT school - our boy comes home every day excited to share about what he learns at school, and talks lovingly about his teachers and friends

Every morning, Ms Chong checks on our boy diligently and teaches him to greet the day with a smile 🌻

Every evening, he shares about what he learns - going beyond the academics but also things around the world. Special shout out to his teachers Wu Lao Shi and Ms Adrea who is so patient with him when it comes to learning Chinese and music 🎶

Special shout out to his form teacher Ms Franny. She pours her heart into the job and I see her on weekend birthday parties and kids’ play dates. It is no surprise that she was loved and moved at the K2 graduation earlier… it’s almost like her graduation too as a 2nd mummy to the class. Don't be deceived by her coloured streaks and her tattoo - she’s puts her ALL in the role as an educator, disciplinarian, and most importantly friend. The kids know it too - my boy called her “his best friend” until the other boys bribed him away with Pokémon cards.

The school isn’t complete without the top-down support of Principal Ms Bee. She has the job of managing the school as a business and parents as customers - but we have never felt the disconnect vs. enrolling our boy in a school with a heart ❤️",5 months ago,,https://www.google.com/maps/contrib/104695391448280072185/reviews
Claire Xiong,5,"I think MindChamps is a very good preschool because my daughter always feels happy in her school life.MindChamps also has many professional teachers, especially Ms Franny— English teacher, Ms Wu—Chinese teacher, Ms Andrea—Music teacher.Thank you for providing my child with a good environment for growth and learning.",5 months ago,,https://www.google.com/maps/contrib/104557490399108079564/reviews
SeungChul Han,5,"We are incredibly appreciative to all the teachers and staffs at Mind Champs, especially towards the K2 teachers Ms Franny and Wu Laoshi for the amount of effort they have put in to provide our daughter with a nurturing environment.

She has grown in so many aspects, from her confidence in expressing herself to her ability to adapt to new challenges. Encouraging curiosity and imagination allowing her mind to explore all the possibilities. Their dedication and care have played a significant role in shaping her development and making her learning journey enjoyable and fruitful.

We are truly grateful for the unwavering support and encouragement they have provided. Thank you for creating such a positive and nurturing environment for our daughter.",5 months ago,,https://www.google.com/maps/contrib/113001767430940106435/reviews
Li Miao,5,"I believe that early childhood education provides a crucial window of opportunity to impact a child's overall development and lay the groundwork for their future. My daughter's young mind has grown, learnt, and blossomed in ways that have exceeded my expectations over the past two years of attending Mindchamps Preschool, which provides diverse content including reading, writing, maths, music, gymnastics, etc. She frequently mentions Ms Franny and Wu Laoshi at home and she is grateful for their loving care and devotion. As parents, we are also grateful for her teachers' professionalism and kindness.",a year ago,,https://www.google.com/maps/contrib/107276915100887617015/reviews
Anna Chew,5,"The Mother's Day Tote Bag Painting organised by Ms Franny & Wu Lao Shi for the Champs  has been fabulous & fun. It is certainly heart warming ❤️  to see the mums & children bond thru painting.

Thank you for your love and patience in nurturing our Champs in a safe, loving & enriching environment ❤️ ♥️",a week ago,,https://www.google.com/maps/contrib/109017886972988807148/reviews
