author_name,rating,text,relative_time_description,reviewer_total_reviews,reviewer_profile_url
Srd G Bains,4,"Ok but waiting time is a long of 75mins
Instead I recommend y all visit from 3-4pm onwards instead visiting before 2pm this is a small 1 cent tip to the visitors so that waiting time will be less n can enjoy more",a month ago,,https://www.google.com/maps/contrib/100632680324370910290/reviews
Joyce,5,Came at 11am spent 2 hrs played 3 minion land rides,a week ago,,https://www.google.com/maps/contrib/106444357371392448106/reviews
Planet Mars 2033,5,New attraction. Good to visit,a month ago,,https://www.google.com/maps/contrib/114212871438191164256/reviews
Rachel kee,5,Rifdi was so nice and friendly. He made out trip to USS minion land so happy,2 months ago,,https://www.google.com/maps/contrib/100514946317101589026/reviews
Tee Kexin Estee (Clementips),5,I love it,a month ago,,https://www.google.com/maps/contrib/114952522947194843829/reviews
