author_name,rating,text,relative_time_description,reviewer_total_reviews,reviewer_profile_url
ice cold veins,5,"I've attended Youth Service in Mount Carmel since Feb 2023. I can now safely say that Mt Carmel has changed my life.
With a wonderful congregation and meaningful sermons preached by dedicated pastors, I find myself growing closer and closer to God.",4 months ago,,https://www.google.com/maps/contrib/102759085634174770375/reviews
Kevin Tan,5,Excellent place to meet new people and gather for big events.,8 months ago,,https://www.google.com/maps/contrib/105516165879953327816/reviews
Cynthia,4,"It’s good to look for a church that has at its core Word & Prayer that leads congregations to full Worship of Father, Son & Holy Spirit where you enjoy fellowship with believers & reach out to others as you serve one another!

Many churches will lean more in 1 way and thus we call those traditional (Law) or charismatic (Grace)! Look Biblically & wholistically for any church you want to belong to 😉.

This highly Word-based church’s vision is to bring generations together to love God & love people. Like any church, it will always be a work in progress! However, they are a solid church!!",5 years ago,,https://www.google.com/maps/contrib/114735938830883821698/reviews
Soong En Lim,5,This church has changed my life. Praise God!,11 months ago,,https://www.google.com/maps/contrib/101372570635157562365/reviews
jimmy chew,5,"Healthy fellowship and caring seniors. I attended their thanksgiving anniversary, the message was deep and meaningful",2 years ago,,https://www.google.com/maps/contrib/110161987271829319082/reviews
