author_name,rating,text,relative_time_description,reviewer_total_reviews,reviewer_profile_url
John Tan,1,"First time mums get duped with the shittiest delivery wards. They have a couple of new modern looking delivery wards but if you are not aware, they would put you at one the old delivery wards at the end that face the noisy flyover. By the time you realize it, it would be too late because the water would have broken and the mum can’t be moved. For the price they are charging, I would go elsewhere.",6 years ago,,https://www.google.com/maps/contrib/100556790317352890678/reviews
Chong AI keen,2,Nurses are too young and has no EQ. Must train them how to talk politely to patients.,a year ago,,https://www.google.com/maps/contrib/112373104550634763063/reviews
John Budi,2,"Disappointing hospitality. Especially from the younger nurses....they have to be retrained for EQ, LQ and basic hospitality and follow SOP.",7 years ago,,https://www.google.com/maps/contrib/105514347649180292331/reviews
Suan Chiang,4,,7 years ago,,https://www.google.com/maps/contrib/105149585850358583059/reviews
jxexrxoxn,4,,8 years ago,,https://www.google.com/maps/contrib/108267795593161247146/reviews
