author_name,rating,text,relative_time_description,reviewer_total_reviews,reviewer_profile_url
Mrdtux Rdtu,1,"teachers are not feeling and not understanding. Instead the principal and teacher want us to understand their situation. COMPARE OUR SON WITH OTHER STUDIES WHICH IS RIDICULOUS. Didnt want to calm the kids when they meltdown instead they IGNORED and let them to calm themselves. First day of school teacher didnt share what will they doing. They really want the kids to be so independent within the time frame. NOT ALL KIDS IS THE SAME. treating the kids like a soldier . make kids to understand really took time,  its not easy.  Principal giving so many scenarios but they dont try to make time for the kids settle themselves.
The best is vice principal giving so bad expectations asking whether we are still interested to send my child to school just bcs we send about 930-10am. Ridiculous.",a year ago,,https://www.google.com/maps/contrib/112603763836683376483/reviews
Grace Fu,5,"Placed my child on the WL for this sch since she was 20mths old even though we stayed at Keat Hong. First impression of this sch was that it was big, clean and very neat. My child has been here since her PG days and it was the best decision ever.

The sch teachers we have met hav been so enouraging, nurturing and attentive. My child blossomed from a shy little toddler to a confident and happy K2-er!
They helped wean her off pacifier, toilet trained her and helped to spot her socio-emotional development issues at an early stage that we managed to get the right intervention.

The curriculum is a good balance of inquiry/play based learning and her English lessons are filled with current affairs which my child always come back and share with me. Her Chinese T has a unique way of teaching Chinese tt my child even with her dislike of Chinese, adores him.

The school is clean, food is made fresh from their in house kitchen w fruits daily, learning outings planned well and parents are welcome during parental involvement day end of terms!

Thank you too all Ava’s teachers and Principal! We will miss this school when she graduates.",in the last week,,https://www.google.com/maps/contrib/105335156371127270268/reviews
afi wafi,5,,a year ago,,https://www.google.com/maps/contrib/107334929548815677968/reviews
