author_name,rating,text,relative_time_description,reviewer_total_reviews,reviewer_profile_url
Cat T,4,"Needed an air-conditioned place for lunch after walking 2hours in the gardens on a hot morning... think this place just next to McD is new. We were the 1st customers 15mins to noon on Sunday. So food was served super fast after we ordered.  👍👍👍
Ordered half chicken $16 and they allow mix of roasted and steam chicken.  Chicken rice is $1.20. Hainanese pork chop $12, prawn roll $10, Chinese sausage eggs $10 (for our friends who are experiencing shortage of eggs in C.A, USA), green sprouts $14 (medium). Portions for small are good for 4, we prefer lots of vegetables so upsized the sprouts. Would say that the prices are similar to coffeeshop zichar but the ambience is nicer. Good flavours and not overly salty. Lots of choices on the menu too...
Drinks are $3... prices are subjected to GST... they don't take credit cards but do have paynow etc...",a month ago,,https://www.google.com/maps/contrib/115501602868899713032/reviews
AC Chan,4,"Took a trip down memory lane to Superbowl Jurong, this one-of-a-kind place that’s been around since the early-Nineties. It’s hard to believe it’s been that long since I first visited this place. 😌💫
We decided to try the steamed chicken at  Nam Kee Chicken Rice Restaurant with an old-school charm. Tender and meaty with a delicate layer of skin bathed in light soy-based sauce. It’s simple, yet incredibly comforting!
P.S. What makes it even more special? All the dishes are served on these beautiful vintage longevity pattern plates, adorned with floral design and the four Chinese characters — 萬 | 壽 | 無 | 疆. Truly in love with these pieces!🥰",a month ago,,https://www.google.com/maps/contrib/112914663109983612841/reviews
Isobel Tan,5,"Am not sure why we didn’t know about this place earlier. I love a good plate of chicken rice, and Nam Kee certainly ranks up there for offering precisely that.

We came here for dinner after a run around Jurong Lake Gardens, since you can park at the open air carpark at Super Bowl.

The restaurant is air-conditioned and really comfortable, and the staff are very friendly and helpful.

We ordered half a poached chicken, sweet and sour pork, the home made prawn rolls and the chicken rice.

Everything was delicious. The poached chicken was tender and juicy, and tasty even without any sauce. In any case, the free flow dark soy sauce and chilli were still there to elevate the flavour. The rice was also really flavourful and was perfect to pair with the chicken. As with other traditional chicken rice restaurants, your chicken rice comes with free refillable chicken soup, which was such a comfort for the evening.

They also do tze char dishes in case you want more variety. The sweet and sour pork and prawns rolls were both good as well.

The food also came pretty fast.

All in all, it was a great experience and we’ll definitely be back the next time we have a chicken  rice craving.",a month ago,,https://www.google.com/maps/contrib/114565326728876809259/reviews
Richard Cheah,2,"Our first visit here. Before we proceed to order, we were informed many dishes not available like:
1) Hainanese Roasted Chicken
2) Char Siew / Roasted Meat
... and among others.

What and how on earth are the owners going to run their business when it's newly opened. And, it is only Monday.

To add-on, there are no proper eating utensils. We have to eat with soup spoon, together with the fork for our meal. Boss explanation is the shipment has not arrived! What a good reason to give, considering this not their first outlet after more than 30 over years in business. Wondering if the spoons are specially plated with gold, custom made to serve our locality here?

Coming to the prices, portion for a bowl of fragrance rice at $1.20 is an extremely small portion, definitely far over priced considering the location serving housing estate in Jurong here.

Sad and sorry to say, you can get a bigger portion, with better fragrance at the nearby FM Food Court.

Overall, the chicken rice is only average at best. The price is far too costly to warrant any customers returning after their first visit.

Hard to say if I will ever return but looks like chances are not high.",6 months ago,,https://www.google.com/maps/contrib/116759225490774107700/reviews
Jeremy Tan,4,"Now westies do not need to travel all the way to the Thomson stall for nice chicken rice. This outlet is situated just beside Sheng Siong at Yuan Ching Road.

The chicken meat is tender and is the hainanese version. Goes well with the condiments. The chili sauce is the savoury kind - with a tinge of sweetness.

The ambience is old school with the metal tables and chairs of old.

Overall, a decent meal.

Opens during CNY (surcharge of 20% applies).",3 months ago,,https://www.google.com/maps/contrib/116191827592187993639/reviews
