author_name,rating,text,relative_time_description,reviewer_total_reviews,reviewer_profile_url
Tan Jun Wei Zeyes (Nhps),1,bias teachers and food bad a,3 months ago,,https://www.google.com/maps/contrib/115900091348173468183/reviews
Jordyn,1,Food is bad teachers are bias! One star,7 months ago,,https://www.google.com/maps/contrib/103058785066398694623/reviews
Pang Jun An Vayeus (Nhps),5,very good techears,3 months ago,,https://www.google.com/maps/contrib/115261406198077767209/reviews
Shanglin Li,1,I've been in Nascans for 1 and 1/4 years and I already hate it. Don't go there.,5 years ago,,https://www.google.com/maps/contrib/100337548268605290422/reviews
Trop Rainforest,1,Die there very easily,3 years ago,,https://www.google.com/maps/contrib/106825451745173243906/reviews
