author_name,rating,text,relative_time_description,reviewer_total_reviews,reviewer_profile_url
Tan hang chong,3,Convenient shuttle bus from bukit timah campus to Kent Ridge campus.,8 years ago,,https://www.google.com/maps/contrib/113051076774579941350/reviews
Muhammad Firdaus,5,"Clean and green, nice chickens!",4 years ago,,https://www.google.com/maps/contrib/106868471219880237950/reviews
Chatinai Morarai,4,Beautiful campus,6 years ago,,https://www.google.com/maps/contrib/108625031675388158638/reviews
Andrew Tan,5,Nice and beautiful campus. About 12 minutes walk from botanic gardens mrt.,7 years ago,,https://www.google.com/maps/contrib/117654223398999384589/reviews
Brian Sun,5,Nice stroll or cycle in the evening to see the colonial buildings in night lights,3 years ago,,https://www.google.com/maps/contrib/115273384983257464606/reviews
