author_name,rating,text,relative_time_description,reviewer_total_reviews,reviewer_profile_url
Steven Seow,5,My go to place for briyani . Prata and Other  dishes also good.,a week ago,,https://www.google.com/maps/contrib/103113515951353684615/reviews
Rodson Chue,4,Decent. Ordered one plain (kosong) and one Onion Egg Prara with Dhal Curry. Not sure if the same stall as the previous Jamal Khan that was also selling Prata,2 years ago,,https://www.google.com/maps/contrib/110557991810192405120/reviews
Rilwan Mohamed,5,Good service,3 months ago,,https://www.google.com/maps/contrib/101368649196227082396/reviews
Ken Smith,1,"Badly burnt Prata, poor attitude",a year ago,,https://www.google.com/maps/contrib/103891848649964455354/reviews
Desmond,5,Best Talk,a year ago,,https://www.google.com/maps/contrib/110453387194701266795/reviews
