author_name,rating,text,relative_time_description,reviewer_total_reviews,reviewer_profile_url
Terrick W.,4,Our regular place for snacks. Food is reasonably good. They have pretty good process normally dont take ling to order and pay. We like their Cheese Chicken sausage and Sotong sticks. They also introduce new items here and there which is great for us.,8 months ago,,https://www.google.com/maps/contrib/117988793492560252192/reviews
Fairy,5,"Very tasty hot curry puff.
There is a stand-up dining table right next to this stall.",6 months ago,,https://www.google.com/maps/contrib/110707374703256523409/reviews
Superb Lim,3,"Dry mee siam. Can't taste its tangy, sweet, sour favour. It's missing. There's room for improvement. With little mee siam gravy, good to have that drooling.",5 months ago,,https://www.google.com/maps/contrib/104288481888263625218/reviews
Lenny Yapananda Samudra,4,"Easy to eat snacks! There are lots of variant to try. I love the cheese fish stick so much, it's so soft and yummy ❤️ not a big fans of the gyoza since the vegetable tastes stronger than the meat

The staff is very kind and helpful",a year ago,,https://www.google.com/maps/contrib/117039779427424072608/reviews
Edwin S,5,"The stall is for takeaway only, but there is a table just opposite the store.

They currently are serving rojak as a SG60 special. The rojak sauce was excellent — it was not overly sweet and had the fragrance from the torch ginger flower. In it, there were chunks of you tiao, tau pok, tempeh, and cucumber. It was also topped with peanuts.",a month ago,,https://www.google.com/maps/contrib/113192406653516830642/reviews
