author_name,rating,text,relative_time_description,reviewer_total_reviews,reviewer_profile_url
H2 O,5,Walking distance covered pathway to Novena MRT with buses serving Whampoa Bishan Ang Mo Kio Yio Chu Kang Toa Payoh Yishun Sembawang Pasir Ris and neighbourhood heartland of Thomson. Walking distance to Revenue House IRAS Novena Regency with plenty of famous dinning the famous Novena Church Church of Saint Alphonsus Gentle Drive Playground with breezy greenery away from busy cityscapes Gentle Villas Tan Tock Seng Hospital National Skin Centre Kiddiwinkle Schoolhouse@Novena Oasia Hotel Novena Royal Square at Novena Square Ii Novena Square Velocity with plenty of dinning shopping banking supermarkets library cinemas entertainments groceries sundries postage services cinemas entertainment and amenities nearby. Friendly cosy comfy welcoming ambience for romantic intimates groups students expats locals visitors and families.,5 years ago,,https://www.google.com/maps/contrib/114520501314404177965/reviews
Flo Yeow,3,"It's a little messy right now given the road works around the area. That said, they do what they can to making things work. It's still an important bus stop, given it's right by Novena Church, and opposite Novena Square shopping mall. Also right outside Novena Regency, a residence above all the restaurants.",4 years ago,,https://www.google.com/maps/contrib/101597484841229205770/reviews
keng juan Yeo,3,Remember! Need to cross the zebra crossing toward this stop from the church(opposite side)!,5 months ago,,https://www.google.com/maps/contrib/108882902678685211919/reviews
Jessie Sng,4,Quite a number of buses available,6 years ago,,https://www.google.com/maps/contrib/116945375216858901706/reviews
Jamberi Kamis,4,Drop point,a year ago,,https://www.google.com/maps/contrib/102664947919378089772/reviews
