author_name,rating,text,relative_time_description,reviewer_total_reviews,reviewer_profile_url
Villagemayor,3,Go through the mall and pedestrian overpass to Merlion from Raffles Place. not the greatest looking mall however.,4 months ago,,https://www.google.com/maps/contrib/105504356867855904852/reviews
Alfred Low,5,Found Local Coffee People here only SGD 1.10 per cup for tea or black coffee,6 years ago,,https://www.google.com/maps/contrib/117987188915859361014/reviews
Rick Smith,4,"Surprisingly good little mall over the street, connecting between Raffles Place and Fullerton Bay Hotel.  Good tea shop, ineresting Tex-Mex, specialty wine/liquor store, automated dry cleaning, and a money changer.  Who could ask for more 😁",7 years ago,,https://www.google.com/maps/contrib/110912694764992930144/reviews
Ma Shun,4,"a ordinary offie building sitting by the heart of CBD area.
My usual lunch place and for tea break.",2 years ago,,https://www.google.com/maps/contrib/102953742603127699990/reviews
Thundermist Bane,5,It's a very overwhelming experience with nice views of Marina Bay and Marina Bay Sans,10 months ago,,https://www.google.com/maps/contrib/103125070266285251231/reviews
