author_name,rating,text,relative_time_description,reviewer_total_reviews,reviewer_profile_url
Adrian Teo,5,Clean & Big Rooms with friendly service and reasonable HH pricing !!,5 years ago,,https://www.google.com/maps/contrib/106071791834696700567/reviews
TT Lim,4,Nice ambiance Night Clubs.   Price reasonable.   No pushy sales for singers flower.,6 years ago,,https://www.google.com/maps/contrib/107997321846310240909/reviews
Keith Kong,5,Friendly staff and reasonable pricing for what it was.,6 years ago,,https://www.google.com/maps/contrib/104778989981944599063/reviews
Harsh Nagalla,1,Utter waste of money.,a year ago,,https://www.google.com/maps/contrib/100899930484452468715/reviews
Lim Li Kuan,5,Nice place to hangout,6 years ago,,https://www.google.com/maps/contrib/100507438795000823359/reviews
