author_name,rating,text,relative_time_description,reviewer_total_reviews,reviewer_profile_url
Fauzi Taib (freaker126),5,"My favourite cycling rest spots. Now you can use the eastern route from Pasir Ris to East Coast. Basically, just follow the river flow or big drainage.",10 months ago,,https://www.google.com/maps/contrib/116135338321345003230/reviews
Seng Chong Tan,5,The Pasir Ris Park PCN is really a great gift to the neighbourhood. It connects the various corners of the park into this interwoven web of tracks that can lead you from point to point. The greatest consolation of them all are how the trees are planted. It provides some much needed shades as well as giving the park an identity that differentiates from other parks.,2 years ago,,https://www.google.com/maps/contrib/112753912480208859387/reviews
Isaac Z,5,Great sunset views by the rocks. Light presence of people. It does get dark quickly. Easily accessible to Down town east,a year ago,,https://www.google.com/maps/contrib/118009568848322272989/reviews
S.Bhupinder Singh Brar,5,Went there for the first time... Took a day off and started from Pasir Ris MRT and went all the way to Punggol and Coney Island... Didn't expected to be mesmerized by the surroundings and felt like Kampong days of old.,2 years ago,,https://www.google.com/maps/contrib/105666085071275495432/reviews
Thomas W yt,5,Can’t lie this is a banging park brev,10 months ago,,https://www.google.com/maps/contrib/102359340084002138279/reviews
