author_name,rating,text,relative_time_description,reviewer_total_reviews,reviewer_profile_url
Tracy Zhang,4,"See this restaurant in many places such as orchard road and want to try its brunch.
We tried the 5cheese platter and tuna sandwich.
The cheese platter was delicious and really generous , all 5 cheeses were good I like the soft one the most. The truffle cheese was also good too.
The tuna sandwich came with side salad and the sandwich was made with croissant.
Coffee is ok, general standard.
It’s happy to meet an old friend there and she reminds my favorite bread 🥖 😂
All is good will be back.",a week ago,,https://www.google.com/maps/contrib/115734578140137125670/reviews
Florewela Cornelis,5,"My friend and I had an afternoon tea here. We had macaroons, crepes and choc cske which are all delightful. The teas were perfectly brewed too .
Nice ambience and well cooled with their efficient airconditioners . Staffs ( Cathy & colleague )  are very pleasant and quick to assist us. Thank you. Highly recommended place .",a month ago,,https://www.google.com/maps/contrib/117790867876006251481/reviews
Melanie E,4,"I came here seeking some good French food and they did not disappoint.

Food: 5/5 - I opted for their set menu lunch special. You can start with soup or Caesar salad. I chose the salmon chowder which was delicious. For an extra $3 you can choose a dessert but I was too full. There are 3 choices for the main course ranging from meat to vegetarian. I had the chicken with pasta cream sauce. A good serving size at a great value. The set menu also came with an iced lemon tea. If you don’t want to dine in, there’s a section of takeout sandwiches, cakes, pastries, and desserts.
Service: 3/5 - the service could be improved as I had to call the server to bring my check
Atmosphere: 5/5 - the beautiful interior of the restaurant made up for the lack of service. There’s a nice vibe to the place.

I will come here again.",5 months ago,,https://www.google.com/maps/contrib/111136896090209853190/reviews
Fab Foodie Swede Malin Nordblom,4,"A nice smaller Paul’s with both lunch, dinner, coffee and cakes. I often buy bread here. They have both baguette, dark bread and sourdough versions. Their pastry is pretty good.
They recently redecorated their Tanglin outlet and it’s really nice now.",2 months ago,,https://www.google.com/maps/contrib/107062657007062713328/reviews
Merryheart,3,"Paul Bakery at Tanglin Mall boasts a bustling and inviting atmosphere, complete with the delightful aroma of freshly baked goods and the comforting fragrance of coffee. Upon entering, one is immediately drawn in by the vibrant energy and warmth of the establishment.

However, the service left something to be desired. The staff seemed overwhelmed by the crowd, resulting in slower service than expected.
As for the food, the experience was a mixed bag. The croissant, unfortunately, was a disappointment. It was soggy and oily, lacking the desired crispiness and flakiness that one expects from a good croissant.

When it came to the main course, the duck confit was well-prepared and enjoyable. On the other hand, the squid ink pasta was a letdown.
The sauce, reminiscent of laksa, did not pair well with the seafood, creating a somewhat unharmonious flavor profile.

Overall, Paul Bakery is a decent spot for catching up with friends over a cup of coffee, but don't go with the expectation of an exceptional culinary experience. The ambiance is lovely, but the food and service leave room for improvement.",4 months ago,,https://www.google.com/maps/contrib/101391398296811227556/reviews
