author_name,rating,text,relative_time_description,reviewer_total_reviews,reviewer_profile_url
Douglas Looi Thean,5,Clean and easy to find,10 months ago,,https://www.google.com/maps/contrib/117666725169525640867/reviews
Yati Yati,5,Can finding indonesian food easly❤️❤️❤️🧐,2 years ago,,https://www.google.com/maps/contrib/108904509501881123001/reviews
Hossain Sohag,5,I am here,3 years ago,,https://www.google.com/maps/contrib/103777678883826849612/reviews
Ng bee kwee michael,1,Very irresponsible manager n problematic.,6 years ago,,https://www.google.com/maps/contrib/111601116278275028963/reviews
Nic Ang,4,Paya Lebar Stn Exit B,8 months ago,,https://www.google.com/maps/contrib/114562729781448823334/reviews
