author_name,rating,text,relative_time_description,reviewer_total_reviews,reviewer_profile_url
elrid carvalho,5,"Have been eating at Pete’s for the last 2.5 years now and there has never been a time I’ve been disappointed, be it the kebabs, the pilaf, the falafel or the hummus, it’s all cooked and seasoned to perfection.
Tried the latest addition to the menu - the wagyu steak on pilaf and it was simply delicious. I’d always recommend Pete’s to anyone who wants a no frills, all taste experience in Joo Chiat.",a week ago,,https://www.google.com/maps/contrib/111977036851709937649/reviews
GA YA,4,"We often go there and like the food albeit a bit pricy for what it is. The falafel with humus is delicious, the beef wrap feels very fresh and simple but so small that it leaves a need to repeat the order (very clever). We did and went for a second wrap with chicken. I must say it was extremely salty and less appetizing than the beef version. All by all a small shop with decent food located in the vibrant Alibaba hawker",6 months ago,,https://www.google.com/maps/contrib/107030149869065027484/reviews
Jack,4,Had beef and lamb pita with hummus and it's really good. Meats are well seasoned and pairs well with the wrap and hummus. Just wished that portion is rather small for the price.,4 months ago,,https://www.google.com/maps/contrib/106288565584051666357/reviews
Nick GC Tan,5,Good food and good taste at a good price - double portion wagyu beef rice at 17$. 15$ is you give a good review. So I tasted it before I review. It’s good 👍,3 weeks ago,,https://www.google.com/maps/contrib/114827845011651343990/reviews
A. Peng,4,The grilled chicken was excellent ..though think I should have ordered with rice as the bread was a tad too soggy..beef w rice was average.Would come back for the grilled chicken,2 weeks ago,,https://www.google.com/maps/contrib/116103525044805290404/reviews
