author_name,rating,text,relative_time_description,reviewer_total_reviews,reviewer_profile_url
Evonne Woo,4,"My new favourite and regular lunch spot in this area. There’s a good variety of dishes selection for its economy rice, in addition, they have a separate menu that you can order for them to cook on the spot. The interior is air conditioned so it’s quite comfy. The dishes tasted good and I loved the hor fun 🫶🏻",a year ago,,https://www.google.com/maps/contrib/112712924978762648151/reviews
Yan En Ang,3,"Food is cheaper than most options in the area. 5* for affordability.
Queue for Cai Png is long but moves much faster than queue for Zi Char.
Zi Char quality is so-so but can expect to wait up to 45 mins.",a year ago,,https://www.google.com/maps/contrib/108170865790500540566/reviews
Sree 1289,5,"Good place for Economy food located below IBM building, Changi Business Park. The food was tasty and the place is neat and clean. Indoor and outdoor seating available.",a year ago,,https://www.google.com/maps/contrib/116697955703860241770/reviews
イザベル,5,"newly opened food court in IBM building, serves economical rice + ala carte dishes. priced reasonably as well, $5-$6 range.",a year ago,,https://www.google.com/maps/contrib/108863355468523327621/reviews
May Wondrous,1,"Do not order zi char. Came in here at 11:20 to skip the crowd, food was not serve till 12:10. There are not order before me yet I still have to wait close to an hour before I gotten my food.",a year ago,,https://www.google.com/maps/contrib/107371752254196157435/reviews
