author_name,rating,text,relative_time_description,reviewer_total_reviews,reviewer_profile_url
Iyedr,2,"Friendly staff and patrons, a bit unclear on pricing, almost boarding dishonest. Careful if you’re approached and don’t speak any local language, drinks might get added to your tab whether you know it or not.
Had fun but felt cheated!",11 months ago,,https://www.google.com/maps/contrib/114906158439642318001/reviews
Ben Rias,5,Very nice place with a kind lady boss. This place is run by gangster so becareful not to stare at them,2 years ago,,https://www.google.com/maps/contrib/114644935390575846237/reviews
Wayne Koh,4,Good place to chill and wind down with singing and beering,2 years ago,,https://www.google.com/maps/contrib/113949799122977019750/reviews
J C,1,Empty always,a year ago,,https://www.google.com/maps/contrib/116952722861631945204/reviews
weeyoung lee,5,Good Place,2 years ago,,https://www.google.com/maps/contrib/107387682815692245500/reviews
