author_name,rating,text,relative_time_description,reviewer_total_reviews,reviewer_profile_url
Tat Shing Chin,5,Great services by PwC Singapore.,a year ago,,https://www.google.com/maps/contrib/103039264857197829150/reviews
Pearlynn Tan,3,Good place for meetings,2 years ago,,https://www.google.com/maps/contrib/101613602245470083533/reviews
Sugondese Nuts,1,"Never pick up call, sleeping on the job?",5 years ago,,https://www.google.com/maps/contrib/115054484905289403152/reviews
P K,4,"Good security, right in the city",9 years ago,,https://www.google.com/maps/contrib/111887485421584212796/reviews
Phat Pham,3,Good place.,8 years ago,,https://www.google.com/maps/contrib/109230437408343523536/reviews
