author_name,rating,text,relative_time_description,reviewer_total_reviews,reviewer_profile_url
Garett Lee,5,"I had a frozen shoulder issue that persisted for over more than half a year prior to seeing Kwan, despite visits to TCM and other physio clinics. While some relief did take place, the problem didn't go away completely. I saw a workshop focusing on frozen shoulder issues that Qinetic Wellness had organised and signed up for it, and it was from there I came to know of Kwan's level of knowledge which led me to sought treatment at Qinetic Wellness. A handful of sessions in, and I'm back to 100% and can train again with confidence.

In-depth knowledge paired with extensive experience is what makes Kwan a maestro in his field. His diagnosis is always on point, and he's always able to link the connecting issues to get to the bottom of the source of the pain and to then firm up the treatment plan. Bedside manners as a therapist are also top-notch, and he puts people at ease right away. 👍🏽

The experience with patient services is also great - Alicia is fab, sending in timely reminders about appointments and their policy of cancelling 24hrs beforehand allows for flexibility in rescheduling is very reasonable and fair.

Located on the fifth floor of Bukit Timah Shopping Centre, parking is ample, not an issue and the mall never gets overly crowded or busy, thanks to its largely less retail tenant mix, and more specialised services such as domestic helper agencies. The mrt station is also conveniently located close by. A plethora of food options where necessary, are conveniently located in the adjacent mall and across the road (Cheong Chin Nam).",2 weeks ago,,https://www.google.com/maps/contrib/102429779161382378043/reviews
Stephanie Zhao,5,Kwan is super knowledgeable and is able to identify the problem areas quickly. He identified lymphatic blockages as the source of my shoulder pain and was able to solve the root cause of the problem (something other treatments/therapies have not done for me). Highly recommend!,a week ago,,https://www.google.com/maps/contrib/108777611640391864816/reviews
hsing lu Lai,5,"I’ve been to many therapists, but this one truly stands out. The attention to detail and personalized care I received were exceptional. They carefully assessed my shoulder and ankle issues and provided targeted treatments that made a real difference. Their deep knowledge and commitment to helping clients recover are evident in every session. Without a doubt, this is one of the best activity therapists in the neighborhood. Highly recommend to anyone looking for expert, results-driven therapy!",2 months ago,,https://www.google.com/maps/contrib/104178117015765496445/reviews
Ivan Hoe,5,"I was a student in International Sports Academy-Qinetic Rehab Exercise and Therapy Specialist Course September 2024 intake (27/9-29/9, 4/10-6/10).
Kwan was exceptionally professional in imparting the methodology, methods, techniques involved in manual therapy treatment and exercise prescription based on different conditions of clients.
Kwan was always encouraging us to think as detectives in examining, treating, assessing and fine turning our treatment of clients and to take care of ourselves during the treatment process.
There were always lots of hands on practice among our fellow classmates and even among Kwan's Team.
His Team: Alicia & Ryan also left a deep and lasting impression on me too as they were also encouraging and fine tuning our way of thinking and the correct treatment technique and thinking like a detective too. Excitedly looking forward to the next practice sessions, workshops, etc with the Qinetic Wellness Team & my fellow classmates & friends soon ❤️😁🙌",7 months ago,,https://www.google.com/maps/contrib/106663026908476797217/reviews
Gaius Chai,5,"I was running late to my session by 10 minutes, but Ryan was incredibly understanding and still provided me with the full 30-minute treatment. Throughout the session, he was exceptionally hospitable, constantly checking in to ensure I felt comfortable and that the pressure points during the massage were just right for me. The relief was almost immediate, and the entire experience exceeded my expectations. I highly recommend Ryan to anyone looking for a professional and attentive massage therapist. I’ll definitely be recommending him to friends and look forward to returning for another session! plus the view was amazing",4 months ago,,https://www.google.com/maps/contrib/102304301581870894983/reviews
