author_name,rating,text,relative_time_description,reviewer_total_reviews,reviewer_profile_url
Paul Ler,5,"Located at the basement of Terminal 3, Saap Saap Thai is an open-concept eatery—not fancy, but clean and fairly spacious. At first, I thought it was part of a food court, especially with the dishwashing area right beside it. This also meant I occasionally caught the smell of Dettol, but it wasn’t overwhelming or off-putting for me.

Ordering is done via a self-service kiosk, which is convenient, though the system can hang at times.

We had the signature chicken boat noodles and the beef boat noodles. The broth was excellent—savoury, refreshing, and not too salty. The noodles were silky, bouncy, and had a nice chewy texture (有嚼劲). The meats were fresh, and the meatballs were tasty as well. Overall, we really enjoyed the noodles.

For dessert, we tried the mango sticky rice, which was pretty good—above average, though not something I’d call out-of-this-world. The mango wasn’t overly ripe; it had a nice balance of mild sweetness and a hint of sourness. The sticky rice was soft and fully cooked.

As for drinks, the Thai milk tea was a bit disappointing—tasted somewhat artificial with a syrupy, fake tea note. The original Thai iced tea was slightly better than the green tea version, but both were forgettable.

All in all, a solid place to grab a good bowl of noodles and dessert before a flight. I’d return for the food, just not for the drinks.",a month ago,,https://www.google.com/maps/contrib/100644526789243756650/reviews
Lindah,1,"i'm so excited until i try the beef meat..so disappointed 😞the meat not cooked properly.can see trough the photo,it still Raw😭i only like the drink",a week ago,,https://www.google.com/maps/contrib/108777225209723690832/reviews
M. Chen,4,"An affordable, value for money place to enjoy halal Thai food. There are better tasting Thai food but this one does meet the minimum criteria. Go for their Combo 3 with rice/noodle, drink and mango sticky rice. Very worth it.",6 months ago,,https://www.google.com/maps/contrib/117219980570993006062/reviews
Mason Tay,3,"A fast food concept Thai style boat noodles and Thai food. I get a quick fix for my craving for Thai milk tea, Thai glutinous rice, Thai boat noodles and Thai green curry. It is not the best but it has maintained the taste of Thai food. However, why are you hiring all Filipinos that doesn’t act like a thai. Lack of Thai presence and the friendly culture here. Overall the food is still not that bad!!",a year ago,,https://www.google.com/maps/contrib/108195777674730720034/reviews
Coco,4,"This is my second time having a set meal,
It's reasonable , taste quite authentic esp beef boat noodle is my favourite.
Everytime we visit T3, i'd like to take a meal here. A staff is friendly as well.",4 months ago,,https://www.google.com/maps/contrib/108940397591841285325/reviews
