author_name,rating,text,relative_time_description,reviewer_total_reviews,reviewer_profile_url
Kevin Gerard,5,"Salad Paradise is for anyone seeking a healthy and satisfying meal. The ingredients are always fresh, crisp, and packed with flavour. I loved how customisable the salads were, allowing me to mix and match a variety of veggies, proteins, and dressings. The portion sizes were generous, and the staff was polite and attentive. Whether you’re looking for a light meal or a hearty, nutritious bowl, this place hits the spot. Definitely coming back!",3 months ago,,https://www.google.com/maps/contrib/109103689981631532798/reviews
may yap,5,"Absolutely amazing experience at Salad Paradise! The customer service is top-notch – the staff are incredibly friendly and attentive. The salads are fresh, flavorful, and perfectly balanced in taste. You can tell they put a lot of care into every dish. It's now my go-to spot for healthy and delicious meals. Highly recommend for anyone looking for great food and exceptional service!",4 months ago,,https://www.google.com/maps/contrib/102813543951480785797/reviews
Eli LLoren Clavero,5,"‘Had a late lunch near the office.  Today’s lunch was an intriguing mix of flavors and textures with a unique combination of ingredients. The cold red spaghetti was a refreshing twist, offering a nice, subtle chewiness that contrasted well with the crispness of the lettuce. The roasted pumpkin and sweet potatoes were sweet,  earthy addition, perfectly balancing the lightness of the greens.

The fruit salad added a surprising sweetness, bringing a bright and fresh element to the dish. The mushrooms added a savory note that paired well with the sweetness of the vegetables and fruit. The carrots were crunchy and provided a nice bite, while the roasted sesame sauce brought it all together with a nutty richness.

Overall, this salad is a great fusion of savory, sweet, and earthy flavors. The roasted sesame sauce is a standout—deliciously creamy and nutty without overpowering the other ingredients. It’s a filling yet light option that feels both satisfying and refreshing, perfect for a midday meal. ‘Hope I can try their tofu or other protein next time.  :)",3 months ago,,https://www.google.com/maps/contrib/104566624723505954770/reviews
Nicolas B,5,"Very good variety of veggies and proteins. One of my only options for keto diet 😅
See the picture, I have eaten half of the bowl and there is still so much, very generous portion! Nice to be also welcomed by smiling and courteous staff. Highly recommended!",3 months ago,,https://www.google.com/maps/contrib/101365856072100309023/reviews
Fion Tong (Yap Ker Qing),5,Best salad bar in Singapore. They have many choices and reasonable price with super friendly staffs. Great location and nice environment. Highly recommended 👍👍👍,4 months ago,,https://www.google.com/maps/contrib/116570374557458707304/reviews
