author_name,rating,text,relative_time_description,reviewer_total_reviews,reviewer_profile_url
Qhan Han,4,"Shop had a good variety of malay food not normally found in most shops! Its has nasi padang, nasi sambal goreng, lontong, gado-gado and ayam penyet as well. On top of that, they sell porridges and kuehs too. Would definitely come back to try their other dishes.",3 months ago,,https://www.google.com/maps/contrib/109676371249595977415/reviews
Hanis M,5,"You can find one of the nicest nasi sambal goreng, mee rebus, mee soto and laksa here! Nasi padang too, of course.

Great variety of kuehs available and sardine epok2 sells out very fast 🤩",a year ago,,https://www.google.com/maps/contrib/101494823626869238351/reviews
Ryan Fernandez,4,"The mak cik’s mee rebus is one of the good ones I have tasted. Tasty, good proportion accompanied by friendly and good service. Her other dishes are good too 👍",2 years ago,,https://www.google.com/maps/contrib/106982280176042399585/reviews
Jass Singh,1,"Auntie taking order completely rude and not the first time. 1st time when I encounter, I didn't want to review bcos i thought they might clashed into an argument before I came to buy. But now 💯 it's their attitude.",8 months ago,,https://www.google.com/maps/contrib/108302413304203845476/reviews
Marcus Goh,3,"Nice Malay food stall selling rice and noodles, both fried and soup form.",6 years ago,,https://www.google.com/maps/contrib/105182234976754893762/reviews
