author_name,rating,text,relative_time_description,reviewer_total_reviews,reviewer_profile_url
Scarlet Red B. Zero,1,"When the store changed hands to the duo of ladies, the prices were unjustifiably jacked up so much, and the payment methods were reduced to cash only. Within less than 3 months, the store was ran to the ground, and now it has been closed since the end of February till now with no notices of how long it will be closed for or a permanent closure. The UEN is still listed as valid and online but on the official registry it does not exist. Now old rusty fridges with moldy drinks are just left there, together with shelves and stagnant water.",3 weeks ago,,https://www.google.com/maps/contrib/116660088841234135748/reviews
Dyana Yusof,1,"As mentioned by others, the shop lady has a bad attitude. Came here to collect parcel bought frm shopee. The lady seems uninterested to entertain those coming to collect parcel. Parcels were also not very organised. They were scattered on floor, shelves etc so she took a long time to look for the parcel. Initially I wanted to buy some snacks frm her shop but bcos she took a looong time to look for parcel and I was running late, I decided to return snack items to the shelf and go off. One of the snacks fell as I was returning it and she said I was rude and throwing her things around. Never coming back here again.",9 months ago,,https://www.google.com/maps/contrib/106442169338440656282/reviews
Erlin Diana,1,"Trying out Shopee collection point here and it is worst decision ever. Went to collect at 11.30am on wed and it is not opened. Called them and they say they will open tomorrow from 9am. Went there the next day at 9.30am and it is again not opened. Call them and the same person answered scolding me saying hello the shopee website saying it is opened at 10.30 why you come at 9.30, you understand or not.

Totally horrible. I rather pay 2$ for shipping to home rather than dealing with the kind of emotional damage and uncertainty it caused.

Contacted Shopee live agent which was not very helpful and giving wrong phone number for me to call. They asked me to raise refund request instead which imo not fair for sellers & buyers for something that is caused by collection points…",11 months ago,,https://www.google.com/maps/contrib/113894169640629139789/reviews
David Kwek,1,"Very bad attitude lady. Shopee put opening time 10am-8pm everyday but went on Thu 20 Jun 10.10-10.30 and closed, went on Fri 21 Jun 10.15, the lady arguing with her husband on the phone, then tell people come after 10.30am or evening in a very rude manner, when people explain we have to work.",11 months ago,,https://www.google.com/maps/contrib/110176087027691677903/reviews
TempoLynx,1,Closing and opening time is inconsistent and all the packages scattered and unorganized,5 months ago,,https://www.google.com/maps/contrib/104969743096429287547/reviews
