author_name,rating,text,relative_time_description,reviewer_total_reviews,reviewer_profile_url
T WP,5,"Great place to visit learning about plant seed and Singapore's effort in seed preservation. Nice collection and  specimens are well displayed. Also, the detailed exhibition did lead me to learn more about plant seeds, different shape and sizes, different type of dispersal method. I've learnt new thing. :)",4 months ago,,https://www.google.com/maps/contrib/116063738673256691463/reviews
Noemi R,5,very cool space! particularly enjoyed seeing the laboratory through the glass windows,4 months ago,,https://www.google.com/maps/contrib/115362816371476139961/reviews
Forest BK,5,"A beautifully restored Colonial era house that has been repurposed as a Seed Bank centre to caring for plant Seeds.
The Seed Bank houses seed specimens of various Seed Dispersion type. Within the Seed Bank Centre itself are Live laboratories working on seed cleaning and preservation. The Seed Bank centre is fully air conditioned with working elevators and clean washrooms. Admission is free.
Several Seed-theme sculptures were strategically located around the compound of the Seed Bank centre.
Some interesting displays among them are:
- Double coconut aka sea coconut seed 海底椰 that look like the female lower body torso. It's the largest plant seed.
- Water caltrops seed aka buffalo nut 菱角. Water caltrop has been used for worship as prayer offerings by the Chinese.
- Cheng Tng Plant seed or Kembang Sa-mangkok, 胖大海 is a key ingredient in the Singaporean dessert.",10 months ago,,https://www.google.com/maps/contrib/116448453673911455728/reviews
Zameer Gajiyani,4,A nice educational place. It's a colonial bungalow converted into a display/ lab/ storage place for a variety of seeds. The display has a wide variety of seeds including the largest seed in the world. Alas the lab  part is restricted.,7 months ago,,https://www.google.com/maps/contrib/111733229268851019205/reviews
noel aye,5,Very educational and informative. Very cooling also after a long walk in the humid weather.,a month ago,,https://www.google.com/maps/contrib/100571587233890832342/reviews
