author_name,rating,text,relative_time_description,reviewer_total_reviews,reviewer_profile_url
Norman Chai,1,I was trying to feedback to Seng Choon on the quality of eggs. I tried multiple times to submit the feedback via their website but the message cannot be submitted. Then what’s that for?,a year ago,,https://www.google.com/maps/contrib/105206262229059683866/reviews
chengjong gan,1,Look at the eggs that We bought from NTUC Senja,3 years ago,,https://www.google.com/maps/contrib/109809520918909187767/reviews
Krishno Das,5,This is very good company. This company eggs best qualityfull.,11 months ago,,https://www.google.com/maps/contrib/113554479676451861791/reviews
Philippe Pang,1,Was shouted at by the customer service person that picked up the phone when I tried to ask for an email contact to email them. Suggest you try to speak to whoever is picking up the phone at the office before this issue goes viral.,3 years ago,,https://www.google.com/maps/contrib/115691407244227643074/reviews
fabian lalung,3,Good company,9 months ago,,https://www.google.com/maps/contrib/103432873595438655993/reviews
