author_name,rating,text,relative_time_description,reviewer_total_reviews,reviewer_profile_url
Melinda Bai,5,"Shakiya is the best dance studio I've ever attended. The teachers are professional and patient, the students are helpful and friendly, especially the principal Ms Susan is very talented and caring. This is a warm team that gives you beauty, joy and friendship. We love Shakiya!❤️❤️❤️❤️❤️",a year ago,,https://www.google.com/maps/contrib/118188336317888202178/reviews
Angie Quek,5,"Many variety of dance classes to choose from, experienced & patience instructors, convenient location and good environment. Wonderful experience I hv with Shakiya!♥️",a year ago,,https://www.google.com/maps/contrib/116763680284273550103/reviews
xialu Zuo,5,highly recommended this dance studio. Professional instructors . Plus the environment is good. Convenient location as well.,a year ago,,https://www.google.com/maps/contrib/101926670501690275423/reviews
Ming Yi,5,,5 years ago,,https://www.google.com/maps/contrib/106499317877238584771/reviews
Fiona Ng,5,,7 years ago,,https://www.google.com/maps/contrib/106578161147854386988/reviews
