author_name,rating,text,relative_time_description,reviewer_total_reviews,reviewer_profile_url
Pauline Wee,5,"SI PASTA at 399 Taman Jurong Koufu is a hidden gem! Easily the best pasta I've had in Taman Jurong. Their Aglio Olio is amazing—perfectly cooked pasta with just the right balance of garlic, spice, and fragrance. The flavors are rich, and you can taste the quality ingredients. The flavors are rich, and you can taste the quality ingredients. I also tried their cheese fries, and they were delicious. Highly recommended for all pasta lovers!",a month ago,,https://www.google.com/maps/contrib/113442208195765868656/reviews
coey tang,5,"pasta here is goated 🐐🐐
ordered the...
🍝 prawn, cherry tomato aglio olio 🌶️9/10

🍤prawns were deshelled and they even took out the digestive track!
lacks umami, but still good for kopitiam standard

🍝 smoked duck tomato cream 10/10
🍅good balance of flavour between tomato and cream

koufu needs to step up the cleanliness else overall food at si...pasta is 10/10",in the last week,,https://www.google.com/maps/contrib/100007871687321389855/reviews
YW Lau,5,"This is the first time we tried Si Pasta.

We ordered smoked duck pasta, mixed veg pasta and steak (Medium).

All dishes exceeded our expectations. Very polite and friendly service from the lady who took our orders.

We saw many customers patronized Si Pasta, definitely a good and healthy sign that Si Pasta is doing a good job. Keep it up Si Pasta.

Unfortunately, the atmosphere was not that good due to the flies at Koufu. Hopefully, Koufu and all the stalls will step up the cleanliness of the place so that customers will have a more enjoyable dining experience.",4 months ago,,https://www.google.com/maps/contrib/100672887438941772177/reviews
Yingxiang Lee,5,"Si Pasta is the best neighbourhood pasta I have eaten by far! Food tastes good, prices are reasonable and portions are big. I've been eating here at least once a week, so glad that they're in Taman Jurong. Staff are very friendly and accommodating.",a month ago,,https://www.google.com/maps/contrib/110744789813955073226/reviews
YongShun Lee,5,Looks good and taste good. Love that there are vegetarian options. Not crowded at Koufu even during lunch hours so good to enjoy the aircon while enjoying good food.,6 months ago,,https://www.google.com/maps/contrib/101927768839646389271/reviews
