author_name,rating,text,relative_time_description,reviewer_total_reviews,reviewer_profile_url
Carmen Ku,5,"We were previously at Small Wonder BM since my daughter was 15 months, then transferred to Small Wonder Dundee at around 24 months. The school had been very helpful during the transition and it did not take long for my daughter to adjust. The environment is nurturing and teachers are committed. My daughter has picked up many life skills and can independently do many things for her age which we are grateful to the teachers for. The school is also committed to communicating with parents on a daily basis and engaging us in different activities and events.

Teacher Saranya has also been instrumental in helping my daughter become potty trained at school and helping her to open up and speak up although she previously was hesitant/shy. A very committed and hardworking teacher who although busy, never fails to provide timely updates of daily class activities by uploading photos onto the school app. Thank you!",3 months ago,,https://www.google.com/maps/contrib/108638082748923610697/reviews
Tricia Tan,5,"A big thank you to 刘老师(Dundee) for being such a wonderful teacher! She creates a warm and supportive environment, always taking the time to explain things and help our child understand situations better.

Chinese lessons are so much fun with games and songs, making learning Mandarin enjoyable and engaging. We've seen such a boost in our child’s confidence!

We really appreciate all the care and effort 刘老师 puts in.",2 months ago,,https://www.google.com/maps/contrib/106109474173957891871/reviews
Andrea Tan,5,"We enrolled our son in Small Wonders Queenstown Preschool this January, and while he has been facing some difficulties adjusting, the experience has been very positive so far. The teachers—especially his form teacher Ms. Saranya, Chinese teacher Li Lao Shi, and principal Ms. Fiona—have been incredibly patient, understanding, and supportive throughout the process.

I also appreciate how the school keeps parents updated on their children’s activities through the app, which gives us insight into what they are learning and doing daily. The curriculum seems well-structured, and the overall environment feels nurturing. We are hopeful that our son will settle in soon and thrive in this great school!",3 months ago,,https://www.google.com/maps/contrib/109918542572522338112/reviews
Chee Chong Teo,5,"We enrolled our boy for infant care when he was 15 months old. Initially the separation anxiety was very bad for him he would cry and not want to be carried by the teachers in the morning into the classroom. However in just a short 1-2 weeks time, our boy was enjoying school and very willingly allow the teachers to carry him. This shows that the he really likes the teachers. Special shoutout to teacher Cherry Ong for always sharing with us what our boy have been doing in school, answering our questions promptly and loving our boy (giving us suggestions on what to do when he doesn’t want to drink milk, etc.). Would highly recommend any parent who needs to send their child to infant care to consider this place!",2 months ago,,https://www.google.com/maps/contrib/115622167200226816192/reviews
Rebecca Teo,5,"Enrolled our twins at Small Wonder@ Dundee since last year July when they were in playgroup. They’ve grown a lot and have gotten more independent and teachers are always attentive to them and gives us timely updates.

Tr Joyce and Zhou Laoshi from their PG and now with Tr Saranya and Li Laoshi in their N1 class. Tr Saranya gave us nice updates on their first day of transitioning them to full day. Although the preschool is a little small, the teachers are warm and caring which makes for a very positive experience. Thanks also to Principal Fiona for always being there at pick ups and drop offs and knowing every child by name 🧡",3 months ago,,https://www.google.com/maps/contrib/114820383452144136971/reviews
