author_name,rating,text,relative_time_description,reviewer_total_reviews,reviewer_profile_url
Sharifah Aidah Alhabshie,5,"My son enjoyed his very first lesson. He didn’t cry and was very comfortable with Coach Kidd. It looked like he was able to follow certain instructions and really liked the lesson. After the class, he told me he loved the lesson. Good job Smile swimmers! Highly recommended!😁",4 months ago,,https://www.google.com/maps/contrib/101034820932764567376/reviews
Elin Zul,5,"Awesome coaches, friendly, professional and very approachable.
Kids are comfortable with them. My 1st was w another company before this and i decided to swap and was surprised she improved drastically aft 2nd lesson (a technique she cldnt get right previously). Now she is steadily getting better.
Enrolled my 2nd kid soon after. N i dont regret, 2nd kid is enjoying himself n his water confidence is good now thanks to good coaches!
Highly recommended!",a month ago,,https://www.google.com/maps/contrib/102380061558369929771/reviews
Aini Sani,5,Coach Kidd and team are fantastic. My kids enjoy their swimming lesson and always looks forward to it. My son complete the 6 SwimSafer stages within 2 years. Smileswimmers provides a structured swimming program and makes the kids feel comfortable in water. I am very glad to have choosen Smileswimmers! Highly recommended.,a month ago,,https://www.google.com/maps/contrib/111625390393220335914/reviews
Huda Dali,5,All the coaches are good with kids and have patience with each child’s different pace & progression. My child was initially only comfortable with Coach Kidd however he adapt to the other coaches too and learn from them too. Truly appreciate their dedication and love watching the milestones my child achieved.,4 months ago,,https://www.google.com/maps/contrib/109619288885652569129/reviews
Widyawilis Selamat,5,"Coach Kidd and his team are great. My kids look forward to the weekly lessons very much. From fearing of not being able to float on their own, they can now swim independently with confidence, thanks to the coaches! Appreciate the good training from the weekly lessons!",4 months ago,,https://www.google.com/maps/contrib/109848464311620234213/reviews
