author_name,rating,text,relative_time_description,reviewer_total_reviews,reviewer_profile_url
Sammy Soong,1,Avoid coming to this carpark. You will not have a choice but to use the valet service. Even you park for 5 mins.,a week ago,,https://www.google.com/maps/contrib/101973858090677551447/reviews
Salam Mohamed Rafeek,2,"Given phone number aren't responded.
Called multiple times for an emergency advice on post surgery issues.
The worst part of medical service",5 months ago,,https://www.google.com/maps/contrib/110687269403328120654/reviews
Juz Ng,1,Worst hospital layout. After drop off you need to park at a car park that's  about 15mins walk to car park. If it rains its even worst. Finding the pickup location also difficult and traffic issues. To many curvy route to go to the pick up location. Pick up area are small and short and easily jam up to the main road. Even taking grab also difficult to drop off.,a year ago,,https://www.google.com/maps/contrib/108441941737551756129/reviews
Sunny Sun,1,"Waited close to 2.5hrs to see doctor for less than 10mins.. Poor scheduling by the clinic. Nurses have bad attitude as well. Malay nurse got impatient with my mum during eye assessment and was rough while applying eyedrop. When we asked another nurse to check on our queue, nurse said okay but did not even bother coming back to update.

Come if you want to waste your time and money. DO NOT recommend at all.",2 years ago,,https://www.google.com/maps/contrib/108770645571193014021/reviews
Gan Melvin,1,"Brought my mum eye consultation. Worst experience, just because we are subsidised by gov. We get subsidise service. Tell us to be patience. But when the team consultant came to talk to us, he was in a hurry. Even before we can confirm what lens to use, came another consultant also in a hurriedly manner. Only thing focus on telling us is, risk. 🤦‍♂️",a year ago,,https://www.google.com/maps/contrib/105269724458549788182/reviews
