author_name,rating,text,relative_time_description,reviewer_total_reviews,reviewer_profile_url
zj,2,"While the food is generally good, the china lady from the drink stall has a bad attitude.
She always puts on a black face and uses an impatient tone as if you owe her money. $2 for an iced teh and price not being shown anywhere is a red flag.
Get the food but skip the drinks.",6 months ago,,https://www.google.com/maps/contrib/111766253586863129545/reviews
Adam Pang,4,"Newly revamp
Now kopi got promo",a year ago,,https://www.google.com/maps/contrib/107864589264871088972/reviews
Kelvin Teo,4,"Great place to dine in, variety of choices, spacious carpark, Fan ventilated coffeeshop",2 years ago,,https://www.google.com/maps/contrib/107858420908005296405/reviews
Clive Gwee You Young,4,Only had a cup of tea. The view is good to car watch.,a year ago,,https://www.google.com/maps/contrib/101883188691173001150/reviews
Plastic Luv,5,The stir-fry here is very fragrant,in the last week,,https://www.google.com/maps/contrib/113579397506224215979/reviews
