author_name,rating,text,relative_time_description,reviewer_total_reviews,reviewer_profile_url
Joelle Pang,5,True-blue speakeasy cafe based out of Delun's home! Barista roasts his own beans and you won't be able to get his coffee anywhere else. Wife Approved beans are my favourite - tasting notes of fruit wine and oolong comes to live! Remember to make an appointment and also be patient when finding Blk 634A. Totally worth a visit! ☕️,2 weeks ago,,https://www.google.com/maps/contrib/112071853536212660441/reviews
Shuwen Lou,5,"Easily one of the best coffees I’ve had—smooth, rich, and expertly brewed. The owner’s passion shines through, not just in the coffee but also in the beautifully designed, customizable packaging. Even non-coffee drinkers are in for a treat with his amazing specialty drinks. Perfect for a treat or a unique gift!",3 months ago,,https://www.google.com/maps/contrib/105687779340210647661/reviews
Desmond Foo,5,"If you're looking for a truly unique and memorable coffee experience, look no further than Spilled Roaster & Brews. This cozy little gem hidden in Tampines North offers an immaculate vibe that instantly makes you feel at home.

The owner, Delun, is the heart and soul of this place—friendly, approachable, and incredibly knowledgeable about coffee. What makes Spilled truly special is that he roasts his own espresso beans in-house, operating a micro roastery that allows him to experiment and craft his own unique blends. His passion for coffee is evident in every sip, and it's clear that he puts his ❤️ into every step of the process, from roasting to brewing.

The coffee here is simply divine—rich, flavorful, and expertly crafted. Whether you're a coffee connoisseur or just someone who enjoys a good brew, you'll appreciate the care and creativity that goes into each cup.

Overall, Spilled Roaster & Brews is a must-visit for anyone who appreciates great-tasting coffee, a cozy ambience, and a touch of creativity. The combination of a micro roastery, unique blends, and the owner’s warm hospitality makes this place truly one-of-a-kind. I can't recommend it enough!",2 months ago,,https://www.google.com/maps/contrib/106890905807224119544/reviews
Yongliang Lim,5,"An absolute gem! Always a delight to support home businesses. His coffee-making skills are on par and even better than cafe standard. My go-to order is usually ""wife approved"" and ""nut bar"" — coffee temperature has been consistent. The warm and welcoming atmosphere makes every visit a pleasure. Highly recommend this place to anyone looking for great coffee and friendly service! 😀",3 months ago,,https://www.google.com/maps/contrib/106637942036818763577/reviews
WC Tok,5,"Spilled Roasters and Brews is a true gem! Their cafes feel like a warm hug, with a cozy atmosphere that's perfect for relaxing or catching up with friends.

The coffee is consistently amazing, whether you're enjoying a latte at the counter or brewing their beans at home. Spilled Roasters surpasses the typical cafe experience in every way – the quality, the ambiance, it's all top-notch.",3 months ago,,https://www.google.com/maps/contrib/113321646451267511923/reviews
