author_name,rating,text,relative_time_description,reviewer_total_reviews,reviewer_profile_url
Srd G Bains,4,"Visited during thaipoosam day
Could not visit temple but got some memories n updates
On this day cannot visit temple for normal prayer should follow the troop who carries the milk pot

Entire way got food , water n Buttler milk distributed to the diety",3 months ago,,https://www.google.com/maps/contrib/100632680324370910290/reviews
Thiyagarajan RRS,1,"I went to this temple on 11 Feb 2025 to participate in the Thaipusam festival. However, the way the Hindu Endowment Board and temple management had planned many stops causing unnecessary delays along the way and to add there was a crowding (see photos) at the last stretch leading to temple. Hence, under the blazing sun with no natural shelter normally provided by the trees (the trees were cut the week before) many devotees suffered dizzy spells, fainting and some required first aid and ambulance assistance. The crowding was seen at the last stretch before the temple, however, the first aid post was set up far away beyond the temple entrance - poor planning. Lets hope they put in a bit more effort to think carefully to plan properly and do a good job in future.",2 months ago,,https://www.google.com/maps/contrib/101321436890106268117/reviews
Gopalan Rajamani,4,This temple built in early 19th century is worth visiting once if you are in Singapore.  Nattukottai Chettiars were into financing business.  They had done a lot in the development of Singapore.,3 months ago,,https://www.google.com/maps/contrib/113671249199404619870/reviews
Jonathan Hillier,5,"Just visited, was very impressed, I know these places aren't carering for non m-Hindus but a guide on proper etiquette would have been helpful(there is a basic list of don'ts at the door, but something more descriptive would albe appreciatee)",3 weeks ago,,https://www.google.com/maps/contrib/103715102915584640829/reviews
Gabriellius Le,5,"Sri Thendayuthapani Temple, located on Tank Road, is one of Singapore's oldest and most revered Hindu temples. Built in 1859, it is dedicated to Lord Murugan and is a significant site during the annual Thaipusam festival, where devotees carry kavadis in a show of devotion. The temple's intricate architecture, featuring beautifully carved pillars and a richly decorated gopuram, reflects the Dravidian style. Inside, the serene atmosphere invites quiet reflection and worship. The temple is a must-visit for those interested in Singapore’s cultural heritage, offering a glimpse into the city's vibrant Indian community and spiritual traditions.",7 months ago,,https://www.google.com/maps/contrib/116576851611807790661/reviews
