author_name,rating,text,relative_time_description,reviewer_total_reviews,reviewer_profile_url
Santosh Ojha,2,"It's not that great and taste is not that great. Just a fast food place and for chinese chefs to get their fried rice wrong , must be very bad. They gave some deep fried item in our veg meal, not sure,.what do they use to deep fry. It's expensive but food doesn't stand for the price. There was simple ask salt pepper and were not able to find in complete store and didn't see any interest from staff to locate.Staffs are rude, My experience was not great and least recommended place to go.",6 months ago,,https://www.google.com/maps/contrib/110172574477303134392/reviews
Dadz Perez,5,The food is good and the place is clean and comfortable.great service and nice place to chilled with my family. shirley is very friendly when i approach her to ask for some recommendation rides. thanks so much,4 months ago,,https://www.google.com/maps/contrib/115182715116575989847/reviews
秀慈,5,Ordered their Christmas set meal the food is really good and i glad I made the right choice to enter Starbot cafe to give a try. Shirley service is very warm and friendly. Thanks you 😊,4 months ago,,https://www.google.com/maps/contrib/100837696633030824533/reviews
Ericka Delos Santos,5,"Let’s start with the service - the staff were so polite  and greeted us with a big smile :) when we first enter. She led us to our table and make sure we are comfortable. I like SYLVIA service and she is really great staff to have.

Food - the food serve was hot and the portion is big enough to share with my kid. The ice cream portion is big too. My kid enjoys it and will be back again for the ice cream 🥰",4 months ago,,https://www.google.com/maps/contrib/103026070331783397529/reviews
Michelle Felicia Terence,5,"Very clean! good ambience, like we’re at the space. kids definitely love it.
very nice food and my son loves it! all the staffs are very kind and friendly to kids. love having our meal here while we’re at USS.

especially thank you Shirley for helping us and being so kind to us and giving my son a watermelon juice!",4 months ago,,https://www.google.com/maps/contrib/111088321183735340651/reviews
