author_name,rating,text,relative_time_description,reviewer_total_reviews,reviewer_profile_url
Kevin G,3,"Typical Starbucks offering, usually very busy because it’s on the 1st floor of mount Elizabeth hospital.
Only standout is the huge mural along the wall which is very colourful",7 months ago,,https://www.google.com/maps/contrib/107684922467773822165/reviews
Mohana Devi,1,"I visited this Starbucks outlet on Saturday, April 5, and was disappointed with the experience. There were two staff members working at the time. I usually order a White Chocolate Mocha Frappuccino, and at every other Starbucks I’ve been to, it’s consistently served with a light brown (beige) color. However, at this location, the drink was completely white and tasted much sweeter than usual—almost like pure white chocolate without the mocha

I politely pointed this out to the staff and even showed them reference pictures from previous purchases and online. I suggested they try a spoonful to understand the difference, but unfortunately, they were dismissive and asked unrelated questions. One of them even questioned whether I had tried this drink in Singapore, which felt quite disrespectful (the way she asked).

Eventually, I asked for a refund, but after some internal discussion, one of the staff members remade the drink—albeit in a visibly frustrated manner, banging items as she worked. The second version of the drink was finally what I’m used to and expected.

While I appreciate that the issue was eventually resolved, the overall service experience was not up to the standard I associate with Starbucks. I hope this feedback can help improve service and consistency in the future.",a month ago,,https://www.google.com/maps/contrib/109599876201948052467/reviews
Drew Esa,5,"Nothing surprises me in Singapore anymore😉 Even the hospitals here look so that patients are not scared. You walk into Mount Elizabeth Novena Hospital like a hotel with a lobby and a bar. Except instead of a bar, it's a chain Starbacks. It's a great idea when a hospital is a place where people go for a coffee, a snack and a chat, not for diagnostics or операцию✌️ And Starbucks is as good as ever, it's the best chain coffee shop in the world with excellent quality drinks and food.",10 months ago,,https://www.google.com/maps/contrib/100231074350729929090/reviews
Angel Samson,1,"I feel that Starbucks serves customers differently based on who they are. I placed a mobile order using the app, selecting Grande and applying a free size-up voucher, assuming it would upgrade to Venti. I didn’t know I had to select Venti first before applying the voucher, as I’ve only used the app twice.

When I arrived, I was given a Grande drink, and when I asked if I could cancel the voucher to use it next time, the manager claimed I had ordered a Tall, which was completely false. I clearly paid for a Grande and expected the size-up to Venti, as I don’t think the app even allows upgrading from Tall.

As I was explaining my concerns, I noticed a barista looking at me while asking her colleague what the problem was—as if I had done something wrong. The service was very slow, and I would understand if they were busy, but they weren’t even rushing. What made it worse was that I saw another customer having their drink changed, and the barista thanked them nicely, but when my drink was handed to me, she didn’t say anything.

To top it off, they intentionally gave me a Frappuccino lid for a non-Frappuccino drink, which makes no sense since they should know what lid goes with what drink. On top of that, the drink tasted completely different from what I had the day before.

It’s frustrating to pay for something and not even get basic service or consistency. This experience felt biased, unprofessional, and disrespectful.",2 months ago,,https://www.google.com/maps/contrib/117742169369034595192/reviews
DR DAVY GOH,5,"Surprisingly it was one of the busy Starbucks. With the patients and visitors, not forgetting the staffs of the hospital, during peak hours.
Can be very busy.

Service was good- their standard service.
And the food was good too.
The staff did her part to ask if I wanted jam or butter to go with my food.

Overall experience was good.",3 years ago,,https://www.google.com/maps/contrib/100178836333366849641/reviews
