author_name,rating,text,relative_time_description,reviewer_total_reviews,reviewer_profile_url
Marcus Tan,4,"We decided to have our Sunday morning kopi at Star Corner Cafe at Buangkok.

Star Corner Cafe is a small coffee shop that’s located near the NTUC Fairprice. Due to its location, we think most people could miss it easily as there’s a Kopitiam nearby, and another hawker centre in Sengkang Grand Mall that is directly across the road.

We ordered quite a few things here:

* Kaya butter toast set with Milo Gao Kosong
* 2x Teh Gao Siu Dai
* Fried beehoon with sunny side-up and Taukwa
* 1x Chicken bun and 1x Char Siew bun
* 1x Siew Mai and 1x Har Gao

We think what’s really outstanding here is the kaya butter toast set - it’s thick, well toasted with the right crisp and the kaya spread was adequate (not too much, not too little) and not too sweet. The hot teh Gao siu dai was solid as well; in fact one of the better tasting hot beverages in the area. Interestingly, the milo gao kosong was thick but a little sweet (?) despite it being “kosong”.

Fried beehoon was surprisingly good! It tasted exactly like how we like it - savoury without the taste of the veggies overpowering it. But we found that it was a bit cold - would be much better if it was served hot!

Steamed buns were quite average. The dim sum was slightly above average compared to those that you see at Koufu or Kopitiam, but definitely cannot beat the homemade dim sum that you can find in those dim sum specialty restaurants.

Will we drop by again? Definitely!",a month ago,,https://www.google.com/maps/contrib/114358279135892939279/reviews
andyloe,5,"Hidden Breakfast Gem Opposite NTUC. Tucked away in a cozy outdoor corner, this unassuming breakfast spot offers a great variety of local delights at wallet-friendly prices. The white bee hoon was packed with flavor and came with a generous slice of luncheon meat, all for just $3—a steal for such a satisfying meal. Pairing it with a smooth and aromatic Kopi O at $1.20 made for a perfect start to the day.

What stood out beyond the food was the friendly stallholder, who warmly shared that customers can conveniently order both food and drinks in a single queue—saving time and hassle. With its relaxed atmosphere and welcoming service, this spot is definitely worth a visit for a fuss-free, delicious breakfast.",2 months ago,,https://www.google.com/maps/contrib/110109116555826289679/reviews
Leo Chin Khim,5,"Superb coffee, best we had in a long time! The breakfast set comprising coffee/tea, toasted bread and runny eggs suits our taste and cooked to just right. Service was great and friendly. Overall, a must come if you are in the vicinity! Double thumbs up 👍 👍",4 months ago,,https://www.google.com/maps/contrib/108333416819414524144/reviews
Asia Apparel,4,"Good local alfresco coffeeshop for you to take a rest from the ntuc grocery coffee. Very local feel. Serves lots of breakfast choices from kueh, dim sum, bee hoon, eggs and kaya toast. Kopi C korsong very good.",2 months ago,,https://www.google.com/maps/contrib/112168507594751691491/reviews
Sunny,1,The lady staff is very rude not friendly and black face. Tea very thin and tasteless. I visited the stall on 20 February 2025 around 10:30am. The lady staff prepared the tea in a cup for dine in and I said  I want to take away. The lady replied that I never mentioned with very bad tone. Then I check with her whether are they selling char siu pau or not she never answer me then collected 3 dollars from me and get me one pcs of pau. Bad experience will never come back to this stall again.,3 months ago,,https://www.google.com/maps/contrib/101766110465208311044/reviews
