author_name,rating,text,relative_time_description,reviewer_total_reviews,reviewer_profile_url
Gator,4,A relatively new mall but served the region well as there wasn’t many things yet. The supermarket located here is big and well stocked. Could find most of the items that we were looking for. There is also a seven eleven within the mall. DIY shop is located on level two. There is a caring pharmacy too. Clean washroom and ample parking facilities as well. Spotted some eateries around the mall too.,11 months ago,,https://www.google.com/maps/contrib/114331842318070680564/reviews
p vui ming,3,"no much shop inside mall here, but still can find jaya grocer supermarket, pharmacy, diy shop and some restaurants like sushi house, pizza... convenience enough for residence and airbnb stay beside.
get more restaurants including starbucks, about 400~600meter from this mall. try korea bbq there, which quite nice taste.",a week ago,,https://www.google.com/maps/contrib/118066880541193504041/reviews
ani mahadi,4,"This mall is clean and looks new. But not so many stores open. It has Jaya Grocer as main tenant. Also got old town, pharmacy, and few restaurants. And you can get free parking.",3 months ago,,https://www.google.com/maps/contrib/117016235871556295112/reviews
Grace Tan,3,"To the management of Sunway Citrine, do ensure the playground is clean especially if children are required to remove their shoes. Please consider putting some fencing so animals cannot freely use the playground as a toilet.",7 months ago,,https://www.google.com/maps/contrib/113078308365751765354/reviews
Arfhartoe Marcello,3,Small mall. Open air concept. Not many shops open yet. Jaya Grocer supermarket is the anchor tenant. I will come back to hang out at Awesome Brew. This place looks great.,6 years ago,,https://www.google.com/maps/contrib/118214214200179601076/reviews
