author_name,rating,text,relative_time_description,reviewer_total_reviews,reviewer_profile_url
Charm McC,5,We loved Super Genius! It was quite a trip from our home but it was all worth it because the teachers prepared my son very well for Kindergarten 2 in a bigger school. Now he is thriving and have changed so much from when we moved here one year ago. I believe that letting him attend Super Genius has immensedly contributed to the progress that he has achieved! We miss you Teacher Wei and all the teachers! Terran is making waves in his new school and reads and write well now! He also speaks Mandarin randomly in the house. Thanks to you all and all your efforts!,2 months ago,,https://www.google.com/maps/contrib/100114145512140725130/reviews
Louies Tan,5,"Great preschool for the children!!

We did a centre tour in 2020 (just before the Circuit Breaker) after visited a dozen of other preschool in the area... we fell in love with the place and their pedagogy immediately!

SuperGenius provides a spacious environment (plenty of rooms and space for the children to move around in their learning journey) with committed teachers whom understands the different needs of the LOs at various stages!

Oh, I do have to mention that my LO slipped and fall during the centre visit (minor knock) and was immediately attended to with a ice bag.. after we left, we saw Principle Juvina and her staff examining the scene again and... on the next day, I saw the area revamped with child safe furniture!

Special mentions to Teacher Sandy, Nadia, Jolene, Alice, Othman, Miguel and Estelle! They have made my LO's experiential learning journey a positive one!",3 years ago,,https://www.google.com/maps/contrib/100157220043933474201/reviews
Diana Zulkifli,5,"My son has been with the school since playgroup and is now in nursery. As parents, we've witnessed impressive growth in his communication skills, grasp of the alphabet, and basic ethical behaviors. The school fosters positive reinforcement, setting an excellent example. When we're with our peers, the noticeable improvement in his communication and gestures stands out. Despite the higher tuition fees, we wholeheartedly recommend SuperGenius as a solid foundation for his development. The parent-teacher Zoom meetings are beneficial for tracking his progress, and the staff are always cheerful and accommodating during handovers and pickups. Instead of relying on multiple school enrichments, SuperGenius serves as a one-stop platform for ensuring all the basics are met. Highly recommended, Good work Teachers and staff’s! 👍🍍🍍👍",9 months ago,,https://www.google.com/maps/contrib/108944880600030015143/reviews
Jasline Ng,5,"My girl has been attending different enrichment classes at SuperGenius since a year ago! The enrichment center is bright and clean and with great facilities. I like their teaching style and my girl is enjoying herself very much. She learns alot through play, learning the different alphabets with real items eg. Fish, Egg etc.",3 years ago,,https://www.google.com/maps/contrib/115128703732960816849/reviews
Dan Li,5,"I seldom make right decision in my life but sending my baby daughter to SuperGenius is one of the exception. Before we join here, we already look for a few places and here’s environment I can say it’s the best compare to the area nearby. Principal Juvina gave us a warm welcome and host the virtual tour efficiently. Teachers are also professional to take care my baby. From the daily care/physiological needs to the course(vision/cognitive learning) they teach so that my little one can have a well development through these learnings. Highly recommend this institution to all parents.",3 years ago,,https://www.google.com/maps/contrib/109917758512199325059/reviews
