author_name,rating,text,relative_time_description,reviewer_total_reviews,reviewer_profile_url
Djoeis Shi,4,"This condominium has many stairs. 1 block is divided into 2 parts with different lifts.
The pool is near the end of the estate.",9 months ago,,https://www.google.com/maps/contrib/111128052716293687431/reviews
Adelina,1,"Horrible. Very noisy. Cockroaches and rats are swarming around the estate, attracting python snakes in search for food. Do not recommemd",a month ago,,https://www.google.com/maps/contrib/110745689729288045972/reviews
rosp,1,Overpriced condo that turns slowly into dormitory; went from 5 ( 2018 ) to 1 star,4 months ago,,https://www.google.com/maps/contrib/117677391148859853565/reviews
Jacqueline Gwee,5,"Beautiful, sprawling grounds nestled on top of a hill. Feels like I’m in a castle!",3 years ago,,https://www.google.com/maps/contrib/109335750423848546246/reviews
Eek,5,"Taking a visit back here after all these years seems like a trip back to an idyllic time, when I came home each day to a peaceful town safely isolated from the busy world lying just beyond it's groomed shrubs and cream coloured walls. Very thankful indeed for the days I spent here during my early childhood!",8 years ago,,https://www.google.com/maps/contrib/104209424352791082534/reviews
