author_name,rating,text,relative_time_description,reviewer_total_reviews,reviewer_profile_url
Jun Er,4,"A little shop serving Taiwanese delights. Surprising extent of menu, and very friendly owners. Serves a formidable array of alcoholic options. Grade A for hygiene. Definitely a gem of a find.",5 years ago,,https://www.google.com/maps/contrib/109665576931304830824/reviews
Martin Lee,4,"A simple small shop the food isn’t bad
In an old estate where I used to stay
The Chicken Just alright
Nice Hash brown through",a year ago,,https://www.google.com/maps/contrib/114073048745821714183/reviews
Stella “Aokihoshi” Summer Bluemoon,5,The store owners are highly friendly and will often talk to their customers. I am generally surprised to find such a wonderful place amongst residential estates!,5 years ago,,https://www.google.com/maps/contrib/106174248219933920047/reviews
Vishveswaran Sivakumar,5,"I bought popcorn chicken and oreo ice blended.
It was so tasty and delicious. I will definitely buy again :)",4 years ago,,https://www.google.com/maps/contrib/102225441701589730960/reviews
Ying Wu,2,"The food is delicious, but a small portion of chicken steak costs 8 Singapore dollars, which is basically a robbery. It’s so delicious that I won’t be able to come back again!",2 years ago,,https://www.google.com/maps/contrib/100999653166351798206/reviews
