author_name,rating,text,relative_time_description,reviewer_total_reviews,reviewer_profile_url
Yi Ling,4,"An unassuming crowded neighbourhood shopping centre here.

It's a good in between of old and new. Ventilation is pretty good and very interesting because of shops. There are 2 food courts here and traditional bubble tea shops and snack shops as well. Car park is in the basement with beautiful plants basking in the natural sun. Kids running in the designated playground.",a year ago,,https://www.google.com/maps/contrib/115707001285123682601/reviews
Ayi KW,4,"The shopping centre is left with some kiosks still on business. The building was old and incomparable to those new shopping mall. But still a place to go for food, grocery and market for nearby housing. Bus access is convenient to and from MRT station. And there is a mosque just a side.",7 months ago,,https://www.google.com/maps/contrib/104367576393154426307/reviews
Andrew Ho (何德财),3,"A sleepy old neigbourhood shopping centre at the older part of Jurong. Not much people walking around but it's bustling in the morning due to the close proximity to the market and food centre next door.
There are 2 food courts, a supermarket and a variety of shops offering different service and products for all needs and wants.
The only shop with the best business is the 4D LOTTERY. Who doesn't wanna get rich??! 😅",a year ago,,https://www.google.com/maps/contrib/117281057664754523775/reviews
Ezee Sharil,5,"This heartland shopping centre has the basics that residents require. Convenient stores, mom and pop shops selling household items, fast food, food courts, barbers and hairdressing salons. Simple and uncomplicated concept.",5 months ago,,https://www.google.com/maps/contrib/103925746266505310436/reviews
Pearl Chan,5,"My all time favorite BCM place! One of the best one! Legit! It’s first place in my personal BCM ranking XD There’s a unique taste in the BCM.. rem to add more vinegar! And the soup is very flavorful too!
⭐️⭐️⭐️⭐️⭐️",7 months ago,,https://www.google.com/maps/contrib/106653581576120991754/reviews
