author_name,rating,text,relative_time_description,reviewer_total_reviews,reviewer_profile_url
Jia Yi Ong,5,I visit this clinic for my annual health checkup. They offer very comprehensive packages and deliver results in a timely and secure manner. The doctor takes the time to review the report in detail with you. The staff is also tremendously friendly and helpful!,a month ago,,https://www.google.com/maps/contrib/110939095884078282803/reviews
F. E. Urquhart,5,This is my repeat visit here to do the AHT. Called the clinic to confirm the opening hours before coming. Came at 2.20pm on a Thursday so there was no queue at all. Dr Mark Chin was polite and objective. Test results came out in 10 minutes. Swift and no frills. Honestly don't quite understand the low ratings here haha.,5 months ago,,https://www.google.com/maps/contrib/102768838174908440099/reviews
Rafe,5,"Dr Kwek is very nice and understanding. It was new year eve and the clinic is suppose to close early. Though busy, i only waited for a few minutes.",5 years ago,,https://www.google.com/maps/contrib/109244700585541428665/reviews
Jean Guegue,1,Opening at 8am30 with a doctor arriving at 9am. I guess I should feel glad that the clerk said it upfront,5 months ago,,https://www.google.com/maps/contrib/108104022470465262505/reviews
H,5,"Convenient clinic that’s located in Tanjong Pagar plaza. Contrary to the other negative reviews, my experience there was pleasant.

Receptionists were polite and prompt. Dr Kwek conducted the consultation in a non hurried manner and was patient and detailed in explaining.",a year ago,,https://www.google.com/maps/contrib/110978578711128478827/reviews
