author_name,rating,text,relative_time_description,reviewer_total_reviews,reviewer_profile_url
Donald Chan (Spice Like Us),5,"Despite the long travel time, I have been coming to this clinic for over 15 years for aesthetic treatments. The staff are always friendly and helpful. Dr. Janet is exceptionally warm and professional. she always recommends treatments that are best suited to my needs.",2 weeks ago,,https://www.google.com/maps/contrib/114648170427987673205/reviews
Bee Choo Tay,5,"I have been seeing Dr Janet for the past 20years. A professional, caring doctor whom I can trust. Otherwise, I would have stopped seeing her long ago. Attentive and listens patiently. Gives good advice. Adopts a Holistic approach to treatment. Her team of receptionist are efficient. Knows their patients well. Friendly and approachable.",2 weeks ago,,https://www.google.com/maps/contrib/106281237051380183889/reviews
Ernie blushes,5,"I have been visiting the clinic for years and this has been our family preferred doctor. Dr Janet has always been the best. She would always listens to our medical conditions and gives positive advises with the correct prescriptions.
The clinic assistants are all very helpful and friendly.",a week ago,,https://www.google.com/maps/contrib/106294297441411260978/reviews
Siti Aishah Jamail,5,A good place to get treatment. Doctor will give a thorough check up. Just be prepared to wait a little longer by ut worth the wait.,2 weeks ago,,https://www.google.com/maps/contrib/105834683134245919970/reviews
Ching see Lau,5,Dr Janet Lee is a great family doctor with many years of experience and up to date medical knowledge. She is always warm and gives good medical explanation and advice. She also does not over prescribe .Her staff members are also efficient and speedy in dispensing medications with clear explanations. Highly recommended clinic!,3 weeks ago,,https://www.google.com/maps/contrib/110189879502608226935/reviews
