author_name,rating,text,relative_time_description,reviewer_total_reviews,reviewer_profile_url
Forest BK,5,"Not far from Adventure Playwoods and Rolling Hills, is Tembusu Lawn.
It's an open field where visitors can enjoy the expansive open space.
Sunlounger seats are strategically located by the Lawn.",a month ago,,https://www.google.com/maps/contrib/116448453673911455728/reviews
Ivan Tan (FireFox),4,New park in Bidadari full of young families and pooches. One can find a children's playground here too.,a month ago,,https://www.google.com/maps/contrib/117659783939101213413/reviews
k ryu,5,"Watch birds while sleeping! There is a tree where birds often visit.

Several types of birds, including kingfishers, come and go.

Recommended for people who want to have fun watching birds! Binoculars required",3 months ago,,https://www.google.com/maps/contrib/102127497832735219175/reviews
