author_name,rating,text,relative_time_description,reviewer_total_reviews,reviewer_profile_url
Adrian Koh,5,"I'd like to extend my warmest appreciation to the incredibly talented Chef Lynette and Chef Jedidiah! Their professionalism and expertise in their craft are truly impressive.

I must say, executing Korean-inspired cuisine in a fine dining setting is no easy feat, but they've managed to pull it off with flair. Their dedication and passion for their work are evident in every dish they create.

Great job, Lynette and Jedidiah! Keep up the fantastic work!",2 months ago,,https://www.google.com/maps/contrib/112406855299738923618/reviews
Xin,5,"We had the 3 course dinner for my partner's birthday at That Chefs Couple on Saturday and everything was scrumptious. My partner and I are pretty picky eaters and I did not expect to enjoy some of the flavours (celery soup, Pea & dill puree) as much as I did, but every dish's flavour went so well together and harmoniously I put aside my bias against those ingredients.

The halibut/scallop dish was fantastic and both seafood was super well cooked and paired with the miso infused butter was a match made in heaven

Highly recommend if you're looking for a private dining experience! Chef Jedidiah was very friendly as well and the service was really good",3 months ago,,https://www.google.com/maps/contrib/108901915052431124843/reviews
M S,5,"We had the absolute pleasure of having Chef Jedidiah and his wife, Chef Lynette, cook for my husband's 30th birthday, and it was an unforgettable experience! From start to finish, their attention to detail and culinary expertise blew us away. I was initially concerned about how the food will turn out since it’s Omakase style and we didn’t know the menu beforehand. We were delightfully surprised as the menu was perfectly curated, starting with a rich, flavorful tomato bacon bisque, followed by a vibrant burrata with pesto. The squid ink aglio olio with gambas prawns was a beautifully executed dish that left us all wanting more.

But the true standout was the pan-seared ribeye with cognac miso cream. My husband is a big fan of steak, and this dish was an absolute showstopper. The flavors were perfectly balanced, and it was cooked to perfection—my husband was beyond thrilled. Chef Jedidiah truly captured all the flavors my husband loves and brought them to life in the most spectacular way. I also love how we managed to interact with them during the entire experience and learned a lot of culinary tips too!

The entire dinner was nothing short of magical. Both Jedidiah and Lynette were professional, personable, and made us feel so comfortable in our own home. I cannot recommend them highly enough and this is worth every penny in my opinion. If you're looking for a truly private and personalized dining experience, you won’t regret booking Chef Jedidiah and Chef Lynette. They truly made my husband's birthday a day to remember!!",a month ago,,https://www.google.com/maps/contrib/114134774994389420234/reviews
Neo Robyn,5,Enjoyed the interesting curation of the various dishes - it was fun for our taste buds and definitely a wonderful experience to remember by. Thank you to That Chef Couple for the warm service and very thoughtful meal. Definitely trying their food again for new surprises!! 😋,a month ago,,https://www.google.com/maps/contrib/103380490559573435700/reviews
Elijah Wong,5,"We spent a beautiful Valentine’s Dinner at their house, which was so cosy and it gave us the quiet space to share! (We requested for a quiet dinner evening, which Jedidiah and Lynnette respected and created such a quiet space for us!)

The food was spectacular, and every dish was crafted with care and intentionality, and they also explained to us each dish as they served the dish to us.

Thank you so much for hosting us and giving us a beautiful evening!",3 months ago,,https://www.google.com/maps/contrib/101311376414661967943/reviews
