author_name,rating,text,relative_time_description,reviewer_total_reviews,reviewer_profile_url
Sarah Pang,5,"I am a professional tennis player and have worked with many therapists around the world.  I have struggled to find a fitting osteopath to work with since my previous practitioner left Singapore during Covid.

That is, until I met Irqa.

There are some clinicians who can be technical in their work, and others who do magic. Irqa is a miracle worker and every session with her unlocks a deeper level of healing, and subsequently performance in my body. I think most impressively, was an injury I was working through. I  was so sore, I couldn't even lift a car boot! Irqa worked her magic on me and in three weeks, I was able reach the finals of the nationals, and most importantly, play pain free.

I could not recommend her enough.

P.S. I also appreciate how cost efficient and simple the clinic is. No frills, just pure, straight up treatment.",2 months ago,,https://www.google.com/maps/contrib/114579736302414188327/reviews
Sakshi Gopal,5,"We saw Greg today. True to the testimonials earlier, he really is amazing. The true ""baby whisperer"". He cleared all our concerns very calmly and was so gentle with our baby. I even felt a little bit jealous that my baby was so happy with him.",4 months ago,,https://www.google.com/maps/contrib/111765016385966829368/reviews
Natasha Volante,5,"Very knowledgeable, dedicated and caring  osteopaths I have gone to for over a decade.   Recently I had the pleasure of working with Marina and Iqra as Paul has been travelling. These ladies  brought their individual skill set to help me with my neck issues, working tirelessly week after week and I certainly can feel a big improvement. I’m so grateful for them. Thank you for your healing touch.",8 months ago,,https://www.google.com/maps/contrib/104400609083582118836/reviews
Adelphia Lim,5,"I can't express how grateful I am for Iqra at The Osteopathic Centre! After suffering from pulled nerves and persistent lower back pain, I was in desperate need of relief. Iqra worked wonders in just two sessions. Her expertise and gentle approach made a world of difference, and I left feeling so much better. The care and attention I received were exceptional. If you're struggling with any kind of pain, I highly recommend booking an appointment with Iqra.",10 months ago,,https://www.google.com/maps/contrib/107716036069562865972/reviews
Ann Ng,5,"I highly recommend Iqra Kazee for anyone dealing with muscle or joint issues. I recently visited her for a hip strain, and her expertise and care were exceptional. Not only did she accurately diagnose the problem but her treatment plan was effective and tailored to my needs. After a few sessions, I felt significant improvement in mobility and pain relief and very happy to be able to squat again!",11 months ago,,https://www.google.com/maps/contrib/105805161557600261078/reviews
