author_name,rating,text,relative_time_description,reviewer_total_reviews,reviewer_profile_url
Alexis Herrera,5,"We stayed in the Scarlet Hotel for just one night  to be able to visit Singapore.
The hotel is very well located with public transportation within few meters (subway, buses).
Yes the rooms do not have windows. However, they are not small and they have their charm. It was also very calm, we didnt hear anything from the street or wherever. Beds and furnitures are of good quality.
For us, the major positive point for this hotel is the staff. They are all incredibly helpful ! The hotel kept our luggage until late at night before our flight. We really enjoyed our stay there and would recommend 100%",2 months ago,,https://www.google.com/maps/contrib/107328626002014313268/reviews
Jess.Z W,1,"Don’t book if you care about check in time.

Tried to check in earlier than the normal check in time (2pm) The manager told me he would try. And something should open by 1pm.

Fast forward to 2:40pm, 40 mins past the normal check in time, I was still waiting in the lobby could barely sit straight due to jet lag and the 13 hour flight I just got off from in the morning.
The good thing was: after my third time checking with them on what time they could get the room ready, they offered me an alternative room to rest until my booked room is ready.",2 weeks ago,,https://www.google.com/maps/contrib/118318812736206730600/reviews
Antonio Maria Bovo,1,"Unfortunately, my experience with The Scarlet Singapore was extremely disappointing. I had made a booking well in advance, which was officially confirmed, but the hotel cancelled it without providing any explanation or offering an apology. I find this behavior highly unprofessional and disrespectful.

To make matters worse, I had chosen this hotel for a stay during a very busy period, so now it will be very difficult to find a suitable alternative without facing higher costs or having to settle for something less.

Customer service like this is simply unacceptable, especially from a hotel that markets itself as a high-end boutique property. I will never book here again and I do not recommend it to anyone.",a month ago,,https://www.google.com/maps/contrib/117655932565165944878/reviews
Simon Meyers,5,"Really enjoyed our stay here. The Scarlet is perfectly situated on the edge of Chinatown, and, more importantly, literally opposite the Maxwell food court/hawker centre. There are a couple of really great coffee shops nearby too, and the Maxwell MRT. Getting in from the airport was very easy, and we found it was the perfect location to explore from. Everywhere we wanted to go was relatively close and easy to get to. (Even the Gardens by the Bay which we found over priced and very touristy)

The room was small but the decor was nice, the bed was very comfortable with nice bedlinen. Staff were courteous and friendly, and, for Singapore, the Scarlet is good value.",3 months ago,,https://www.google.com/maps/contrib/104872386433884719110/reviews
The Glereans,2,"How disappointing...we booked 2 rooms for 4 adults.
We were on the mezzanine floor, out side our room was the outdoor spa which was under repair so couldn't be used. The rooms were much much smaller than the photos led us to believe. Also the rooms were at the back of the hotel where our view was a giant car park....The recommended roof top bar was a joke. Inattentive staff, no beer available (what !!) and if we wanted something to eat, which we did, they would have to order it in and we would have to wait around 45 minutes.
The only great thing was the location, Chinatown was only a couple of minutes walk. It looked great on the outside, the foyer looked groovy, BUT overall very very disappointing.",a month ago,,https://www.google.com/maps/contrib/114528119505455476137/reviews
