author_name,rating,text,relative_time_description,reviewer_total_reviews,reviewer_profile_url
Janine Marie,5,"A very sweet family business, with good coffee and tea on a warm day. To go in, just walk right into the clubhouse Incredibly chatty and good space to relax on your off day. The food is simple but a hearty meal. Support them if you can!",4 months ago,,https://www.google.com/maps/contrib/106387595053710136075/reviews
alexander choo,5,The fried rice and chicken chop tasted delicious! Will definitely come back!,4 months ago,,https://www.google.com/maps/contrib/115967681540290956078/reviews
Stephanie Liadinata,5,Family business with a good home cooked meal. The aunty is so kind and give us cookies.,2 months ago,,https://www.google.com/maps/contrib/106370872284263040378/reviews
Aaron Choo,5,"Delicious chicken chop, especially loved the sauce !",4 months ago,,https://www.google.com/maps/contrib/109713553548166257377/reviews
Samuel Wiggins,4,It is tasty and convenient,3 months ago,,https://www.google.com/maps/contrib/116885721526828583622/reviews
