author_name,rating,text,relative_time_description,reviewer_total_reviews,reviewer_profile_url
DAVE NG,5,"Great service, good beer and reasonably priced set lunches.",2 months ago,,https://www.google.com/maps/contrib/104655600975661471857/reviews
Josh Lim,5,Haven’t been to Hot Kitchen since they moved. This is my first time here. Not too crowded even though it’s lunch time. They have affordable lunch sets at $15.90. Topped up a bit for the beef steak which was nicely done. Ordered the chicken wings too. Quite filling. Service is good,2 years ago,,https://www.google.com/maps/contrib/100606910212221946176/reviews
ehs wol,4,"The set lunch was absolutely delightful, and the staff were warm and accommodating, taking the time to explain the menu in detail with great patience.",9 months ago,,https://www.google.com/maps/contrib/106822197528181846448/reviews
GWEN GOH,5,"Always live their food there . Friendly staff there too .. our usual hang out after work place for drinks & food . U can even ask for “special menu” (subject to availability, need to check in advance) 😉😝 you wont regret the food there !",2 years ago,,https://www.google.com/maps/contrib/112577287678394496543/reviews
Marc Woo,4,Great place to hang over draft beer and yakitori. Good sticks and pizza. Friendly owner and fast service. Noisy in the inside with large crowds. Otherwise a cosy place for a catch up,a year ago,,https://www.google.com/maps/contrib/115105251346240743102/reviews
