author_name,rating,text,relative_time_description,reviewer_total_reviews,reviewer_profile_url
Qing Rong,5,This is my farther shop but now is not I fill so sad😭😭😭😭😭😭,9 years ago,,https://www.google.com/maps/contrib/102039049581931951660/reviews
Tan K H,5,"Ting On Medical Hall (Chinese Medicine Shop) has moved to
Block 408 Ang Mo Kio Avenue 10 #01-797 Singapore 560408
Ding'an Medicine Store (Chinese Medicine Store) has moved to
Blk 408 Ang Mo Kio Lane 10 #01-797 Singapore 560408",7 years ago,,https://www.google.com/maps/contrib/115209407905832756422/reviews
