author_name,rating,text,relative_time_description,reviewer_total_reviews,reviewer_profile_url
Ernest Quah,5,"Excellent aftermarket service, very good to do business with.",a year ago,,https://www.google.com/maps/contrib/103264019537998002096/reviews
Jin Han Seah,5,"Best after-sales service and support - NC Series is highly recommended, running 10,000+ hours and not a single break down, 10/10",5 years ago,,https://www.google.com/maps/contrib/117882422574035660668/reviews
alex Lee,5,Good equipment supply company. Their JCM excavator is so reliable.,6 years ago,,https://www.google.com/maps/contrib/103728939613341300286/reviews
UIA QS,5,good customer service.,2 years ago,,https://www.google.com/maps/contrib/117242722274192352151/reviews
SAM T313,5,Excellent service! 👍,2 years ago,,https://www.google.com/maps/contrib/110515814701010830387/reviews
