author_name,rating,text,relative_time_description,reviewer_total_reviews,reviewer_profile_url
Peter Chong,4,"Value for money place to eat with decent food. Not too large variety of food choices but as good as it gets in the area. Four stalls, including a Drink Stall, Economical Rice Stall, Noodle Stall, and Indian Muslim Stall.",2 years ago,,https://www.google.com/maps/contrib/115086655103873779488/reviews
Lily Perr,2,The Auntie selling the drinks always not in the mood. Maybe have anger issues or problems. I observe shes not fine with the other races.,6 months ago,,https://www.google.com/maps/contrib/112380037971698236303/reviews
Pawan Kumar,1,"The aunty selling the always with anger
Not even know how make tea c",2 months ago,,https://www.google.com/maps/contrib/113101068635031283430/reviews
RAVINDARAN V RAMAN,5,The place seemed a little warm but the breakfast set is still good.,3 weeks ago,,https://www.google.com/maps/contrib/105585945893279178605/reviews
James Tay,3,You must try the curry chicken noodle. Very generous portion of meat and noodle. The disadvantage is very limited parking lot available.,2 years ago,,https://www.google.com/maps/contrib/116075881335821896463/reviews
