author_name,rating,text,relative_time_description,reviewer_total_reviews,reviewer_profile_url
James Pee,5,"Wide selection of beer (including soju) at reasonable prices. Discounts available for more 2 / 6 bottles depending on products.

Small place but well stocked.

Cashless payment only paynow and paylah.",2 years ago,,https://www.google.com/maps/contrib/111424365104745497160/reviews
Florence Ang,5,"I heard good things about this store so I decided to pay it a visit.

First off, the prices are very reasonable, with many canned drinks selling at a dollar.

I also found interesting items ranging from Hai Di Lao hotpots and ready to eat soups to a wide variety of beers and other alcohol.

But what particularly caught my eye was their own brand of ice cream called uGelato.

The candy cotton bubble gum flavour intrigued me. But I decided on buying the apple strudel and sea salt chendol because they have a combo price at two cups for only $6.10!

I am super impressed that the apple strudel taste just like the real thing! And the chendol is a new take on a favourite dessert of mine.

I will surely be back.",2 years ago,,https://www.google.com/maps/contrib/103627904388034597772/reviews
Ho Shane,5,"Simply love this shop! It offers a wide variety of products, despite its size. Very affordable prices too! Will definitely return!",2 years ago,,https://www.google.com/maps/contrib/110014884650901212970/reviews
Andrew C,3,"Shop so small, lady boss still squeeze past me in aisle. #injured",3 years ago,,https://www.google.com/maps/contrib/103825660593105807652/reviews
Joe,1,👎👎👎👎 not 24 hours,4 months ago,,https://www.google.com/maps/contrib/109133662338794616811/reviews
