author_name,rating,text,relative_time_description,reviewer_total_reviews,reviewer_profile_url
Lee Ash,5,"I went to this branch to settle some of my DD. The lady Lina Lya is so patient and helpful. Although the end result was not as what i hoped , however due to her excellent service, it helped me feel much better.",2 months ago,,https://www.google.com/maps/contrib/114209250681680684800/reviews
Victor YIN,5,"I visited the UOB Anson Branch to exchange new banknotes for Chinese New Year, and I had the pleasure of being assisted by Mr. Jeff Chua. He provided exceptional service, explaining in detail how individuals below 60 can withdraw new cash and guiding me through the process of resolving interbank transfer issues between DBS and OCBC.

Not only did he clarify everything clearly, but he also took the time to analyze the transfer issue I was facing and offered practical solutions. His thorough explanations and genuine care were truly commendable. It’s rare to encounter someone as attentive, professional, and knowledgeable as him, and I sincerely appreciate the effort he put into helping me.

Wishing Mr. Jeff Chua a joyous and prosperous Chinese New Year!",3 months ago,,https://www.google.com/maps/contrib/109254393083641825693/reviews
Goh Wee Kia,1,"Poor service rendered by Joy Loh serving at Privilege counter 2 on 29 Dec 2022. Incompetent and unfriendly. Was there for a simple transaction - to apply for Treasury Bills using CPFOA. Even if I were a not Privilege Banking customer, I would have expected her to fill in the simple form for me, like my name, address. She even wanted me to fill in my CPFIS account number, which is on her screen right in front of her! Without asking me for my investment preference, she instructed me to cancel out competitive bid option.  Joy needs more coaching and training before being put at the counter to serve Privilege Banking customers. She lacks basic knowledge.",2 years ago,,https://www.google.com/maps/contrib/107811126937462749705/reviews
Syazwan Menzies,5,Was very pleasantly surprised after reading the other reviews on here. I went down to open a UOB One account and was served way faster than I was expecting. Was served within half an hour after receiving my number. The staff were all very courteous and friendly throughout my entire experience. They always made sure to check if I was clear or if I had any outstanding questions. Special shoutout to the guy who helped me open my account. I didn't catch his name but we were in Rm 8 on 8th December. Would come back to this branch specifically next time :),a year ago,,https://www.google.com/maps/contrib/112798092048113995556/reviews
Olivia,5,"We were attended to by Samantha Yik who very patiently guided us with our banking transactions. She was very helpful, kind and patient. We went there in the morning on 8 Dec 23. Thank you for the superb service.",a year ago,,https://www.google.com/maps/contrib/101578635639436386898/reviews
