author_name,rating,text,relative_time_description,reviewer_total_reviews,reviewer_profile_url
Sharan Shastri,3,Good for quick south Indian (veg) breakfast options. Breakfast usually gets over by 9:30 - 10:00 AM. Best to have before then,a year ago,,https://www.google.com/maps/contrib/107486687725907175668/reviews
Etsuo Okazaki,5,"The briyani is very nice but sadly it’s close already.
Any one know where’s its relocated?",2 years ago,,https://www.google.com/maps/contrib/117454716727999664575/reviews
gerald jacob,5,"Surprised with quality and the taste.
I tried the briyani with prawns and another day with the fish.

Both were good. The briyani was flavourful!",2 years ago,,https://www.google.com/maps/contrib/100001572274250848271/reviews
Rajesh Bhat,4,"Food options are good, especially Indian vegetarian. The preparation & taste is excellent. Nice ambience except that the food court is non-aircon.",2 months ago,,https://www.google.com/maps/contrib/100059225248246712757/reviews
buyer n,2,They serve not fresh oily papadum. Briyani Mutton full of bones and fats,a year ago,,https://www.google.com/maps/contrib/110286383647272032645/reviews
