author_name,rating,text,relative_time_description,reviewer_total_reviews,reviewer_profile_url
Nikitha Rathna,5,"Beautiful experience! Had booked for my hubby birthday celebration. Special evening!  Had a wonderful time! Smooth communication, well decorated tent, clean n spacious!  Clear instructions for self check in and checkout. Thank you Wondrous Glamping!",2 years ago,,https://www.google.com/maps/contrib/110633598412579865518/reviews
joshua khoo,5,"Had the place booked for 70 ppl, only 64 came but it was really spacious enough to fit everyone!! The Night Vibes were amazing and chilling, would recommend outdoor picnic more as its less humid but everything was very beautifully setup!!",a year ago,,https://www.google.com/maps/contrib/100569462350315548650/reviews
Ili S,5,A very pleasant experience booking Glampicnic for a birthday. Amazing set-up with Pokemon decor. Tent was also spacious enough to fit 25 people. Thankful that the weather was on our side. We all definitely had fun!,a year ago,,https://www.google.com/maps/contrib/112442763774279497244/reviews
nandushree 1991,5,"We had an amazing glamping experience,I booked it for my husband’s birthday. Now kids too want to celebrate their birthdays under the glamp😍… Communication,transactions everything was smooth. Loved every bit of it❤️",2 years ago,,https://www.google.com/maps/contrib/102305518200567038001/reviews
Suraya Mohamad Shukor,5,It was the best experiences ever... My mother and kids enjoy the most... But i hope in future it will be upgraded more appliances so everyone will enjoy most of all. Overall it is the best glamping ever... Will be engaged with them again in future..... Kiddos to the team...,a year ago,,https://www.google.com/maps/contrib/114592843629601178610/reviews
