author_name,rating,text,relative_time_description,reviewer_total_reviews,reviewer_profile_url
Ee Jen Kiat,1,"Will give 0 star if possible. Ask if the medicines available in thier store. The lady face and altitude like owe her a million. Damm arrogant, not the only tcm store in this estate. AVOID THIS SHOP.",a year ago,,https://www.google.com/maps/contrib/108612725173873508410/reviews
Sri Rafidah Abu Bakar,1,2nd time buying items from the shop and 2nd time the lady showed attitude. The uncle from morning shift was nice but not her.,8 months ago,,https://www.google.com/maps/contrib/116674103529634694646/reviews
Anthony Lim,1,"Wow didn't know this will happen in a neighbourhood store, we went on two separate occasion to buy a cream one cost $8 and the other cost $10 the same product.. There are at least 4 other Chinese medical store in teck whye market just around this store,AVOID THIS PLACE!!",a year ago,,https://www.google.com/maps/contrib/116803404001505688550/reviews
Hsu Vennetta,1,"Be careful of the expiry date. Never encounter milk tin expiry in 6 months time. Bought on 21/03/2020 and the expiry date was on 30/09/2020. Lucky that my 3 years old daughter can tell us that she don't wan to drink her milk and want change to her younger sisters milk. She also say milk funny. Think the milk tin they keep too long and near to expiry date. In chinese we call it Lao hong. We go back to the shop and feedback that the milk is way to near the expiry date and our daughter rejected the milk. Please stop selling to others babies or kids. They might not tell the parents the milk is smelly. The lady in her early 50s and sound like a Vietnamese which we bought from her. Go aggressive in talking and so offensive. Told us cannot be change becos is open. 😂 Come on, we open n let our daughter drink than we will know right. She push to Nan and say contact Nan. After that my hubby ask her again. ""so you say contact Nan""  she then say ""no I did not say that"". Come on talk nicely to people and ppl will understand. Dont talk in a v bad attitude to your customer la. We walking out the the shop and she continued to shout. 😂 People buy thing from u. Wow talk v nice to you. But ppl come feedback abt ur bad product. You fast fast taiji to Nan with a bad attitude. Think a solution for ur customer and show empathise to your costomer. But I confirm never ever buy things from her shop anymore. Will share to our friends, relative and family.  Be careful",5 years ago,,https://www.google.com/maps/contrib/113572012895488713125/reviews
Hortpark walker,1,"Avoid this store, the lady attitude is very bad.",9 months ago,,https://www.google.com/maps/contrib/112062611295524818385/reviews
