author_name,rating,text,relative_time_description,reviewer_total_reviews,reviewer_profile_url
Mike25sally Sally,5,"Had a great experience at Zest Clinic.
Mikayla was very friendly, professional & knowledgeable. She was very helpful and was me all the way through when I had some issues. Doctor was very friendly and professional. Zest clinic has a wide variety of treatments that suits my needs. Overall great experience",in the last week,,https://www.google.com/maps/contrib/117966510025354802461/reviews
Smart Tv,5,"I recently visited Zest Clinic for a ESWT consultation, clinic itself is clean and aesthetically pleasing, The staffs were helpful and accommodative. Was in the good hands of the doctor , not only professionals but also took the time to thoroughly explain every detail of the procedure, addressing all my concerns. I felt completely at ease and comfortable.",3 months ago,,https://www.google.com/maps/contrib/109992220401041106529/reviews
Elicier Ng,5,"I went to the Zest Clinic today to schedule a mole removal appointment. Staff member Sherry gave me a warm welcome. The other team members, Carmen and Olivia, have taken good care of me. They often serve with a cheer up and are extremely courteous. I am grateful to Dr. Tifanny Teo for providing thorough explanations before to the laser operation. She always has a smile on her face and is very understanding of my demands. The teams are awesomes.",2 weeks ago,,https://www.google.com/maps/contrib/111296081223085294404/reviews
Soren Beaulieu,5,"I've done several treatments at Zest, and have only had positive experiences. Dr. Reddy is professional and always makes time for my questions, and the bubbly staff are super friendly, attentive and create a warm and welcoming atmosphere. Most importantly, I've seen great results in the areas I've focused on (Men's health and skincare).  Would highly recommend Zest to anyone!",3 months ago,,https://www.google.com/maps/contrib/118389720677532062148/reviews
Evan Koh,5,"Recently went to zest clinic for dark eye circles remover. The overall experience was great.
Mikayla and Edrea are accommodating, friendly ,patient and professional making the whole process more comfortable and smooth

Doctor Reddy is very professional and highly knowledgeable in aesthetic

highly recommended",2 weeks ago,,https://www.google.com/maps/contrib/106684723549245815820/reviews
