author_name,rating,text,relative_time_description,reviewer_total_reviews,reviewer_profile_url
Capture Asia Photography,5,"Uncovering a gem. The Minced meat noodle with speciality sauce is surprisingly delicious, the portion is suitable for a lady to finish it all. As seen in my picture got plenty of minced meat spread on it! Chewy noodle texture too. The stall owner is quite friendly too.

Definitely going back to try other selection. Spoilt for choice in this coffee shop. 😅",4 months ago,,https://www.google.com/maps/contrib/113796572659279486041/reviews
Jack Bush,5,"Amazing homemade food from a lovely lady. I worked in the same building and ate her La Mian all the time. Still the best I've eaten. Go try, you won't regret it!",3 years ago,,https://www.google.com/maps/contrib/105666405632233953544/reviews
James King,5,The best noodles in BB!,2 months ago,,https://www.google.com/maps/contrib/108229213585496037660/reviews
Goh Haw Shyang,5,Food is really solid. Her dumpling and 抄手 much better than those restaurant ones.,3 years ago,,https://www.google.com/maps/contrib/104408431388049729861/reviews
Jiazhen Chong,5,Excellent dumplings at affordable prices!,3 years ago,,https://www.google.com/maps/contrib/106687756787726838542/reviews
