author_name,rating,text,relative_time_description,reviewer_total_reviews,reviewer_profile_url
dan nat,5,"I recently visited this pub and had a fantastic experience. The atmosphere was warm and inviting, with cozy lighting and comfortable seating. The staff were all friendly and attentive, making sure we had everything we needed throughout our visit.

But what really stood out to me was the food and drink. The menu offered a great variety of options, from classic pub fare to more elevated dishes, and everything we tried was delicious. They also had an impressive selection of craft beers and creative cocktails, which were expertly crafted and perfectly complemented our meals.

Overall, I would highly recommend this pub to anyone looking for a great night out. Whether you're stopping in for a quick drink or settling in for a full meal, you're sure to have a wonderful time at this welcoming and top-notch establishment.",2 years ago,,https://www.google.com/maps/contrib/112524467515709298736/reviews
Wilfred Allais,5,"Decently priced beers, not too crowded, and friendly staff 👍👍",2 years ago,,https://www.google.com/maps/contrib/113842552123179592680/reviews
MARK JEREMY Low,5,Great customer service ! They serve us for a living. Superb!,a year ago,,https://www.google.com/maps/contrib/106836247698623152796/reviews
joel ng,5,Cheap beers,2 years ago,,https://www.google.com/maps/contrib/108438207993542678973/reviews
