author_name,rating,text,relative_time_description,reviewer_total_reviews,reviewer_profile_url
Earoel Kennedy,4,"This place has a lively and vibrant atmosphere, making it a great spot for happy hour.

The drinks menu is well-priced during happy hour, with a good selection of cocktails, beers, and wines. The cocktails are well-mixed and refreshing.

The ambiance, enhanced by live music, creates a fun and relaxed vibe, perfect for unwinding after work. Service is friendly and attentive. It is a great spot for drinks and good vibes.",3 months ago,,https://www.google.com/maps/contrib/105782077382160797659/reviews
Johnson Tan,4,"Visited on Friday night. This is a very good spot to enjoy the live music, the first live music more on thr jazzy music, one of the best in town, second live band, majority on mandarin and English song. Best place to chill for the weekend.",a month ago,,https://www.google.com/maps/contrib/115912694778558940179/reviews
D Lo,4,Food was hit and miss - roasted chicken and the salad was really good but calamari/wings and other fried items are misses. HH till 7pm only. Music is great but don’t expect to have good conversation except in between sets.,4 months ago,,https://www.google.com/maps/contrib/109633349485863470090/reviews
Naomi S,5,"A classic bar right at the heart of the city, in the corner of Emerald Hill. Staff are always accommodating and friendly, and we love our queen Mimie 🫶 the chicken here is huge n aMAZING and joooicy and the garlic chili here is made fresh..it’s the bomb 🔥 (not to mention the live music is amazing)",3 weeks ago,,https://www.google.com/maps/contrib/110712881123379893907/reviews
Echeng sh,5,"Mimi , Lili & team gave the best customer services. Our table was well served and had lots of laughter.
Utmost, AOCheng, Mavis(live band) brought LIFE to the place.",3 weeks ago,,https://www.google.com/maps/contrib/103437109991763047606/reviews
