author_name,rating,text,relative_time_description,reviewer_total_reviews,reviewer_profile_url
Gregory Athanasius,5,"Active Garden, Waterfront Plaza is a great place for an active day outdoors.

Here's a summary of what makes it a good place to visit:
- Exercise Stations: There are a variety of exercise stations available.
- Cafe: A cafe is available, serving light refreshments.
- Playground: There's a playground, making it suitable for families.
- Accessibility: It's wheelchair accessible.",a month ago,,https://www.google.com/maps/contrib/101240389824842882822/reviews
Toon Tran,4,"Active Garden at Waterfront Plaza is a hidden gem for anyone looking to unwind or enjoy some light outdoor activities in the heart of Singapore. With its beautiful landscaping, open green spaces, and scenic waterfront views, this garden is a perfect spot to relax, take a leisurely stroll, or even enjoy a casual picnic.

The garden is thoughtfully designed, featuring walking paths lined with lush greenery, vibrant flower beds, and shaded areas for resting. There’s even a small playground, making it ideal for families with young children. The open spaces encourage light exercise, yoga, or simply soaking in the peaceful atmosphere with views of the Marina Bay skyline as a backdrop.

The location is incredibly convenient, offering easy access from Marina Bay Sands and Gardens by the Bay. Despite being in a bustling area, the garden maintains a tranquil vibe, making it feel like a serene escape from the city’s pace.

Overall, Active Garden is a refreshing spot for visitors and locals alike to enjoy the outdoors without straying too far from the city center. It’s a wonderful place to recharge, get some fresh air, and take in the stunning surroundings of Marina Bay. Highly recommended for a peaceful retreat or a family outing with a view!",6 months ago,,https://www.google.com/maps/contrib/102078641965155497930/reviews
Fanny Ng,5,Nice area to let kids play outdoor with great scenery and shelters for a day out. Was there for band performance and it was great and lively!,a month ago,,https://www.google.com/maps/contrib/114189199747243246352/reviews
Mohammed Junaid,5,"Active Garden at Waterfront Plaza – Where Energy Meets Relaxation

If you're looking for a place where nature meets movement, Active Garden at Waterfront Plaza is a refreshing hotspot at Gardens by the Bay that ticks all the boxes. With its vibrant open spaces, interactive play zones, and lush surroundings, it's the perfect escape for both fitness enthusiasts and families.

What sets Active Garden apart is its versatility—whether you're in the mood for a high-energy workout, a fun playtime with kids, or a relaxing picnic by the water, this space adapts to your vibe. The outdoor fitness equipment, jogging paths, and open lawns invite you to stretch, sweat, and soak in the scenic waterfront views.

But it's not all about activity—there are also cozy chill-out areas with shaded seating, making it an ideal spot to wind down, read a book, or enjoy an evening breeze with the Marina Bay skyline as your backdrop.",a week ago,,https://www.google.com/maps/contrib/112718123701423001485/reviews
Tommy Byun,4,"Fun place (especially for kids!) to try out different physical activities & percussions set up in an outdoor setting, on the way to the Gardens by the Bay.",3 months ago,,https://www.google.com/maps/contrib/101775194237250179981/reviews
