author_name,rating,text,relative_time_description,reviewer_total_reviews,reviewer_profile_url
Hanzos Zos,4,Tasty and affordable Indian Muslim food. Self service scoop your own curry gravy from the pot. Great for  people who like their roti drenched in curry!,4 months ago,,https://www.google.com/maps/contrib/114793457163485355928/reviews
Yoris Yunanda,5,"Very friendly and skillful uncle, even with many customers. One of my favourite places for Maggi Goreng and Prata especially because curries are self-service. Prices are affordable and portion is perfect. Thank you sir.",a year ago,,https://www.google.com/maps/contrib/103182285588467506356/reviews
Ramzi,4,Dalca is spicy. Self service.,a year ago,,https://www.google.com/maps/contrib/114788807639865665098/reviews
Evelyn Kusmanto,5,"Very nice ikan bilis fried rice.
Got the wokhey! Generous portions",12 months ago,,https://www.google.com/maps/contrib/117993103620313833533/reviews
Kalaichelvan Kb,1,,5 months ago,,https://www.google.com/maps/contrib/113247836460426034634/reviews
