author_name,rating,text,relative_time_description,reviewer_total_reviews,reviewer_profile_url
ivie low,5,"In October 2023, I learned about this community from a stranger. Initially, I went to see the teacher with a mixture of skepticism and curiosity.

When I met teacher John, I was not only struggling with my mental and physical health but also dealing with long-term anxiety due to business worries. I was overweight and bloated, and the aftermath of COVID left me with a persistent cough and hoarse voice. These problems had caused me to lose confidence and gradually distance myself from friends over the past few years.

Through the teacher's natural therapies, all these issues were resolved. In just four months, I lost 10 kg so far and I have regained my confidence and self-esteem.
My gratitude to teacher John and the whole community support to make a stronger person and highly recommended this community to everyone.",10 months ago,,https://www.google.com/maps/contrib/109826999618452279109/reviews
Pauline Tjoa,5,"John Wong is the kind of teacher I had been seeking for and fortunately, the master appeared 5 years ago when we were so ready to learn. Our family are forever grateful as John shown us the path of living healthy, natural life style, sustainable living and constant learning to be mindful of our environment, to protect the planet.
John, your keen intuitive to tap into our inner strength and ability to shine is incredible. You share your deep knowledge generously, your dedication, commitment and readily available to answer any difficult questions in such a simple understanding have made the learning process an enjoyable life long love of learning indeed. On behalf of my family, we sincerely blessed to know you and I can only say to everyone I meet, if you want to know a good healthy life, John Wong is the guru to learn from. Thank you and love you my dear life guru.......",3 years ago,,https://www.google.com/maps/contrib/116249649723270377781/reviews
Carina Chan,5,"I am recovered from my eczema after consulted  with John, and also learnt a lot ancient knowledges from applied methaphysics during my healing journey, thanks for always sharing ancient and NOWaday world wide information to broader my eyesight.

Recommend to everyone if you are wish to embark in your natural path with genuine guidances.",a year ago,,https://www.google.com/maps/contrib/114547440837297435756/reviews
Sameer Dulhot khan,1,Sar my account unban please help me and hack sorry🙏😞😭,4 months ago,,https://www.google.com/maps/contrib/102029590572384777304/reviews
Eve Chong,5,"Lessons conducted, whether online or in-person, has helped me to understand how to use the oils in a useful way in terms of its quality and quantity. John has the wisdom to put the oils together for the study in the improvement of physical and emotional health. The ecology of natural earth is also an important element in the human survival. How it affects the sea and the soil environment affects the end product - the plants and sea animals. These are crucial survival, and the end result is the production of the quality of oils and the continued existence of the sea animals and its in the ocean. The sea animals should not be made to suffer because of our oblivious negligence.We are what we eat and use. The intake of toxins poison us, the natural food intake build strong tissues in us as we ""eat clean and use clean"". John's lessons have led me into this knowledge.",3 years ago,,https://www.google.com/maps/contrib/113039611804046408344/reviews
