author_name,rating,text,relative_time_description,reviewer_total_reviews,reviewer_profile_url
Clarissa B,5,Very nice Pig organ soup with super Yummy yam rice !  Superb combo!  Home made garlic bits took the soup to another level !  Highly recommended !,a week ago,,https://www.google.com/maps/contrib/110171288148486945508/reviews
Madeline Ng,5,"The food here is actually really good. Pig organ soup is flavourful and yam rice has a lot of liao, like shrimp, yam, mushrooms, cabbage. Worth to eat!",3 months ago,,https://www.google.com/maps/contrib/104966380521683784570/reviews
Kendall Peterson,4,"Just a bit lackluster in presentation but good in taste. Surprised myself. Simple but satisfying.
Century egg pork porridge",2 months ago,,https://www.google.com/maps/contrib/102176574137888868216/reviews
Aaron Sim,5,Ordered the soup and it’s delicious!!! Reasonably priced too.,9 months ago,,https://www.google.com/maps/contrib/111633261504882120088/reviews
Yi Lin,5,Surprisingly good.  Yam rice must try,3 weeks ago,,https://www.google.com/maps/contrib/102858948005973770612/reviews
