author_name,rating,text,relative_time_description,reviewer_total_reviews,reviewer_profile_url
William Lee,4,"The corner fish soup stall run by a middle age couple has very nice soup base. I usually have their seafood e-mee which is chock full of ingredients for only SGD 6. Prawns, fish slices, dumplings, fish cake, etc. Love the clear broth which is not too overpowering but sweet enough. Worth a try.",5 months ago,,https://www.google.com/maps/contrib/108142416745967711790/reviews
Sam Wong,5,"Their yuan yang - c is smooth, slightly thick, less sweet and comes with tea/coffee aroma. 9/10",a month ago,,https://www.google.com/maps/contrib/115694236480258826587/reviews
T. S,4,Laksa(large size) is only $5..! Taste is not bad;),4 months ago,,https://www.google.com/maps/contrib/115428337244249878065/reviews
Vicq,4,"This is not a restaurant- just a small old school local coffeeshop with chicken rice, fish ball noodle which is selling laksa as well, Chinese style economical rice, etc. alongside  the busy pasir panjang road with the west coast highway running parallel overhead. In between and near to pasir panjang mrt station and Labrador park mrt station.",2 years ago,,https://www.google.com/maps/contrib/106473378023729080154/reviews
Soo Hin Yeoh,3,"Popular lunch venues for port workers located opposite Hillman 99, this is the only other venue other than Pasir Panjang Food Centre for port workers.",3 years ago,,https://www.google.com/maps/contrib/115725392210756907778/reviews
