author_name,rating,text,relative_time_description,reviewer_total_reviews,reviewer_profile_url
Nuryasmin Hannah Suleiman,5,"Bought MSW, unfortunately about 2 boxes out of the 3 I bought was a little hardened, seems like the durian has been frozen for some time already. When tearing into it, can literally see the durian fibres. The seeds were soggy and some of the durians tasted bland.  Maybe it’s not the season, quality was much better before this. Gave our feedback, they ask for some pictures. They were nice enough to offer us a return voucher afterwards.",2 weeks ago,,https://www.google.com/maps/contrib/105744668427405691507/reviews
Mabel Fox,5,"Durian Delivery. Always a Golden Moments supporter! I must say that their quality is great and service is amazing! Once I received a box of mashed durians, which I believed that the driver might had performed an emergency brake. All the durians were mashed and tugged in a corner. Without further question asked, a new set of durians were delivered to me without additional charges within an hr! They really go the extra miles to ensure that their customers have a positive experience with Golden moments! Keep it up the good work! 👍",a month ago,,https://www.google.com/maps/contrib/116069638196356283629/reviews
Irene khor,5,"I wish I had discovered this brand sooner! I absolutely love their cakes and products, the quality is exceptional, with a rich, concentrated original taste, crafted exclusively from genuine ingredients.

I’m so proud to present their products as gifts to my clients and friends. One thing to salute, they go the extra mile by preparing greeting cards on your behalf with every order , such a thoughtful touch!",3 months ago,,https://www.google.com/maps/contrib/105371767334109403475/reviews
Chen Quanrong,5,"Superb quality & service! First encounter was a company event where Golden Moments did a nice and engaging infotainment setup to introduce different types of durian and pamper my co-workers with fresh in-season varieties. Next was an after-wedding party. It was easy placing the order and the delivery came in ~90min. My extended family loves it - despite a feast at the dinner banquet, we devoured the Black Gold MSW for supper that came in a great mix of sweet, bitter and bitter-sweet. Generous flesh, small seeds. Highly recommended! Certainly value-for-money and very convenient.",a year ago,,https://www.google.com/maps/contrib/105268464092980754499/reviews
Jackson Goh,5,"The combination of durian mousse and puree is amazing!
Not only does the galaxy cake looks aesthetically pleasing, the taste is also 💯✅️

The customer service is also quick and efficient to cater to my request of changing the collection date. Overall a good experience 👍",11 months ago,,https://www.google.com/maps/contrib/115664141608484168281/reviews
