author_name,rating,text,relative_time_description,reviewer_total_reviews,reviewer_profile_url
Chris Tan,5,"Went to Dr Chan twice and during our consultations, I find him to be professional, a nice person and one who genuinely cares for others.

He listens to patients, then explains things simply sometimes with the use of visuals and even have print outs for you should you need to refer to it after you left the clinic. That I find it useful and perhaps even helpful for elderly patients who might struggle to remember things said.

You can utilise your CHAS benefits at this clinic. Reception staff was responsive and communicative.",3 weeks ago,,https://www.google.com/maps/contrib/103463791737805347871/reviews
Queenie,5,"The clinic is clean and orderly. Dr Chan and his staff (with him for many years) were courteous and professional. Dr Chan is as always very knowledgeable, professional and cautious in treating patients. His explanation was thorough and sometimes took the efforts to show you the photos or research on certain conditions. His staff was also very loyal and friendly too. Good work! Keep it up and going 💪🏻",a year ago,,https://www.google.com/maps/contrib/110502783353412243930/reviews
Tan Ling,5,"Dr Chan Yit Meng took time to explain clearly to me high blood pressure issues and even coupled with drawings to help me comprehend. Moreover, he was proficient in Mandarin. We need doctors who exhibit care and concern towards patients.",3 months ago,,https://www.google.com/maps/contrib/110636336858873518353/reviews
Haruka184,5,"Dr Chan Y M attended to me, and he explained very detailed of my condition and what might have happened to my body. He even drew out diagram for my aftercare. This is my first time meeting a enthusiastic doctor who is genuine with patient. Thank you. 👍🏻",11 months ago,,https://www.google.com/maps/contrib/112952189898086261454/reviews
Joel Ng (Jojibu),5,"Dr Chan's medical review was very clear and precise, which helped very much in leading a better and healthier lifestyle. Goes above and beyond the normal medical practitioners.",a year ago,,https://www.google.com/maps/contrib/100139905168998970701/reviews
