author_name,rating,text,relative_time_description,reviewer_total_reviews,reviewer_profile_url
Angeline Ng,5,"I was referred to Dr Tan Yia Swarm by my family physician for some issues to manage. My observation for this clinic and the surgeon are 1) a professional team  2) an empathetic doctor with good bedside manners 3) definitely not pushy  . I enjoyed my consult and my process of the surgery that I had to go through. It meant a lot to me when I had to manage my emotions over the fearful impending surgery .  A lot of people are fearful of young doctors . However I must say Dr Tan is definitely forward looking, knowledgeable, and definitely one whom I would confidently recommend my friends and family to.  Thank your Dr Tan for your implacable skill . Am deeply grateful.",6 months ago,,https://www.google.com/maps/contrib/118002874327796460590/reviews
Malsawmthangi,5,"Dr. Tan is a kind and gentle doctor who explains everything clearly. The nurses and staffs are also friendly and supportive. Even though I was nervous about my first surgery, Dr. Tan and the team made sure everything went smoothly. The surgery and healing went well. I also want to thank my AIA agent, Derek Lee, and his wife for recommending Dr. Tan.
God bless Breast Friend Surgery clinic and may it be a healing place for many people 🙏",2 months ago,,https://www.google.com/maps/contrib/102547980772142960991/reviews
Shu Wen Suvenna Tan,5,"I had a truly wonderful experience at this clinic. Dr. Tan is an amazing and encouraging doctor who made me feel well cared for throughout my recovery. The nurses and staff were just as outstanding—always so kind, helpful, and prompt in reminding me about my appointments and assisting with invoices and insurance claims. The positive and welcoming vibe at the clinic really supported my healing journey. I’m genuinely glad I chose this place from the start, and I wouldn’t hesitate to recommend it to anyone looking for quality, compassionate care.",a week ago,,https://www.google.com/maps/contrib/109588296152382930892/reviews
Chuchiau Chuchiau,5,"I had an excellent experience with Dr. Tan Yia Swan.  She is not only a highly skilled breast surgeon but also a kind and patient listener. Her ability to explain everything clearly and provide genuine care made a significant difference in my journey. Dr. Tan was an exceptional counselor during our conversations—her words and compassion brought me to tears, offering me a sense of relief. Her expertise in diagnosing and managing my rare breast condition was remarkable, and her support gave me the confidence and comfort I needed.

I would also like to extend my gratitude to nurse Suzy who was equally caring, attentive, and supportive throughout the process. Their kindness and professionalism made the entire experience even more reassuring. I truly appreciate Dr. Tan and her team for their excellent care. Highly recommend!",5 months ago,,https://www.google.com/maps/contrib/114655878042619429943/reviews
Anca Fowler,5,"Amazing care from Dr Tan Yia Swam. The type of personal care and advice that makes you feel better right away. As they say “she took the pain away”. She was extremely knowledgeable and answered all my questions in detail, with a lot of patience. Most importantly, she looks at the patient holistically and is able to provide very informed, personalised advice. Thank you for the wonderful care and advice.",in the last week,,https://www.google.com/maps/contrib/117466146883233173236/reviews
