author_name,rating,text,relative_time_description,reviewer_total_reviews,reviewer_profile_url
Ranaha 69,5,"Pizza Is really nice.very quick service
Staff friendly and customer service is good.taste of pizza was wonderful and nice price affordable to public.",3 months ago,,https://www.google.com/maps/contrib/111658961740439003144/reviews
Shengyang Yu,5,"Great service and customer service. No fuss, just call the hotline and head over to the store within minutes, you can get your pizza hot and sizzling.",a month ago,,https://www.google.com/maps/contrib/116678951093768736283/reviews
Esther C,5,Kumar and other staff is very nice and friendly. Very patience when we are confused what we wanna order. Thumbs up 👍,3 months ago,,https://www.google.com/maps/contrib/105727028333600942699/reviews
•YixianG• TM,5,The pizza was nice and the staff want very polite. Nicely packing,2 months ago,,https://www.google.com/maps/contrib/112146545843231511059/reviews
Sinishq by Cosishq,5,"It was overall an amazing experience with delicious food! We had the Shepard's pie and Lasagna and it was exquisite.
The place has a lovely ambience and staff as well!",4 weeks ago,,https://www.google.com/maps/contrib/109050277926594746031/reviews
