author_name,rating,text,relative_time_description,reviewer_total_reviews,reviewer_profile_url
Shantal Soh,5,"Really recommend this place for skin management. Huixin was very friendly and gentle throughout the entire process. The extraction was done really well and didn’t hurt at all. The overall experience was comfortable, place was clean. Signed a package with them after my first visit!",3 months ago,,https://www.google.com/maps/contrib/106409993718030855961/reviews
Nicole Liew,5,"My 4th time here; Enjoy every visit here as Yumi & her team are always so attentive; their skills are impeccable! I have never found a beauty salon with painless extraction and i could sleep throughout the session. Very homely vibe, absolutely no hard selling… i have signed up a package and further add ons right after my first visit as the results were amazing.
Ps: my bf who hates people touching his face has requested me to book more facials for him here… so this explains how much we love their service 🫶🏻

For those not driving + staying in SG, can consider taking CW3 (from Jurong East Hall Interchange) to Tuas custom then taking CW7L (1st stop, get down at Sunway Bigbox), walking 8mins here… whole journey will take about 2hrs+ without jam or bus delays ❤️",4 months ago,,https://www.google.com/maps/contrib/110064411661968376321/reviews
Sue Ng,5,Cozy environment. Facial is good. Will recommend the suitable treatment and products but not hard sell. Is a good experience and love it. Good service and the 小姐姐 was nice 👍 👏,4 months ago,,https://www.google.com/maps/contrib/113540678226853180793/reviews
Huifen Koo,5,Highly recommended! Especially for those hate hardsales and afraid of painful excursion. Beautician is friendly and skilled. Overall a pleasant experience,4 months ago,,https://www.google.com/maps/contrib/107192463021360422112/reviews
Chew Jane,5,"Luckily,try the 6D treatment  with friendly Huixin. solving my sensitive skin within 1 session",4 weeks ago,,https://www.google.com/maps/contrib/115314500541572616649/reviews
