author_name,rating,text,relative_time_description,reviewer_total_reviews,reviewer_profile_url
Lai Weng Thai,4,"Nice scenery.  Very good for family/company outing. BBQ and chit chat.

Rainy day will be bad the floor is so wet and dirty. Suggest put mat.
Not much entertainment you need bring your own mahjong there.",11 months ago,,https://www.google.com/maps/contrib/110043045911390210013/reviews
Ricardo Quero,5,"Very good, enjoyed a lot having BBQ @ sea front. Place so big 4bedrooms with 3T&B. Living & dining room open concept,  more better if can enclose. As with greeneries around, insects also get attracted.",2 years ago,,https://www.google.com/maps/contrib/109021984575032246662/reviews
Long Peng Lim,1,"Very, very expensive,  one night stay more than S$300. Very  very poor facilities, electrical trip, some rooms no light  toilet bowl cover defective, call the operator several times , no maintenance people come to rectify. At night can see monitor lizard roaming around the bungalow compound.",2 years ago,,https://www.google.com/maps/contrib/116551748546147383607/reviews
Aik Keong Ong,4,"Good place to hold BBQ and family gathering with nice sea view. But compound cleanliness could be improved, there were littering lying around",2 years ago,,https://www.google.com/maps/contrib/113771008387619765590/reviews
Mohamed ilyas,5,Great place to spend value time with family. We had a beautiful barbecue evening with our loved ones…Definitely will make it yearly visit to the same chalet B,2 years ago,,https://www.google.com/maps/contrib/103900156816286142852/reviews
