author_name,rating,text,relative_time_description,reviewer_total_reviews,reviewer_profile_url
jon leong,5,"Variety choice of plastic injection molding machine to choose, great and responsive after sales technical support. Highly recommended",a year ago,,https://www.google.com/maps/contrib/107365216903688528973/reviews
Soo Bak Meng,4,All types of home appliance  boss is hard working,3 years ago,,https://www.google.com/maps/contrib/110056526265461821823/reviews
Bak Meng Soo,5,Excellent in this line,7 years ago,,https://www.google.com/maps/contrib/117194861207215587926/reviews
林正益,5,High technology~,8 months ago,,https://www.google.com/maps/contrib/103340755001956173811/reviews
S K,4,,a year ago,,https://www.google.com/maps/contrib/101996000464957945949/reviews
