author_name,rating,text,relative_time_description,reviewer_total_reviews,reviewer_profile_url
Ram,4,"After visiting the Indian Heritage Centre, we were craving for a good pizza. We found this place while googling good pizzas nearby.

At first, we were quite lost as to where the place was as we walked past it a few times, but we didn't notice it was still closed. After asking ard then we found out it was located next to a hotel called The Daulat by Hotel Calmo

So we waited for it to open, and I guess since it was still early, we were the first when it finally opened. Now, you have an option to choose an indoor or outdoor setting. My preference was the outdoor (even if it was by the road), the indoor was just a little too cramp for me

We proceeded to make an order for the classic of the Chili's Meaty, Garlic bread, and also a drink (in total, it was about $30)

Now we didn't have to wait long before the garlic bread came first, and honestly, when it's like straight out from the oven, most garlic breads are good, and this was no exception. The outside had a bit of crust, but the inside was soft and moist, so it was a good start.

When the pizza came after that, I was a bit surprise as I didn't know it was the thin crust kind. For me, I prefer it with a bit more dough to it. The meat on it was definitely generous enough, and it was enough for my partner and I (we ordered 1 large)

Overall, it was a good pizza, and I believe the one that took our order and served was the owner too, definitely a friendly guy 👍",6 months ago,,https://www.google.com/maps/contrib/113247703719564015453/reviews
alexis cheong,5,"We discovered this halal certified pizza place on accident but it turned out to be the best choice we could have made! Ordered the Chili’s Ocean which is a seafood style pizza and the Chili’s Lover, a mixed meat pizza! Both the dough and tomato paste is handmade which makes it incredibly tasty. The pizza bread was especially soft with the thin crust being perfectly crunchy. With the cheese being soft and stretchy, it was a great pair.

The garlic bread was soft and soaked in an amazing buttery garlic flavour which filled our mouths with each bite.

The owners were incredibly warm and the place was a very cosy get up, I’ll definitely come back here with friends and family :)",10 months ago,,https://www.google.com/maps/contrib/113274413252841495963/reviews
Umar Abdullah,5,"Cleanliness & hygiene is well observed at the simple little but extremely cozy place to unwind the day with splendid refreshing drinks and superb pizzas made definitely out of passion and love that takes the mind away from Singapore and transcend to Italy itself.

Excellent service by the thoughtful owners themselves.

Absolutely a perfect place to chill.  A hidden gem.

And yes, it's HALAL!

4.9/5",11 months ago,,https://www.google.com/maps/contrib/117945329029828422975/reviews
ardhian r (ardhianr),5,"Food: The cheese pizza is very delicious, the ice cappuccino is very refreshing. Halal certification approved.
Atmospher: Bright lights. Capacity 6 tables, around 15 people. The cool breeze from the fan and the night air is very cozy. Suitable for couples or families
Location: In front of the Daulat hotel by calmo. open to general customers.",4 months ago,,https://www.google.com/maps/contrib/114396642621480256207/reviews
Suf,2,"Service was amazing. Atmosphere is kinda so-so since it’s a shared space with a hotel, but not to the fault of the business.

As for the food, we got the sambal chicken. Couldn’t really taste the sambal and the ingredients weren’t really sufficient (you can see only bits of meat), esp for the price. We wouldn’t go back.

It’s freshly made, so that’s good I guess.",8 months ago,,https://www.google.com/maps/contrib/116921994453991739947/reviews
