author_name,rating,text,relative_time_description,reviewer_total_reviews,reviewer_profile_url
Jeslyn Y,5,"Occassionally i will attend their service and only have praises for them..
Do come all ye who are weary and full burdens.",a year ago,,https://www.google.com/maps/contrib/105915359159756457136/reviews
TechFlier,5,the church is so skibidi sigma,4 months ago,,https://www.google.com/maps/contrib/109859537328275789449/reviews
Billy the Goat,3,Bible study fellowship for men is available here. Come check out God's amazing grace,6 years ago,,https://www.google.com/maps/contrib/108567811106481423197/reviews
Kevin Tan,5,Excellent place to visit and have a rare history of West Coast.,a year ago,,https://www.google.com/maps/contrib/105516165879953327816/reviews
K a l 1 S S,5,Well organised activities for Bible study,2 years ago,,https://www.google.com/maps/contrib/100679182423591505301/reviews
