author_name,rating,text,relative_time_description,reviewer_total_reviews,reviewer_profile_url
Skye Cai,5,Lots of seats available and with good air circulation.,2 years ago,,https://www.google.com/maps/contrib/103575601236373049278/reviews
Adarsh Kanodia,4,"With amazing exposure and grilling projects, it provided a great start to my academic career. Would recommend to anyone looking to get started in the field of Computer Engineering and science.",9 years ago,,https://www.google.com/maps/contrib/109215728916386611068/reviews
Bronwyn M,5,Excellent NTU faculty. Highly recommend their courses.,8 years ago,,https://www.google.com/maps/contrib/104281739490824642511/reviews
GG L,5,Cool building,4 years ago,,https://www.google.com/maps/contrib/105335947994246394240/reviews
xavier luah,5,Complicated with rustic school feel,4 years ago,,https://www.google.com/maps/contrib/112810773084449526661/reviews
