author_name,rating,text,relative_time_description,reviewer_total_reviews,reviewer_profile_url
Hovan Chan,5,"The place was very welcoming, and the staff was very kind and gentle, swiftly directing us to our rooms. The rooms were comfortable and clean, and the TVS had many different streaming services we could choose from. Overall, a 10 out of 10 experience, highly recommend for people who want some private space just to chill.",2 weeks ago,,https://www.google.com/maps/contrib/109405588645470400423/reviews
domino stilton,5,"The room was nice; the sofa was clean, the TV had a big screen, and the table is big enough. There were also tissues. It was easy to switch between different apps on the TV. Ultimately, it was a fun and enjoyable experience! Would come back again!",4 months ago,,https://www.google.com/maps/contrib/102786496546929149541/reviews
Amanda LIM JIA YI,5,"Was greeted with good service from the staff that made the process of getting to our designated room smoothly. Room was very comfortable and clean as the staff cleans it after every session. Room was sound proof as we won’t disturb by the room next door.
Love the big tv and sound system, which allowed us to enjoy the movies like we are in the cinema.
Downside was that the wifi connection was pretty bad due to the rain and the amount of people in the vicinity. But with the help of the staff, it was solved to a certain extent.

Anyways,
Will come back again! Great service & great place to chill and relax :)",a month ago,,https://www.google.com/maps/contrib/113227298104479971394/reviews
balqis batrisyia,5,"it was really comfortable . the receptionist was very warm , welcoming and always smiled when talking to guests . it was a really enjoyable time , i watched endless movies and got to relax in such a well cleaned and smell room . will book again !!",2 months ago,,https://www.google.com/maps/contrib/108306186779265577360/reviews
Hui Hui,5,"The room was nice and clean, comfortable sofa and big TV screen.  Friendly staff as well. enjoyed my time here. Will come again, definitely recommend !",2 months ago,,https://www.google.com/maps/contrib/115113784711255074534/reviews
