author_name,rating,text,relative_time_description,reviewer_total_reviews,reviewer_profile_url
ane coni,5,"Nicely sheltered right before entrance to Princess n Bugis Street s Food Lagoon #01-147, opp. Bugis+ Cheng Yan Pl 2b exact.",2 months ago,,https://www.google.com/maps/contrib/109208783299676685064/reviews
Hartono Harjono,5,This ATM machine located at the side of bugis street marketplance. Between bugis+ and bugis street. Can be long queue sometimes. AXS machine is available.,a year ago,,https://www.google.com/maps/contrib/102944719141464210600/reviews
Kirah Kicks,5,The location is across Bugis +. It’s on the road between marketplace & Bugis +.,5 years ago,,https://www.google.com/maps/contrib/106215976782339166416/reviews
Sharon April Ong,5,Great place to shop and try street foods and drinks👌,6 years ago,,https://www.google.com/maps/contrib/109246622530018543962/reviews
Jega Dhis,5,Good loc,2 years ago,,https://www.google.com/maps/contrib/113991374141434136863/reviews
