author_name,rating,text,relative_time_description,reviewer_total_reviews,reviewer_profile_url
Natalie Koh,5,"Food is delicious. Tried the Gambas Al Ajillo,  Bangers and Mash, Quesadilas and Mutton varuval. All are sooo...Good.
Excellent service. Staff are friendly and chef will come out to make sure food is up to customer's standards.
Atmosphere is great. Very chill.
Love this place. This is our 4th time here. Will definitely come back many more times.",a year ago,,https://www.google.com/maps/contrib/102445523696285131649/reviews
Ning Xuan,4,"It's a nice corner bar for relaxation at night. We had the carbonara and ribeye steak. Carbonara was great, so creamy and pasta was al dente. Chef was really nice, he personally came out to take the order and mentioned that he can cook the medium rare steak a little more if we decide we prefer it a little more cooked. But the steak was good, just 👍We also had the red velvet cake after the meal which was dense and filling. Will be nice if theres some music playing at night to add to the atmosphere. Otherwise it's just the sound of chatter from customers from the other tables.",a year ago,,https://www.google.com/maps/contrib/117628058835134313097/reviews
Joan Lyn de Veyra,5,"Had a quick staycation near this cafe, food was served hot, very delicious and service was great.",a year ago,,https://www.google.com/maps/contrib/102404814703926429160/reviews
Kuberan 93,5,The Food Was So Delicious And The Staff Were So Friendly Overall  Experience Was Great Will Come Again Soon,a year ago,,https://www.google.com/maps/contrib/104004013916473371343/reviews
정일문,5,The pasta and quesadillas were absolutely delightful. The waitresses were very kind.,a year ago,,https://www.google.com/maps/contrib/113801712741244799350/reviews
