author_name,rating,text,relative_time_description,reviewer_total_reviews,reviewer_profile_url
Big Roy [eatwithroy],5,Good variety of food and staff walks around to take drink orders. Place is also well ventilated with many ceiling fans. The Mei Xi Yong Tau Foo is our go to stall for yummy ingredients and very good laksa soup base.,2 months ago,,https://www.google.com/maps/contrib/114399014237804415281/reviews
いい子だね〜:3,3,"We came here to have dinner.The place was well lited.We got soon seated and begin ordering food.But This coffee lady has a damn attitude.When I order drink,we decided to order drinks from the lady walking around.We called the old lady but she just bluntly walked across the table and begin cleaning the tables instead.Like is she blind or something.She like treated like we do not exist.When the food arrive,everything seems great and could not find anything wrong with the food.Ok lah ig;)",6 months ago,,https://www.google.com/maps/contrib/103801193071629162708/reviews
Shirley Goh,5,"#01-1260 Coffee Shop nearer to Cheers.....
Very friendly chi char staff at FuLee.  Western food also very good, freshly prepared dishes. Mahan Nasi Padang serves very authentic food with friendly staff too.  Chye Fan ( chai Png) very yummy dishes daily.  Staff are friendly & helpful. Soon Kee HongKong Roasted Delights has authentic roast pork, char siew & roast duck.",4 years ago,,https://www.google.com/maps/contrib/104891134352219496997/reviews
Richard See,4,03 May 2023: Bright and airy coffeeshop and pretty wide choices available. Ordered porridge plus a few dishes from the economy rice stall; the food is good and price is reasonable...will return for more interesting choices.,a year ago,,https://www.google.com/maps/contrib/101090694756471719639/reviews
Michael Ong,2,"Choice of food were great but

1) typical hot beverages pricing is too high. This will likely be the first coffee shop that have their hot beverages breaking the $2 per cup barrier.

2) they have a pet 🐀 running around the outlet.. usually in the morning when it's less crowded.",3 months ago,,https://www.google.com/maps/contrib/105906997969114072362/reviews
