author_name,rating,text,relative_time_description,reviewer_total_reviews,reviewer_profile_url
Kamaraj Ageraamudhalvan,5,The whole experience was positive and professional. A great team who responded very promptly to all communications. Dr Tung explained the procedure in clear and concise detail and the follow up care was excellent,4 months ago,,https://www.google.com/maps/contrib/108482593839099978007/reviews
Florence Tan,5,"I recently consulted Dr. Tung for my chronic migraine, and I am grateful for his ertise and thorough approach. After undergoing a series of investigations, Dr. Tung provided comprehensive explanations about the biological mechanisms behind my condition, which greatly enhanced my understanding and comfort.",5 months ago,,https://www.google.com/maps/contrib/101007126089052039973/reviews
khea ripley,5,Great clinic with super friendly staff. They are always accommodating with patient requests and the care given by Dr. Tung during my rehab is 5 star.,4 months ago,,https://www.google.com/maps/contrib/100666355574648895261/reviews
BABY,5,"Thanks to Dr. Tung's expertise and considerate approach, I feel much more confident in managing my neck pain. I highly recommend Dr. Mathew Tung to anyone seeking a knowledgeable and empathetic specialist.",5 months ago,,https://www.google.com/maps/contrib/105356327648244272176/reviews
chloe,5,"Element, hailey, Melissa, Florence, and Dr Mathew Tung, Thank you for the exceptional service. Very smooth and comfortable experience. Cheers!",4 months ago,,https://www.google.com/maps/contrib/109379094625708482709/reviews
