author_name,rating,text,relative_time_description,reviewer_total_reviews,reviewer_profile_url
Janet Chua,5,"Dr Chin is again, so patient to explain about my health condition.
He even show me the exercise that I can do to improve my health condition!
Dr Chin also help to explain to me when I was confused about the medication given by my specialist from hospital!
Such a blessing to know Dr Chin!
Thank you and thank you! :)",7 months ago,,https://www.google.com/maps/contrib/110826264590897603988/reviews
James Sheu,5,Dr Chin had been the family’s most trusted GP since kids infancy. His believe in strengthening body immunity while aided by min use of medication is well received,a year ago,,https://www.google.com/maps/contrib/104319137692642518144/reviews
Grace Tan,5,"Very patient doctor who listens to patients, and then explains throughly.",2 months ago,,https://www.google.com/maps/contrib/108752847514410975314/reviews
Edhifa Aliwarga,5,"Knowledgeable doctor that serves with heart and compassion. Explain very detail, patient, and not in rush. Defenitely will come back eventho not in my insurance panel clinic 👍🏻👍🏻",9 months ago,,https://www.google.com/maps/contrib/106134874312910028271/reviews
px,5,"chanced upon this clinic after seeing good reviews online. Consulted Dr Chin for my injured foot and he was very patient and meticulous. He took his time to clean and dress my wound up nicely, and shared a lot of tips on how I should manage it. Also really appreciate the long opening hours, friendly clinic staff and very reasonable pricing at this clinic!",4 years ago,,https://www.google.com/maps/contrib/105858141514485049976/reviews
