author_name,rating,text,relative_time_description,reviewer_total_reviews,reviewer_profile_url
Desmond Lange,5,"I came to know of Eastern Winter Trading from the web. On visiting the shop, I was attended by Andrew and Katherine who were very helpful in answering questions and providing solutions for my requirements. I would highly recommend them for your refrigeration and fitting requirements.",a year ago,,https://www.google.com/maps/contrib/100094946020626386519/reviews
admin Ee Hui,4,"fast responding, high efficency, hazzle-free transactions, sure will deal again",a year ago,,https://www.google.com/maps/contrib/118355235099054230276/reviews
weikee cher,5,"Staff is very helpful and fast response!
Besides that, the most important thing is Reasonable price!!!",a year ago,,https://www.google.com/maps/contrib/113244037307592806558/reviews
Cyril Lim,5,"Very helpful staff. Reasonable pricing. 👍
Highly recommended!",4 years ago,,https://www.google.com/maps/contrib/110760297329335572964/reviews
Darryl Freeman,5,Very helpfull and friendly,a year ago,,https://www.google.com/maps/contrib/110194261798932536356/reviews
