author_name,rating,text,relative_time_description,reviewer_total_reviews,reviewer_profile_url
Sexy Niza,1,Booking running track at night but no light at all very dark.. they said i only paid 5rgt why they shld open the light?… such a worst service given.. its not abt how much money i paid but the service and the answer i get very dissapoint.. management pls improve ur service and your people attitude..,2 weeks ago,,https://www.google.com/maps/contrib/113555640004396194851/reviews
Darren,4,"Good environment and clean water swimming pool.
But I feel expensive on the public adult entry fees keep increase from RM10 ->RM15 to RM20 nowadays. The toilet maintenance needs to be improved. Most of the locker numbering locks are damaged. Should repair and maintain well for visitors use.",4 months ago,,https://www.google.com/maps/contrib/109920908425364442982/reviews
Nizam Nordin,5,A good place for sports event. Space is huge. Parking is plenty,2 months ago,,https://www.google.com/maps/contrib/111859294918854859332/reviews
Saiful Jazri Zahari,5,"Huge sports complex within an education township. Theres Southampton University, Reading University and Sekolah Kebangsaan Medini within walking distance.

Sports complex has aquatic center with 2 swimming pools. 25m and 50m competition pool. Indoor arena, track and field, futsal, basketball and a small playground. Parking is plenty and loads of shops nearby.",6 months ago,,https://www.google.com/maps/contrib/110981345070624571075/reviews
Hazhar Abu Hassan,4,Great venue. Attended a rock concert at the adjacent Indoor Arena. There were people playing football at the venue next door at midnight! Ample parking spaces. There were also a night market at the venue to coincide with the gig. Located around 15minutes from the 2nd Link.,a year ago,,https://www.google.com/maps/contrib/115441104669649990761/reviews
