author_name,rating,text,relative_time_description,reviewer_total_reviews,reviewer_profile_url
Shandy Tan,5,"What amazes me most, is how Eureka! works wholeheartedly, with infectious enthusiasm, at every event, big or small.

They’re a one-stop event services provider, and are more than capable of creating exceptional event experiences.

They’re experienced (more than 20 years), but they’re still constantly learning and keeping up with the times. Always a pleasure to work alongside professionals. Your events are in safe hands with Eureka!",3 years ago,,https://www.google.com/maps/contrib/106854583186791861641/reviews
Eric Yeong,5,"Eureka! Campaign has the most committed, proactive and dedicated team in the industry. Always have customer's interest close to their heart and putting in their utmost effort in delivering a successful event. Highly recommended to have them helm and organise your event :-)",3 years ago,,https://www.google.com/maps/contrib/103266565857845707429/reviews
Sofnade -,5,Eureka! is a great company to work with. Very detailed and understanding in their planning. Have worked with them for a couple of events and the process has always been a breeze. Thanks team!,3 years ago,,https://www.google.com/maps/contrib/104588469951688980706/reviews
Wayne Chua,5,Amazing team with infectious positive energy. It’s surprising how well they can all perform under pressure and even willingly to go the extra mile for you to ensure your event is a success. Eureka … I’ve found it !!!,3 years ago,,https://www.google.com/maps/contrib/103388452735110182964/reviews
Clifford Lam,5,"You've found it! You really have!
This is a dynamic, team-driven and a great one-stop shop for all your event needs. The sales team works tireless with you to conceptualise a unique event and they are backed by a design team and a dedicated audio-visual production team. Reach out to them for a chat.",3 years ago,,https://www.google.com/maps/contrib/110331236366400075082/reviews
