author_name,rating,text,relative_time_description,reviewer_total_reviews,reviewer_profile_url
Kelly Ho,4,"Thanks for Events Partner team, we had a successful Asia launch without any issues. The chairs & bar tables served their purpose. We are happy with Events Partner's service!",a month ago,,https://www.google.com/maps/contrib/116732216122681167352/reviews
Kathy Rougier,5,"I have been using Events Partner for my large scale events since 2022. They are reliable, easy to deal with and efficient. I know I can rely on them and when you have 100’s of attendees to attend to, knowing your Furniture Rental company is reliable is such a weight off my mind! Thank you!",a week ago,,https://www.google.com/maps/contrib/116945662962466963550/reviews
Chloe Chan,5,Thank you Events Partner for the smooth delivery. Team was flexible and attended to our order promptly 👍 Delivery team also did their best to provide touch ups and replacements as requested.,3 months ago,,https://www.google.com/maps/contrib/107397404310929458683/reviews
Chui Ying,5,"Events Partner has always been our to go to partner when it comes to furniture rental for our events. Their sales team is always responsive, ensuring the quality of their furniture.",3 weeks ago,,https://www.google.com/maps/contrib/106574707771222368725/reviews
Dann wong,5,"Have engaged Events Partner again for events.
Few times where we have to increase our provisions and they responses quickly and professionally. The sales team provided a personalised service to facilitate any issues you got. Kudos to the sales and operation team to be part of the successful event! Thank you!",a month ago,,https://www.google.com/maps/contrib/114370585238737385322/reviews
