author_name,rating,text,relative_time_description,reviewer_total_reviews,reviewer_profile_url
ShengLong Cai,5,"Great service at FairPrice West Plaza! I’m really impressed by Elise Lim’s patience in assisting me with my wrong purchase bill. Despite being under pressure, she went the extra mile to ensure everything was sorted out smoothly. She truly demonstrated a customer-first attitude and provided excellent service. Thank you, Elise, for your dedication!",2 months ago,,https://www.google.com/maps/contrib/104535582883040391642/reviews
Mohamed Irfan Bin Mohamed Jufri (trdasho_alt),5,"Wide array of items. I especially liked the variety of snacks present for celebrations (such as Teacher's Day) including cookies, chips, chocolates, ice cream and more.

Would recommend visiting if you need any snacks or are living in the vicinity (like White Water)",a year ago,,https://www.google.com/maps/contrib/113909271046454525853/reviews
Ho Soo kit,3,"Housed with a great range of Households essentials,  fruits, vegetables, 🍖  meat,
T-shirts.
Sufficient and convenient shopping for the
Heartlanders.",a month ago,,https://www.google.com/maps/contrib/107164542257114146748/reviews
Barbette Strauss,5,A relatively large Fairprice supermarket that isn’t super crowded even during circuit breaker.  There is alot more stuff added to this branch after a major makeover.  My favourite Thai organic red brown rice is still available.  And I would like to thank the TL for the relevant section for ordering the Taiwanese green max brand of multi grain 五谷米 rice for me.  Highly recommended to visit this outlet as you won't be disappointed with the good variety of products and also the sushi and baked chicken. The staff are also very helpful with our purchases.  Highly recommended!,3 years ago,,https://www.google.com/maps/contrib/116995110127835257886/reviews
ames james,5,"Went there about 5.15pm, Cashier at counter 2 was a sweet woman who informed me about the deals in the NTUC app. Even reassured me that she will hold my order and I can take my time figuring out the app!",5 months ago,,https://www.google.com/maps/contrib/107313585852379679592/reviews
