author_name,rating,text,relative_time_description,reviewer_total_reviews,reviewer_profile_url
Joshua Christopher,5,"Amazing church and amazing people. We have been there, wonderful hospitality. I highly recommend the church for people around this area and new comers to Singapore. Love it",a year ago,,https://www.google.com/maps/contrib/107591616123768654169/reviews
Roger Poh,5,Small homely church in Geylang with a welcoming bunch of people. Service starts at 9am weekly on Sunday and 5pm on the last Sunday of the month.,2 years ago,,https://www.google.com/maps/contrib/115019324846556823974/reviews
Eric Tan,5,A welcoming and cozy non-denominational family church - been attending for the past 5 years and grown a lot in faith and maturity as a person,2 years ago,,https://www.google.com/maps/contrib/114429163083150537149/reviews
Janessa Kong,5,wow! great church :) drummer is quite cool,2 years ago,,https://www.google.com/maps/contrib/100855092966212335966/reviews
Jet Chung,5,English Church Service ⛪,4 years ago,,https://www.google.com/maps/contrib/113716076118279424644/reviews
