author_name,rating,text,relative_time_description,reviewer_total_reviews,reviewer_profile_url
W Bradford,1,"I was perusing the local churches near my hotel and came across this one that intrigued me. Their website page ‘About Us’ curiously has only two items they stand for - one on the charismatic movement and the other on homosexuality. How weird! I’d hope that the so-called Christians there focus instead on compassion, service, and community building, not issues that divide and exclude!",2 months ago,,https://www.google.com/maps/contrib/100849803012366610572/reviews
Philip Fong,5,Recommend for those who just arrived from Hong Kong and need a Cantonese community. Join fellowships and it would be easier to join in.,a year ago,,https://www.google.com/maps/contrib/109642000619597088411/reviews
Jamie L,5,"Nice, simple worship place without the hypes. Love the atmosphere here. Locals and HK migrant families who came to SG for many years. A very pure and welcoming culture.",4 years ago,,https://www.google.com/maps/contrib/103425964838394757073/reviews
Nick Peh,4,"Didn't get a chance to enter, Nice outlook peaceful feel",5 years ago,,https://www.google.com/maps/contrib/107942982119174473299/reviews
Joshua Vincent,5,Good church to have a devoted time,5 years ago,,https://www.google.com/maps/contrib/108332181264867690831/reviews
