author_name,rating,text,relative_time_description,reviewer_total_reviews,reviewer_profile_url
Yap Harnyi,5,"Our experience with Habitat Learning Centre has been nothing short of remarkable. My daughter, Vanessa Ow, attended their tuition courses in A-math, E-math, Physics, and Chemistry. Since enrolling, her grades have shown a tremendous improvement. Vanessa achieved A1 in A-math and A2 in E-math, Physics, and Chemistry, which is a testament to the centre's exceptional teaching standards.

Vanessa teachers at Habitat Learning Centre are truly dedicated and have a unique ability to inspire their students. Their commitment and passion for teaching have had a profound impact on Vanessa's academic journey. We are incredibly grateful to the entire team for their hard work and dedication.

Thank you, Habitat Learning Centre, for your unwavering support and for making a significant difference in Vanessa's education. We highly recommend their services to any parent seeking quality tuition for their children.",4 months ago,,https://www.google.com/maps/contrib/114315903945065854752/reviews
Chuleeporn Boonmasiri,5,"Both my sons attended Habitat Learning Centre when we observed that they needed help with Physics, Chemistry and Math. We were pleasantly surprised that their O-Level grades improved greatly under the tutelage of teacher Leon Choo, so much so that they were able to continue on their learning journey, taking up courses of their respective choices. Thank you.",4 months ago,,https://www.google.com/maps/contrib/117582820140226425248/reviews
Fanxun,5,Teacher Leons chemistry lessons are always fun and informative! When i Joined after promos in J1 he was super helpful and helped me with my topics that I struggled previously but now I am super confident and my results went from S to A in A levels for H2 chemistry!,2 months ago,,https://www.google.com/maps/contrib/104493773606568714577/reviews
yz,5,"I was a student at this tuition centre and thank god for their help, or else I would've stagnated and continued failing subjects. When secondary 3 ended, I realised I was averaging a F9 in Amaths and a C5 in both Emaths and Chemistry. That was when I was referred to this centre by my parents. My older sister had been taught under them during her schooling years and the progress made was remarkable. Hence, we unanimously decided to join their tuition lessons for both Maths and Chemistry. And I must say, the improvement had an immediate effect, and it was VERY NOTICEABLE. I scored A1s for all three subjects in my WA1 (the first examination of the year) in sec 4, which I was very taken back by. I was then able to maintain it until my Olevels, scoring single digit with distinctions for all the subjects guided by Habitat. Overall, I would rate my experience at Habitat a 10/10. The teachers and principal are all very understanding and are able to tailor a study plan for their students to achieve desired results. Class sizes were relatively small during my time there and it was definitely a plus point. 10/10 would definitely recommend! 🔥🔥🔥",4 months ago,,https://www.google.com/maps/contrib/117987976868493658537/reviews
Melvin Tay,5,I am grateful to Habitat Learning Centre with how they have supported Asher with Mathematics Syllabus A . He struggled to pass his Mathematics since Secondary 3 and  decided to enrol him at Habitat Learning Centre in Secondary 4. His grades started to improve and he eventually obtained a Grade 2 at the NA Level exams.,4 months ago,,https://www.google.com/maps/contrib/108575057349170046902/reviews
