author_name,rating,text,relative_time_description,reviewer_total_reviews,reviewer_profile_url
Jason Eng,4,"Their spicy noodle average taste.

Their spinach ban mian dry is really ğŸ‘ taste.
Lotsa healthy spinach ğŸ’ª

Their ban mian soup also shiok especially when you topped a scoop of chicken rice chilli sauce. Shall photo here next time !",3 months ago,,https://www.google.com/maps/contrib/112244911290965003801/reviews
Andrew Lee,5,,3 years ago,,https://www.google.com/maps/contrib/115794746275116836863/reviews
