author_name,rating,text,relative_time_description,reviewer_total_reviews,reviewer_profile_url
D T (琳),5,"What a beautiful waterfront area! You can see the cable cars to Sentosa, cruise lines at the Harbour front center, and the Sentosa express monorail going to and fro Sentosa rail.  Sunset is beautiful to watch from here.",2 weeks ago,,https://www.google.com/maps/contrib/112267041964899367669/reviews
Edwin Petrus,5,"The waterfront area of VivoCity mall that oversee the Sentosa. Visitors may also enjoy the Batam-Singapore ferries moving around at Harbourfront as well as pedestrians walking along Sentosa Getaway bridge. It is a good place to sit and enjoy the afternoon sea view from here. There are some F&B eateries available here.

Harbourfront Promenade can be reached from VivoCity mall lobby level. Just walk straight from the lobby towards the seaside promenade.",6 months ago,,https://www.google.com/maps/contrib/114785935323023325370/reviews
Forest BK,5,"⛴️A scenic waterfront promenade located behind VivoCity overlooking Sentosa Island.
⛴️A great place for an evening stroll, especially after a sumptuous meal at VivoCity.
⛴️HarbourFront Promenade was once a wharf where ships moored. Several bollards are still around.
⛴️At that time, there was no land bridge linking to Sentosa Island. Only way to get to the Island was to take a ferry across.",7 months ago,,https://www.google.com/maps/contrib/116448453673911455728/reviews
Muhammed Salih Ahamed Athaullah,5,Best view,2 months ago,,https://www.google.com/maps/contrib/109575429302265850206/reviews
Cedric Cheung,1,"Waste of a beautiful setup, they should consider hosting more night market events here to jazz up the vibe which would benefit the restaurants lined up facing the harbour/sentosa",4 months ago,,https://www.google.com/maps/contrib/100024908082504612410/reviews
