author_name,rating,text,relative_time_description,reviewer_total_reviews,reviewer_profile_url
syed aje,3,"Can see it's getting wear n tear. Parking ramp is very tight on certain section. Quiet building, probably many are on homestay? Swimming pool is spacious. Wading pool is a bit small. Guards are very helpful, I guess they're used to homestay people",2 years ago,,https://www.google.com/maps/contrib/110719075274031012600/reviews
Snekithy,1,"We booked in June 2022, simply this people ruined our day in Legoland. Its our mistake we dnt notice the deposit $60 which was mentioned somewhere in a corner of the booking.com. They kept messaging us for the deposit middle of our rides at Legoland which is 3hrs before the check-in time. As its our mistake not seen properly abt the deposit we made the transfer. Again they started to call n msg for orher docs, we said we can provide during the check-in, thy said we should checkin before 5.30pm, if we go the apartment after 5.30pm there wont be anyone to help us if there any issues at the property (wow). The vacation mood gone and we were disappointed but as we paid for the house and paid the deposit, we canceled and went to the apartment.
Nothing… its a trash house. The blue sofa bed god! Did thy bring it from the trash area and keeping it?. Nothing according to the images thy have posted in the sites.
Immediately we moved out and booked another hotel. My kids dnt liked it at all, smelly, dusty and the whole things at the property is old. If anything get spoilt definitely thy wont return the deposit we paid. I seriously dnt kw to laugh or angry. We are not Jokers to fall in to ur traps.
They returned the deposit after 3 days after several calls and messages.",2 years ago,,https://www.google.com/maps/contrib/114306650505653812255/reviews
Supaporn Samui,5,"Very nice place to stay in the area, great view from our room, big swimming pool and nice garden. A bit far from everything but we were there for Legoland so that was worth it. You have grocery stores and restaurants at a walking distance. Easier we you go there by car since it is not easy to get the taxi and it is expensive as well.",7 years ago,,https://www.google.com/maps/contrib/113753808138603376597/reviews
KZ Li,4,"We stayed for a week here, the property is new, and well maintained.
The unit was comfortable, windy, equipped with sufficient bath & toilets, right next to the sky garden, and with a view towards the Straits of Johor (the border of Singapore).
It was a pleasant stay even though the place is located away from the necessities, we could still get our grocery 5mins down from Jaya grocer, a local delicacies food court at Anjung, other Chinese, Korean, Japanese and Italian cuisines restaurant 15mins drive away from the property.
The park, playground, pool, and gym was an enjoyable facilities within the property.",6 years ago,,https://www.google.com/maps/contrib/116618844392195546824/reviews
catherine toh,1,View at level 22. House looks clean but... sofa has bugs which caused itching. Strange insects found in bedroom (refer to pictures attached). Faulty lights bulbs at pantry and living room area. SMS the agent to ask about the wifi connection but didn't reply until on day of check out. Carpark exit is terribly narrow. Brown colour towels provided and look more like floor mats. Not within walking distance to famous landscapes or malls.,5 years ago,,https://www.google.com/maps/contrib/112036840709113328210/reviews
