author_name,rating,text,relative_time_description,reviewer_total_reviews,reviewer_profile_url
Rex Puan,1,"Only one ATM and deposit near me, but when I reach here machine not working at all.....very disappointed this bank service 😞😞",8 months ago,,https://www.google.com/maps/contrib/100593895548751427513/reviews
Drifter022,1,"Not 24 hours, i went midnight and it was closed.

Go to Holland village branch for 24 hrs ATM and Cash deposit machine",7 months ago,,https://www.google.com/maps/contrib/117154137644130501452/reviews
Li Feng,2,"Can’t deposit cash any more, why?",3 months ago,,https://www.google.com/maps/contrib/110202381292794441654/reviews
SY C,2,Doesn't have option/prompt on the atm for global account withdrawal. Got charged for service fees on my HSBC saving account.,2 years ago,,https://www.google.com/maps/contrib/109139695262073404252/reviews
anisa fauzi,1,Please check and service the machine.. always faulty.. people come down from other place just to use but disappointed.,2 years ago,,https://www.google.com/maps/contrib/113306233259934722178/reviews
