author_name,rating,text,relative_time_description,reviewer_total_reviews,reviewer_profile_url
John Cheng (ghaztles),4,"It says that they close at 10:30 p.m. on Google, but the stall was already closed for cleaning when I arrived at 9 p.m. on a Friday night.

The ingredients were still available, but they were already cleaning and closing up the stall.

Their opening hours are misleading.

Edit:
The hours for Friday have changed.",3 weeks ago,,https://www.google.com/maps/contrib/103832431747074197215/reviews
