author_name,rating,text,relative_time_description,reviewer_total_reviews,reviewer_profile_url
LETTY .C,5,"Authentic Ipoh taste, the Prawn Chicken  Hor Fun is nice. Strong prawn taste and not oily. Very good and light for a hot day. Price also reasonable at this area.",2 months ago,,https://www.google.com/maps/contrib/114914968000351539248/reviews
Reuben Cheng,5,"Came in the mall and found this place opened at 8am. As it’s still early to go to shopping malls, we sat down to have breakfast. Great service from the staff and the food is nice. Recommended to come here if you come via Tuas Checkpoint 🙂",2 months ago,,https://www.google.com/maps/contrib/107481256694057535558/reviews
Alfen Neo,5,Came at 8.30am on a Sunday morning. 9 Mar 2025. Air-cond restaurant with a wide selection of dishes. All dishes shown in menu were available.,2 months ago,,https://www.google.com/maps/contrib/109474920214386070491/reviews
chinL ch,2,"The nasi lemak sambal is good, rice and white coffee are average, but the ayam rempah is quite tasteless and the hard boil egg is over cooked, service is okay with friendly staff but too many flies which totally spoilt the dining experience here although we sit at the aircon session.",9 months ago,,https://www.google.com/maps/contrib/109665558839376885012/reviews
sze wei eng,5,"Tasted like original Ipoh
Hor Fun is great
White Coffee also great
Pricing almost on high side but still in affordable zone
Nice place to stop dine before heading Big Box
Will come again if ever pass by Sunway one day",3 weeks ago,,https://www.google.com/maps/contrib/110812269369354021671/reviews
