author_name,rating,text,relative_time_description,reviewer_total_reviews,reviewer_profile_url
LT Wong,5,"Strict security with facial recognition upon entrance and exit at lobby and guardhouse, security escort us all the way to designated parking lot which located beside lift entrance, very convenient for load and unloading our stuff. spacious living hall and dining hall for Homestay with 2 rooms and 3 bathrooms.
Stay 2 nights cost rm840 include cleaning fee and city tax",3 months ago,,https://www.google.com/maps/contrib/104777902219979910306/reviews
Hanks Lai,5,"Nice place for living, strategic location
Near Educity, Legoland

I love the house, cozy & the swimming pool.

Highly recommended, I will definitely miss this place.",3 years ago,,https://www.google.com/maps/contrib/105276504693151245852/reviews
Phuong Mai Nguyen,5,"Peaceful, safe and convenient place to stay for family, student and foreigner. 1 min walking to Mydin, Nearby Edu City, Eco Botanics, Medini, Puteri Harbour and Singapore second link.",3 years ago,,https://www.google.com/maps/contrib/104721802594352103247/reviews
Angeline T,5,"Just few kilometers drive to Singapore 2nd link. The interior are really big, cozy environment, elevator, pool, gym, and  visitor’s parking spot make this condominium one of the best in the area.
This is a very classy and friendly place to live",a year ago,,https://www.google.com/maps/contrib/112091265805499471166/reviews
Izham Sham,5,"Spacious units... Mine is a 2 bedroom and 2.5 washrooms unit. Serviceable kitchen, laundry area and storeroom. Gated area with smart tag-type entry, large-ish swimming pool and gymnasium. Quite well kept maintenance-wise, though covered parking area gets quite dark i.e. Could use more lighting.. Mydin shopping just a stone's throw away (but driving there entails a lengthy u-turn). Next to it is a Subway and 23hr mamak restaurant. All in all a very pleasant place to live in.",8 years ago,,https://www.google.com/maps/contrib/113456048345480086677/reviews
