author_name,rating,text,relative_time_description,reviewer_total_reviews,reviewer_profile_url
Kai Zhe Tan,5,"Mr Irwin is an extremely engaging, resourceful and friendly teacher who is able to help me glean insights from reading materials that can be applied to answering many questions. His lesson materials are prepared in a very systematic topical manner and he spends sufficient time covering each topic for us to understand its concepts properly. He also trains us to prepare potential arguments in interchangeable blocks so that they can be used to substantiate various claims, allowing us to set a strong foundation even before sitting for the exam. After joining him back in term 3 of jc1, I have consistently seen progress in my grades, culminating in obtaining an A for GP A levels. Even though the A level paper essay question that I attempted was not one that I had studied for, Mr Irwin’s teachings allowed me to apply the examples that I knew which roughly fell under the broad topic and still have arguments ready to use.",2 months ago,,https://www.google.com/maps/contrib/117502976560263507515/reviews
TML,5,I would say that the lessons are engaging even though i take the online lessons because Irwin call us to answer questions or to read out our answers to ensure everyone is involved in the lesson and we can learn from each other and get a diversity of opinions. Irwin is very intentional in his teaching in a way that he deliberately highlights techniques and vocabularies when going through content so that we not just learn about content but the skills also. The notes and materials provided are also quite insightful and succinct which is effective for us to learn and remember. I also appreciate how we do not have to prepare much for his lessons which does not add to our workload while still allowing us to follow the pace of the lesson easily.,4 months ago,,https://www.google.com/maps/contrib/101218351073306536387/reviews
joey,5,"Mr Irwin is a very dedicated teacher.
Even though he carries out his lesson on a mass scale (~30 students in 1 lesson), he is able to remember all of our names and makes sure everyone has a chance to voice out their opinions and answer the question posed. :)

The lesson is also well paced, with a staggered arrangement of P1 and P2 alternating between the lessons. This allows us to strike a balance and delve into each components properly.",2 months ago,,https://www.google.com/maps/contrib/113475893244393152481/reviews
Amanda Ang,5,Mr Irwin has a really clear teaching style where he will go through how to used the skills taught in his lessons immediately to the general paper. He also is very friendly and knowledgable who always is willing to answer and help me clear any doubts that i may have. His lesson is very interactive where he will get students to answer and share their thoughts on a certain answer or topic which allows everyone to learn from each other and keeps me awake during the lesson due to the varied interesting responses from the other students too. Thank you Mr Irwin for helping me push my thinking beyond the limited view. You are great :D,3 months ago,,https://www.google.com/maps/contrib/103426508057610250741/reviews
Teo Raphael,5,Mr Irwin is a patient teacher that often times uses his own free time to assist students beyond regular lesson times and answers all queries in the class no matter how long it takes. He is willing to accept and give feedback on work done by students and try to suggest areas of improvements. His methods to try and prepare for both Paper 1 and 2 I found to be quite effective,4 months ago,,https://www.google.com/maps/contrib/111786462154146701218/reviews
