author_name,rating,text,relative_time_description,reviewer_total_reviews,reviewer_profile_url
Mridula Jayachandran,5,Last month I had undergone a key hole surgery for my meniscus tear with Dr. Chong from island orthopaedics Gleneagles. I had a pleasant experience with my surgery. Dr. Chong is very friendly & caring. I am recovering now. The staffs of the clinics also so friendly to help me in my difficult situations. Thanks Dr. Chong.,in the last week,,https://www.google.com/maps/contrib/104980279447137105120/reviews
fabrice,5,"Dr Chong has been treating my right knee for meniscus, cartilage repair using stem cells techniques.
After surgery i was able tonresume sport about 6 months after and fully recovered in 9 months.
I therefore got a crashed by a car while taking a coffee, my right leg was in bad shape. He took care of it , and we are pending for other i juries to heal for scheduling another surgery for ACL and meniscus. He went to visit me during days off as well as every morning to check after me.
Very friendly and trustful doctor.
I really recommend him for knee or shoulder issues.
Thanks Doctor Chong.",in the last week,,https://www.google.com/maps/contrib/103287109457060985858/reviews
Shawn Chen,5,"Dr Chong is a true professional who is both highly skilled in his field, sincere and attentive. He took me through consultation, surgery, post-operative care and follow-up. Throughout the process, he addressed my concerns with patience and empathy, I felt completely at ease knowing I was under his care.",3 months ago,,https://www.google.com/maps/contrib/109066468424756393582/reviews
Woan Yann Sim,5,"Dr Chong is approachable and experienced. He provides precise diagnosis with effective treatment. He has successfully treated my knee , hands and shoulder issues and he fixed my son’s back too. 😊 The clinic staffs are also friendly. Highly recommended.",3 months ago,,https://www.google.com/maps/contrib/100169919367623767498/reviews
D Ng,5,"From my first visit in Aug 2023, Dr. Chong took the time to listen to my concerns and thoroughly explained my knee condition and treatment options. I felt confident in his expertise, and he guided me through every step of the process with care and professionalism. His great sense of humor also helped to put me at ease. The treatment plan he recommended has made a significant difference in my knee recovery, and I’m extremely grateful for his attention to detail. I highly recommend Dr. Chong for anyone seeking orthopaedic care!""",3 months ago,,https://www.google.com/maps/contrib/117126278717735824140/reviews
