author_name,rating,text,relative_time_description,reviewer_total_reviews,reviewer_profile_url
Alvin Teo,5,"Highly recommend

I had a fantastic experience with them. Their workmanship is top-notch, and the quality of the framing exceeded my expectations. They completed the work quickly and efficiently, without compromising on attention to detail. The entire process was smooth and hassle-free, and my framed piece turned out beautifully. If you’re looking for professional and reliable framing services, this is the place to go. I’ll definitely return for future projects!",5 months ago,,https://www.google.com/maps/contrib/114251215067598944369/reviews
Cheri Teo,5,"Splendid job done, highly professional work with great attention to detail. The staff were kind enough to accommodate my request to get my A1 poster framed ASAP. They worked quick and flawlessly. I’ll definitely be back.",3 months ago,,https://www.google.com/maps/contrib/103174928612547128350/reviews
Mei Leng Shoon,5,"Ittibaa shop is my first thought when I need help for task on glass, mirror and pictures. Have been a faithful customer since year 2022 to date. I would like to express my appreciation to Mr Deen for his patience, listening ears, advice whenever I send my precious items for framing. There is no worry when I leave my pictures and artwork at the shop. All will come home safe and sound. Always a good job completed. The reliable and professional services from Deen and his team are highly commendable 🙏🙏🙏 Keep up the good attitude and work. Thank you. Sincerely, Mei.",2 months ago,,https://www.google.com/maps/contrib/106444926330915518863/reviews
CF Goh,5,Highly recommend framers here! I was recommended by carousell artwork seller to come here to stretch & frame my oil based painting. The quote was reasonable and best is the staff really treated the painting very carefully like their own. I asked for their help to cover up the painting as I needed to walk in the rain. They did it without hesitation. I'll be back again if I need more framing services.,5 months ago,,https://www.google.com/maps/contrib/111267171694793830237/reviews
Benjamin Tong,5,This frame shop has been here for so long and have always been going to them to custom made my frames. Their quality is excellent and their price point is affordable. Staff are knowledgeable and friendly. Definitely recommend them to make your frame.,2 months ago,,https://www.google.com/maps/contrib/114917436581267790072/reviews
