author_name,rating,text,relative_time_description,reviewer_total_reviews,reviewer_profile_url
Ivan lee,5,Got my 2nd pair of glasses from Jam Optical. Impressed with the good service by Debbie and professional eye test equipment. I like the range of frames available in store. Got a pair of Yellow plus few years ago and this time getting Lindberg. Highly recommend this place if u r not tight on budget.,a month ago,,https://www.google.com/maps/contrib/106781193060348017549/reviews
Reeve Lum,5,"Saw Jamco Optical ads on social media ads, so this time round give them a try. Called and booked appointment, got served by Li Lin told her the brands and my requirements. From choosing frame, getting eyes check process till upon collection. The experience is so friendly and so detailed. Thank you and appreciated. Will definitely be back again for my next frame and recommend my friends.",5 months ago,,https://www.google.com/maps/contrib/111285711174539334045/reviews
Makiki Ng,5,"Jamco is a gem located at Katong Shopping Center.  Strong service orientation, excellent product offering.   My husband and I are extremely happy with our purchases.  Big thumbs up 👍 👍 👍",5 months ago,,https://www.google.com/maps/contrib/105119825278797450776/reviews
Wesley Tee,5,"A friend recommended Jamco Optical as my wife and i were looking to make a new pair after many years.

Went to look for Bryan and he was friendly and patient as we were trying on many many frames, he recommended many that suited us pretty well. Finally we managed to find one that each of us really liked!

I chose the one by Taylor With Respect
While my wife went for Zio.

They have a wide range of frames for different budgets. All of great quality compared to those I tried elsewhere. Some are limited so be sure to grab them if you like them.

They accept quite a number of payment methods, so no worries.

The place is quite small but cosy, they have a few units beside for other frame selection. The staff there were friendly,professional and service was top notch. Felt really comfortable over there. Remember to make an appointment before going down!

Will recommend my friends & family to Jamco if they need anything from them! Thank you!",3 years ago,,https://www.google.com/maps/contrib/111757751266100789357/reviews
Kai Jie,5,"Jamco has a wide range of spectacles to suit different budget, and I love the higher end brands they bring in. What’s more important is that they provide great service which makes me feel super comfortable during my visit in getting my pair of spectacles from them. They were accommodating in letting me try a dozen of frames and also made recommendations on what I could get. Eventually I purchased my first pair of Yellow Plus (model as shown is Stuart) and walked away from the shop super delighted with my new spectacles.

They are located in the basement of Katong Shopping Centre and when you’re there, don’t forget to pop by and get the famous banana pie from Dona Manis Cake Shop (same level) and chicken rice from the food court (also same level)!",3 years ago,,https://www.google.com/maps/contrib/116040620256115569605/reviews
