author_name,rating,text,relative_time_description,reviewer_total_reviews,reviewer_profile_url
Marcus Tai,5,The Jurong Lark Connector is one way to go to Jurong Lake Gardens from Clementi.  It’s relatively easy trail and safe.  Another way would be to cycle along Boon Lay Way to Jurong Lake Gardens from Clementi directly.  The only downside is that there are more pedestrians to avoid along the way.,2 months ago,,https://www.google.com/maps/contrib/113933265223619074260/reviews
J,5,I like to go there for a stroll. Not very crowded…is just a nice small park.,2 years ago,,https://www.google.com/maps/contrib/106717417151004880852/reviews
Juhi Das,5,Loved it.. And participated in small game.. Nice trained birds and animals.. Well treated.,2 years ago,,https://www.google.com/maps/contrib/107901911567358208555/reviews
Sierra Zulu Mike,4,More lighting will be appreciated especially after 8pm,a year ago,,https://www.google.com/maps/contrib/111018093867582797970/reviews
James Ling Huah Nguan,1,"The Jurong park connector at st 42, the canal is full of debris not cleared since covid-19 till now...",2 years ago,,https://www.google.com/maps/contrib/103796885906739529410/reviews
