author_name,rating,text,relative_time_description,reviewer_total_reviews,reviewer_profile_url
Jynz,5,"The staff there are so friendly and cheerful. Especially the cashier staff, Lina and the kitchen staff, Ng Lee Hiang. They are so patient and their customer service are good also. They will apologize for the waiting time and reasure you that they are processing your order. Lina is also being honest that she does not have a good memory and will forget if the order are too large, however she will double and triple check on your order to make sure there are no missing items.",a month ago,,https://www.google.com/maps/contrib/107129083647362878312/reviews
Junxi,1,"Have plenty of experiences with this branch, some times good, some times bad(maybe because of the peak hour/what not)

Today's experience is just borderline the worst. Purposely avoided the peak hours to made an order and got cheese fries without the cheese. The amount is so miniscule that a packet of chilli sauce would have more cheese then what was provided. (If i could attach a picture here i would)

Apart from apologies no service recovery was done.",a month ago,,https://www.google.com/maps/contrib/100524985627676235035/reviews
Zerong Zhang,1,Food quality is inconsistent as compared to bigger outlets and my last purchase of whip potato turns out to be spoiled (tasted sour).,3 months ago,,https://www.google.com/maps/contrib/112331876196926489126/reviews
De de,5,well manner worker very friendly. her name Lina managment should take good care with this kind of worker one in a million. keep up with your good work👍🏽,2 months ago,,https://www.google.com/maps/contrib/107746303081107742578/reviews
Olivia,2,"Order cheese fries but i think i might as well just order normal fries and save my money, so stingy with the cheese even though i’m paying extra for it, barely even covered 10 fries it’s so pathetic.",5 months ago,,https://www.google.com/maps/contrib/109650857932927130678/reviews
