author_name,rating,text,relative_time_description,reviewer_total_reviews,reviewer_profile_url
sHeRRiNe,2,"Differential treatment. Was asked to order via QR code when at counter already, claiming short handed (when there are 3 staffs) but the next customer can order at counter.

The steamed Kaya bread didn’t come hot or warm. Can’t even tell whether it is steamed actually cos it is not soft.

French toast was not sold out even at 8.30am..",3 months ago,,https://www.google.com/maps/contrib/115689472754757086993/reviews
Xin Xiu Hong,5,"Glad that I can now enjoy local delights after my gyane appointment ! Many local options, personal favorite was laksa and mee siam and not forgetting soft boiled eggs and kaya butter toast. A variety of items were also suitable for my little ones. Staff were friendly as well.",10 months ago,,https://www.google.com/maps/contrib/103916534933799307862/reviews
A front,2,Food is too oily especially for a maternity hospital.,3 months ago,,https://www.google.com/maps/contrib/104738797146017964670/reviews
Vince Teng,1,Laksa pasta spaghetti wasn’t cooked. So many staff but food is bad.,8 months ago,,https://www.google.com/maps/contrib/115136181014963057717/reviews
Ryan Lim,5,"Great place to chill indoors and outdoors, excellent service by all staff. A fan for both dine-in and takeaways.",a month ago,,https://www.google.com/maps/contrib/108545513916739083468/reviews
