author_name,rating,text,relative_time_description,reviewer_total_reviews,reviewer_profile_url
Jun Hong Leong,1,"On my first consultation, made me touch my toes, sent me off to take Xrays and charged me $300+.

Set a time for the actual adjustment, then rescheduled because ""Dr.Kissun has something on that slot and we were not aware.""

Changed my timeslot so I had to rush down from central to Siglap. Ended up 10 mins late and they cancelled my appointment just as I reached the front counter.

Understand that it's not a cheap service but really? You're really going to reschedule me and waste my time?",2 years ago,,https://www.google.com/maps/contrib/105020018568118020924/reviews
andreean,5,"Very good team! Dr. Kissun, Dr. Shwetambra and their assistant Ms. Lara are very good professionals ! I have back pain and I am visiting the chiropractic once every 2-3 week . It helps me a lot to keep the hip bones & back aligned . Back in the days, when they were located in the Clifford Center is was easier for me  to reach their location. But even now,  that they are only in Siglap I keep going to the clinic as it is really worth for me! Highly recommended!",a year ago,,https://www.google.com/maps/contrib/108654137926127715100/reviews
Singh Rajratna,5,"One of the best chiropractor in the city. I got injured my neck and my condition was very worst and I was so worried for my healing. But I am really amazed by their treatment. And I would must say a special thank you to the Rehabilitation Therapist Ms. JK, she has done a wonderful job. She is very professional and experienced, due to her proper treatment, I'm able to recovered much faster than expected. I would definitely say that she is a wonderful lady there😊. Finally, I would highly recommend others to Kissing Chiropractor.",3 years ago,,https://www.google.com/maps/contrib/113150402569952715127/reviews
Lau Charis,5,"I had a painful neck and back problem in early 2020 due to a work incident, so painful that no painkiller can bring relief. I was unable to stand, sit and sleep well. I was recommended by a good friend to see Dr Richard Kissun who helped his wife's condition.
This is the first time I have seen a chiropractor.  My first good impression over the phone was a patient Kelly who helped to secure an appointment on the same day. Dr Kissun was able to immediately relieve my back pain with the cold therapy and treatment on the first visit. After the x Ray, he patiently explained my condition and recommended the progressive treatments necessary to bring me to full recovery. A week plus into the treatment, I am able to be off my painkiller and with every visit my condition improved and I am now able to sit, walk and sleep well with no pain. Thank you Dr Kissun and your team.",4 years ago,,https://www.google.com/maps/contrib/107060455630049568652/reviews
K C,5,"Visited Kissun Chiropractic on 22 Nov 2021 for an appointment with Dr Kissun for shoulder pain and hip check. Great service from the front desk staff in booking the appointment (called on a Friday), filling up the form at the clinic - friendly folks and efficient. The consultation with Dr Kissun was personalised - he’s very experienced, quick to diagnose the issues and suggest treatment and next steps.",3 years ago,,https://www.google.com/maps/contrib/114402809786832073971/reviews
