author_name,rating,text,relative_time_description,reviewer_total_reviews,reviewer_profile_url
Kwok Jayne,5,"What makes it safer and comforting in mind to know that your child is in a safe, friendly, welcoming and loving environment.
Staff greets children by name (which is amazingly they can remember all of them)
Principal Joen and Teacher Hani never fails to check on my children when they are away from school.
What is pleasing to know is that in this difficult time, school never fails to update parents promptly on the situation at school.
Admin Ros is always prompt in updating parents and keeping us reminder of school administrations.
I look forward to every event that school celebrates, they always beautifully display children’s work and culturally items in an engaging and interactive way.
I love the curated junior athlete and junior reporter program. 👍🏻
My child always sing along to the song and requests to find the piece of song teacher plays in school.
Highly recommended, regardless of curriculum or a safe school to have your child in.
Kudos and thumbs up to every staff in LV@HC 💪
Thank you for your hardwork!",3 years ago,,https://www.google.com/maps/contrib/106529026025380163083/reviews
Amanda Goh,5,The staff at LV@Hwa Chong are amazing! They are very friendly & supportive. My son had a rough start for the first few days in playgroup but the teachers & vice principal there were very patient and he grew close to them quickly. It is very comforting to know my child is in good hands. Their curriculum also have a good blend of activities and my son enjoy himself in school a lot.,3 years ago,,https://www.google.com/maps/contrib/110466022606025812133/reviews
Lim Yong Ping,5,"Our experience with Learning Vision has been nothing short of awesome. Our son started with their toddler care when he was 17 months old and has started K1 this year. The teachers (including even the non teaching staff) are attentive and caring, with great emphasis on hygiene and quality of meals. The curriculum is comprehensive as we noted our son is developing well in early literacy, bilingualism and mathematics. He absolutely loves going to school, meeting his teachers and friends. This is indeed a great pre school to put your child in.",3 years ago,,https://www.google.com/maps/contrib/106465564896286607784/reviews
Dawn Yin,5,"Lovely staff and teachers in this center. All childcare centers have been hard hit by the pandemic, and everyone at LV@HC has always remained cheerful, positive and warm. My children are thriving under the teachers' care, and I appreciate how patient and loving they all are. Any center can offer a myriad of programmes and curriculum, but it's the people that make all the difference. Those at LV@HC definitely do.",3 years ago,,https://www.google.com/maps/contrib/107110387779111927636/reviews
Farhani Rosli,5,"I love the curriculum at Learning Vision!
It meets the different learning needs of my children.

But nothing beats the lively environment that the teachers provide my children with!
They are always very nurturing, patient and passionate. There is nothing more satisfying for parents than knowing that their children are in good hands.
Thank you for caring and educating my children!",3 years ago,,https://www.google.com/maps/contrib/108593963306385519851/reviews
