author_name,rating,text,relative_time_description,reviewer_total_reviews,reviewer_profile_url
EQ Xavier,5,"Stylish shopping center located in the heart of Orchard Road, Singapore. The mall offers a unique blend of high-end fashion, luxury lifestyle, and artisanal boutiques.

The interior design is sleek and modern, with plenty of natural light pouring in through the glass ceiling. I enjoyed browsing through the various stores, which ranged from international designer brands to local specialty shops.

One of the standout features of Mandarin Gallery is its dining options. The mall boasts a range of upscale restaurants and cafes, serving everything from fine dining to casual bites.",a month ago,,https://www.google.com/maps/contrib/105533019712721928126/reviews
Andrew Tan,5,"We are incredibly proud to be one of the longest-tenured tenants at Mandarin Gallery since 2009. From our humble beginnings as a tiny boutique on Level Four, where a world of shopping, retail, services, and F&B offerings unfolds across four levels, we have blossomed. For the 16th consecutive year, we've expanded to three units on Level Four. We warmly invite you to experience the joy of lifestyle and furniture shopping with our exclusive brands from Japan, featuring many Japan Made Items.",3 months ago,,https://www.google.com/maps/contrib/100064065631123526331/reviews
Irving Choo,4,"Biggest breakfast buffet I've gone to. Eggs made to order, asian station, indian station and juice bar were my favorites.",3 months ago,,https://www.google.com/maps/contrib/113555661213915109410/reviews
Florence Leow,5,"🔶️ This upscale premier mall is set right in the heart of Singapore's bustling Orchard Road. Mandarin Gallery has 4 levels of retail stores, cafes and premium restaurants.

🟦 It's a high-end retail mall with major fashion brands holding fort here.

When was it built?
******************
● The hotel combined with the mall underwent a S$200 million transformation into a high-end shopping and lifestyle destination and Mandarin Gallery officially opened in Jan 2010.",5 months ago,,https://www.google.com/maps/contrib/102656561598060120185/reviews
Karen K,5,This mall is attached to Mandarin Orchard hotel and has a lot of high end retail outlets as well as a myriad of restaurants ranging from affordable brunch places to pricy wagyu omakase. There’s also Arteastiq which is surprisingly packed on a weekday high tea around 2pm. The inside of the mall feels a little “dark” and enclosed at some areas.,4 years ago,,https://www.google.com/maps/contrib/102882223208614112953/reviews
