author_name,rating,text,relative_time_description,reviewer_total_reviews,reviewer_profile_url
ed,1,"After election, the ministries did not recover the dog run. PLEASE do smth abt it.",in the last week,,https://www.google.com/maps/contrib/118019405878849077562/reviews
djcop7,5,"Our very own niche for our furkids with a pretty tight community where everybody knows everyone. Plastic bags provided to clean up after them.

Only thing lacking is a water tap like the one in Any Mo Kio, so bring ample water if U're joining us😁",3 years ago,,https://www.google.com/maps/contrib/115949321035123710117/reviews
Marc Teo,4,A small park probably catered to the dogs of the estate but well kept and cleaned.,2 years ago,,https://www.google.com/maps/contrib/102738589153865582049/reviews
Shailendra Thapa,5,Lots of doggos to see around. Nice park area.,3 years ago,,https://www.google.com/maps/contrib/116592237679341807878/reviews
Ernest Chew,4,Simple dog run that serves neighborhood well.,a year ago,,https://www.google.com/maps/contrib/116805200817859708018/reviews
