author_name,rating,text,relative_time_description,reviewer_total_reviews,reviewer_profile_url
TY1612,3,A big hawker centre and market. A little rundown.,3 months ago,,https://www.google.com/maps/contrib/104933752105577577933/reviews
JOSEPH LIM,5,Vegetarian food is available at the hawker center. Parking spaces are plentiful.,2 weeks ago,,https://www.google.com/maps/contrib/111756448374060911744/reviews
Meng. Chai,3,Small corner eatery near Sheng Siong n Kebun bahru bird singing area,a month ago,,https://www.google.com/maps/contrib/104908480851850700518/reviews
Toh Hongjoo,5,,3 weeks ago,,https://www.google.com/maps/contrib/118050165002256800741/reviews
Kyaw Kyaw Thein,4,,2 months ago,,https://www.google.com/maps/contrib/106465900279261476286/reviews
