author_name,rating,text,relative_time_description,reviewer_total_reviews,reviewer_profile_url
Chinese Moon,1,"Pricey with poor and slow service.  Ban mian store was chaotic, letting people cluster waiting to collect their food.  People ordering according to the line ended up lining up without line moving forward as others came from opposite direction cut queue as those waiting for their food were blocking.  The menu was deceptive too.  Ordered Tom yum noodles and was asked if wanted pork or seafood.  Seeing the menu had seafood prices $7.50 which was $2 more than pork, I went with pork but was charged for seafood and told that it was because the soup was Tom yum.  Then don’t ask for choice if the meat is not the same as the menu’s base offering.  The young guy there was extremely disorganized too as I saw him charge another customer twice to the annoyance of the customer.  He also did not close the cover of the packed soups for delivery.  I pity those who ordered from Deliveroo or foodpanda as it will definitely spill along the way.",3 years ago,,https://www.google.com/maps/contrib/106735384857518209558/reviews
Jane Zhang,3,"The portion is big (lots of lots of noodles but not much meat). Tried the dry banmian, abit too salty to my taste.",3 years ago,,https://www.google.com/maps/contrib/113224273631108764323/reviews
Ida Liana,5,"Ordered knife shaven noodles and steamed dumplings on Foodpanda, super yummy and ate everything even tho I was full🤣",3 years ago,,https://www.google.com/maps/contrib/103305261053112386966/reviews
Grace Wei,5,Highly recommend the Dao Xiao Mian! 👍🏻Must try!,a year ago,,https://www.google.com/maps/contrib/105111494745262534572/reviews
BLASTRAC ROAD REGENERATION SYSTEM BRRS,4,Freshly cook Ban Mian and friendly service to go,4 years ago,,https://www.google.com/maps/contrib/112986048462689892749/reviews
