author_name,rating,text,relative_time_description,reviewer_total_reviews,reviewer_profile_url
Lucas Ng,5,"Home of the SAF Military Police Command, and Military Working Dog Unit (MWDU)",7 years ago,,https://www.google.com/maps/contrib/106768408512831355300/reviews
Tristan Tan,5,nice camp. post here no need to cheong sua,3 years ago,,https://www.google.com/maps/contrib/111395814233067197600/reviews
Leo Qi Xiang,5,Home of the SAF Military Police Command,8 years ago,,https://www.google.com/maps/contrib/103457454483716174319/reviews
Chase,3,Mowbray Camp here,9 years ago,,https://www.google.com/maps/contrib/105380537334914323013/reviews
Lim Ju Meng,5,,2 years ago,,https://www.google.com/maps/contrib/104826978859600356372/reviews
