author_name,rating,text,relative_time_description,reviewer_total_reviews,reviewer_profile_url
Yi Ling,4,"Tried Mr Onigiri at their new Vivocity outlet! Unlike the usual triangle onigiris, these are more like open-faced rice sandwiches, stacked and wrapped in a way that’s both neat and easy to eat. Super practical for on-the-go munching.

I had the 🍙 Kimchi Beef & 🍙Teriyaki Salmon onigiris (both $9.50) And it seemed to be a Vivocity Outlet Specific flavour.

The beef one was moist, flavourful, with a spicy kick from the kimchi that really balanced the richness. The salmon onigiri featured a thick, grilled salmon slab with crispy skin and a sweet teriyaki glaze – slightly dry, but the sauce helped a lot.

Both came with spam slices and cucumber, which added great texture and umami to each bite. I especially loved the tamagoyaki omelette – soft, creamy, and seriously well-made.

You can also upgrade to a set meal (+$4.90) with curly fries or tater tots and honey lemon tea. I preferred the curly fries – crispy and seasoned. Tots were okay but could be improved with extra seasoning or furikake. The tea was a decent complement.

Portion size is perfect for light eaters or a quick bite, though I’d recommend two if you’re hungry. Overall, a unique and delicious concept worth checking out – they also have another outlet in Thomson if that’s closer!",3 weeks ago,,https://www.google.com/maps/contrib/115707001285123682601/reviews
Randomstuffsg,5,"Grabbed a couple of onigiraz from here — portions were generous and pretty tasty. We took them up to the SkyPark to eat, which was a nice chill spot with a view of the harbour and Sentosa. Decent for a quick, fuss-free meal. Love their signature crispy chicken & the occasional new menu!",4 weeks ago,,https://www.google.com/maps/contrib/116551745132589748453/reviews
jayjaytruviews,4,"What a cute Onigiri restaurant located in Harbourfront, Singapore! Reminds me of Onigiri cross taco cross burger. The ingredients are fresh and although the combination is simple, each bite is so scrumptious and delicious!

This is such a good option to drop by for a quick grab and go! Will definitely come back to try their other options!",2 months ago,,https://www.google.com/maps/contrib/107406779507889233689/reviews
Zuriel Mamba,4,"The combinations of cheese & bacon simply made anything more appealing. Hence I passed by this outlet, it gave me a reason to grab something.
Needless to say this was a Savoury bomb, I like the flavors.
It was that familiar taste with a diff twist. Recommended to a meal instead, which is more worth it.",3 months ago,,https://www.google.com/maps/contrib/100097027827819745483/reviews
Kai Ling,5,"Seating space limited and I was lucky to dine in during one of my 3 visits. Takeaways are nicely wrapped in well designed packaging. For those with a soft spot for seasonal items, there are monthly specials to look out for.",2 months ago,,https://www.google.com/maps/contrib/100635259993109346258/reviews
