author_name,rating,text,relative_time_description,reviewer_total_reviews,reviewer_profile_url
PS,4,"Had not eaten Indian rojak for sometimes, this stall appealed to me so bought home some to try and gravy was spicy and good. It'll be better to dine in when it's hot and crisp.",a year ago,,https://www.google.com/maps/contrib/115760626774271634836/reviews
Mohamed Haniffa,3,"Guy@the stall is friendly...
Tried their mee combo,okok only...
The cucumber slice & potatoes was thick..
Rojak was good.",2 years ago,,https://www.google.com/maps/contrib/106001901776455159598/reviews
Sri Jaya Kant,1,Looks nice but tastless. The stall owner gives you weird looks,a year ago,,https://www.google.com/maps/contrib/117548438743873144934/reviews
Nur Azryn Shah Satah,5,Superb Rojak! Really² good!,2 years ago,,https://www.google.com/maps/contrib/105180053787695644397/reviews
Randhir Singh,1,Disgusting food and unclean stay- away .,2 years ago,,https://www.google.com/maps/contrib/107165563390692016252/reviews
