author_name,rating,text,relative_time_description,reviewer_total_reviews,reviewer_profile_url
Sergei Brinn,5,Aunty and Uncle are always very nice and friendly to everyone. Feels very welcoming to shop there every time!,4 months ago,,https://www.google.com/maps/contrib/112973714670260838988/reviews
Andrea Richards,5,"Basic last minute household needs available.
Staff is friendly and attentive.",11 months ago,,https://www.google.com/maps/contrib/112192588115508709230/reviews
meiting li,5,,5 years ago,,https://www.google.com/maps/contrib/111446731231144994842/reviews
liling tan,5,,8 years ago,,https://www.google.com/maps/contrib/102844927690955683586/reviews
