author_name,rating,text,relative_time_description,reviewer_total_reviews,reviewer_profile_url
marco diana,5,I have trained with coach Charlie for over a month. He demonstrates a strong understanding of tennis fundamentals and effectively tailors training sessions to suit my skill levels . His ability to communicate technical adjustments clearly and motivate players fosters a positive and productive learning environment. With continued focus on strategic match play he will further enhance his impact on my game. Looking forward to next session !,2 months ago,,https://www.google.com/maps/contrib/114486318616795888636/reviews
Rahim Khawaja,5,"Charlie is a great coach. Has been coaching my family for years. Brings a love of the game, superb technical knowledge and a calm, encouraging style to the court which makes sessions fun!",2 months ago,,https://www.google.com/maps/contrib/101987069662184406524/reviews
Kate Bancks,5,"We love Next Level Tennis! Charlie's professionalism, knowledge of the game and skillset are unmatched. Our older daughter began group lessons more than two years ago and she has developed solid foundational skills while enjoying her experience, so much so, that her younger sister wanted in on the fun and is now enrolled in a group class too. We highly recommend Next Level Tennis.",3 months ago,,https://www.google.com/maps/contrib/105174453855999743859/reviews
Raza khawaja,5,Charlie has been my coach for several years now. Yet to find someone better! Great coach 100% recommend him to take your game to the next level,2 months ago,,https://www.google.com/maps/contrib/108677125893135793003/reviews
Ryan Wong,5,Coach Charlie is one of the best coaches I’ve ever had! Coach Charlie always brings a positive vibe on and off the court. Not only is it always a productive session but also a fun one. His ability to spot out mistakes and correct them on the spot is second to none due to his knowledge and love for the game. Highly recommended to players of all level!,a year ago,,https://www.google.com/maps/contrib/118301130877660111019/reviews
