author_name,rating,text,relative_time_description,reviewer_total_reviews,reviewer_profile_url
Apurva Ghanekar,3,Always long queue during peak hours but teh taste hasn’t changed in years and prices are decent for cbd beverages.,3 months ago,,https://www.google.com/maps/contrib/102875416673723992765/reviews
Teh C Gao Siew Dai,4,"Visited again on 1 August 2023. There wasn't a queue for ordering, but there was one for collection. Paid via the Grab app.

Date of visit: 31 May 2023. There was a queue when arrived during lunch time, however it moved along quite fast. Due to outlet being near a smoking point, you can sometimes smell the faint cigarette smoke. Drink wise, the Teh C tastes a bit diluted.",a year ago,,https://www.google.com/maps/contrib/102646679801920717610/reviews
Rennie Lee,4,Reasonably priced drinks in CBD area. Long queues esp during lunchtime. Drinks are not bad!,a year ago,,https://www.google.com/maps/contrib/104896149882118051128/reviews
Andy Huang,5,Very delicious tea. Very quick and efficient. Best tea around town. Must try. Inexpensive. 2nd floor and it is a stand.,7 years ago,,https://www.google.com/maps/contrib/109921740660279197508/reviews
May Soon,5,Love the honey lemon tea! Fast service despite the long lunch queue. A great stop by place for a refreshing drink on a hot afternoon.,8 years ago,,https://www.google.com/maps/contrib/109493358080516295207/reviews
