author_name,rating,text,relative_time_description,reviewer_total_reviews,reviewer_profile_url
commander eps,5,"they pride themselves in their homemade dough, cheese and fresh ingredients! i love their pizza dough, which is thin-crusted yet still retains a chew 🍞 absolutely divine for texture lovers :)

i thoroughly enjoyed both the pizzas i tried: scorpion and design pizza. the scorpion comes with jalapeños, chicken sausages, olives which pack a flavour bomb in each slice 💣

the design pizza is a fully customisable DIY pizza, where you can choose the amount of marinara sauce and cheese, as well as the toppings and protein you fancy! you’ll definitely enjoy the pizza because it’s filled with everything you like 😆

another stunner was their sweet knots!!! it’s basically their pizza dough with lots of sugar and butter, and doused in sweetened condensed milk 🤤🤤 doesn’t it sound heavenly alr?",a month ago,,https://www.google.com/maps/contrib/116922317507738631153/reviews
Ravi Nair,5,"Ordered online and arranged for pick up. The place, which is a central kitchen at Serangoon North, was a little difficult to find. However, the designer pizzas were simply awesome. Very generous with the ingredients. The sweet knots were complimentary and were just as nice. Everything was great and as indicated on the box highly addictive. Highly recommended.",a month ago,,https://www.google.com/maps/contrib/110019581652439678126/reviews
Caleb Ellis,5,"Amazing pizza with great value! Came fast and was worth it. Tastes authentic, and the size for the price is good! The sweet knots are amazing too. FYI, this place is delivery only (at the moment)! Don't try to visit in person like we did😆",3 months ago,,https://www.google.com/maps/contrib/110777281310414163251/reviews
Yong Ann Tan,5,Food is fantastic and I feel its a good take on pizza with fresh and bold flavours. Definitely something I would recommend to anyone to try. Knots are amazing and the gold standard tastes great as well!,3 months ago,,https://www.google.com/maps/contrib/117794571516174059262/reviews
Rose,5,Pizza's flavours are very well balanced and the size of it for its price?? The star for me were the sweet knots that retained it crunchyness even through delivery. It had a perfect balance of the baked char and the sweet glaze damnnnn 5/5,2 months ago,,https://www.google.com/maps/contrib/109259018744489836002/reviews
