author_name,rating,text,relative_time_description,reviewer_total_reviews,reviewer_profile_url
Gator,4,"Chanced upon this restaurant while looking for something to eat at 9pm plus. It said open till late outside but never mentioned the time. Anyway, went in and ordered take-away. Inside, the restaurant was spacious and the server gave me a menu to look through. There were quite a number of food items but since I’m taking out, chose something more easy. Ordered the soy fried boneless chicken. I ate them after I got them from the server. The portion was generous. Chicken was crispy and coated with a very nice sweet soy sauce, similar to the ones I had in Korea. Now that I know that it’s open till late, probably will visit soon to try out the other dishes. Oh yes, they gave out plastic gloves for patrons to eat their chicken easily. Good gesture!",10 months ago,,https://www.google.com/maps/contrib/114331842318070680564/reviews
Jonathan Tan,5,"The chicken is cooked to order and it’s definitely worth the 30 mins wait!

The sweet and spicy chicken was my wife and my favorite whereas my two kids loved the original baked!

Considering that this is a baked chicken place, the other dishes were also very nice and i would definitely order them again!

Overall a nice place for chicken and beer!",7 months ago,,https://www.google.com/maps/contrib/111596953680041808085/reviews
Vaansi M,4,"Personally I find the menu was kind of limited.

But I loved their oven fried boneless chicken thigh, it was juicy. Cheese ramen was normal nothing exceptional.

Gimbap was good. Service is fast too",10 months ago,,https://www.google.com/maps/contrib/106719410651893162044/reviews
Dee,3,"We came to this establishment on a Sunday evening at about 7pm. There was a small  crowd. Food was extremely slow and other tables were served their OFC before mine. When I ask lady boss for my order she had to walk over to the kitchen staff to highlight our table was fuming mad as food arrival was slow. She asked if we ordered chicken and if so they would need a longer time to bring our food to the table. What a joke, we ordered kimchi fried rice, Jampong noodles and Jajangmyeon too - I don't see them arriving. What is worst other tables who came in later have already got their food (chix) first. Whilst we were waiting for our food, man boss tried to take away our baby chair for other tables. I had to notify him I have 2 kids here ya. He replied saying he thought I was done with our meal. What a joke as well. He was walking around actively and observing the restaurant and he didn't notice our food didn't arrive after a long wait. He was going around talking to customers and probably introducing his restaurant's food but he didn't notice customers' annoyed face - they would like to have their privacy 😅 There were a lot of waiters around, who will warmly greet you when you enter the restaurant. It wasn't a good experience for me at all despite having 2 bosses supervising the restaurant with a lot of waiters. The only consolation is their delicious oven fried chix. Though not authentic, their Jampong and Jajangmyeon were curated more for msian taste buds. It was nevertheless yummy. When I see the complimentary side dish - pickled radish - I almost want to cry. Portion was small and seemed to be further cut into tiny pieces. Are you trying to save cost? Not that we are here for complimentary radish but it was so pathetic that you might as well don't serve it..",8 months ago,,https://www.google.com/maps/contrib/117281612188800814525/reviews
Winnie faner,5,"Is my second time here. The food here is really delicious 😋The staff here also well trained, the one who come and take our order, didn't jot down anything but can repeat our order all correctly 👍
Very recommended, kudos to the staff",6 months ago,,https://www.google.com/maps/contrib/115650643859517505267/reviews
