author_name,rating,text,relative_time_description,reviewer_total_reviews,reviewer_profile_url
gp matters,1,"Think there is a change of staff / management.
The service standards to clients (your loyal clinics over many years.... probably longer than the tenure of your new team!!) have dropped tremendously!

We have been with Pan-Malayan Pharmaceuticals for 2 decades... recently, a customer service supervisor, a Suzanne xxx, unilaterally told us it would severe our business relationship just because of some inconvenience of debt collection.
Very rude. Very shocking. Wondering if this is the high-handedness from the highest level (the owners; shareholders)??",2 years ago,,https://www.google.com/maps/contrib/114960797433884641219/reviews
Benjamin Tan,3,Can you please explain the huge price difference between what you charge for the Dotory Plus FS-100 thermometer and what most online vendors charge?,5 years ago,,https://www.google.com/maps/contrib/116602075388367825090/reviews
Chia Kee Choon,5,,7 years ago,,https://www.google.com/maps/contrib/101006289375197200491/reviews
Tan KY,4,,8 years ago,,https://www.google.com/maps/contrib/107194432636282505177/reviews
Doreamon Foo,4,,8 years ago,,https://www.google.com/maps/contrib/112113760423276635348/reviews
