author_name,rating,text,relative_time_description,reviewer_total_reviews,reviewer_profile_url
Cheiko's Channel,5,"This place is very good to visit and it is very quiet. In the early morning and in the evening you can come here for biking, jogging or just relaxing walks. There is also a canal connecting from the Kalang river, where you can fish and see the wildlife found in this river such as herons, storks and if you are lucky you will see a family of wild otters looking for fish in the canal.",7 years ago,,https://www.google.com/maps/contrib/104291754801058938647/reviews
Soo Hin Yeoh,3,"Nothing special, not much landscape works, this is a bare minimum PCN but conveniently connects you from MacPherson area to downtown Kallang.

If you are cycling 🚴‍♀️ you will have to push your bicycle over the pedestrian bridge over PIE",3 years ago,,https://www.google.com/maps/contrib/115725392210756907778/reviews
anim farm,4,"A quiet place to go, kallang river has rich biodiversity, various fishes, monitor lizard, great heron, sometimes kingfisher can be seen. Walking, cycling, jogging, up to you. The PCN here is very close to central area,  thus I suggest go by bicycle to enjoy the night scene at marina bay, feel the cooling wind, you will have a good sleep.",8 years ago,,https://www.google.com/maps/contrib/113944988485705066767/reviews
Kenneth Chan,2,All nice and good until.... You reach this bridge. At least they built the little blue path for Cyclists to roll up your bicycle.,8 years ago,,https://www.google.com/maps/contrib/117084372959260303934/reviews
Ngô Quang Đông,5,Nice place for jogging and cycling,a year ago,,https://www.google.com/maps/contrib/116957883414431139342/reviews
