author_name,rating,text,relative_time_description,reviewer_total_reviews,reviewer_profile_url
William Ow,5,"Old school place which has now changed with more eateries.

If you want to look at how shopping malls look like in the 80s, you should visit here. The spiral staircase is still around.

The basement are filled with affordable eateries and you will see mant senior citizens here.",3 months ago,,https://www.google.com/maps/contrib/102779766764269863375/reviews
Wess Lim,1,"I had a disappointing experience located in the basement food court facing the escalator. The displayed pricing was $2.50 for 2 vegetables + 1 meat or $3.30 for 2 meats + 1 vegetable. However, when I ordered 1 pork dish and 2 vegetables, I was charged $5.00 instead.

When I asked about the price responded rudely with ""yes, why what wrong?"" in an aggressive tone. I was too tired from work to argue, so I just paid and left.

This lack of pricing transparency and poor customer service is disappointing. I hope the stall improves its pricing clarity and attitude.

Note: There 3 food court this store B1 facing escalator the sign board black in colour.",2 months ago,,https://www.google.com/maps/contrib/100809827958696787760/reviews
Steven Foh,5,"I have been here to get my made to measure business wears at #01-38 for many years before it has moved here.
Li Na is very friendly and helpful most importantly, very affordable price and all made to fit nicely. Off shelf, there are times the shirt or pants could be too loose and cannot be customized such as, additional pocket(s).",4 months ago,,https://www.google.com/maps/contrib/106404135418051148443/reviews
Wu Anthony,5,"Hello, hello, it is my pleasure to meet with you again, my name is Anthony. I am a Google reviewer from Indonesia.

I recently visited a local establishment for breakfast. Upon arrival, I noticed that there were two options for descending to the dining area: an elevator or stairs.

Once downstairs, I was presented with a variety of food stalls offering a diverse range of culinary options. Halal, non-halal, and vegetarian dishes were all available. I decided to dine at a vegetarian food stall, where I was pleasantly surprised to find that a mere $3 could purchase a substantial amount of food. However, it is important to note that the offerings were exclusively vegetarian. For those seeking a wider variety of options, further exploration of the food stalls would be advisable.

thank you, and God Bless All.",a year ago,,https://www.google.com/maps/contrib/110561422577939376703/reviews
jimmy lee,3,"A really old mall built in 1973 that has not changed much after all these years. I was just a little kid back then and after more than 50 years later, I am surprised to see that it is still not renovated. In fact, many of the shops have been there for decades especially the tour travel agencies.
I am also surprised to learn that they charge 20 cents to use the toilets which is quite uncommon these days as even big new shopping malls don't charge.
One unique feature that I have noticed is that there is an annoying security robot patrolling around and always asking everyone to make way as it approaches. 😂",7 months ago,,https://www.google.com/maps/contrib/110518855728692358654/reviews
