author_name,rating,text,relative_time_description,reviewer_total_reviews,reviewer_profile_url
Florence Lim,5,"Teacher Adeline has been a fantastic piano teacher for our son, Nathaniel! As his third teacher, she has made a remarkable difference in his learning journey. Her firm yet approachable and patient teaching style has truly inspired him. For the first time, we’ve seen Nathaniel so passionate and motivated about piano. He willingly practices on his own and even requests additional homework from her—a testament to her ability to engage and encourage her students. We are incredibly impressed and grateful for her dedication and skill in nurturing Nathaniel’s musical growth! Highly recommended!",6 months ago,,https://www.google.com/maps/contrib/101568997556040549590/reviews
Malathi Valluvan,5,"Adeline was a good teacher and my son really enjoyed the way she taught piano. Adeline was always so encouraging, as well as giving great ideas and techniques of ways to improve. Thanks Adeline for being so good with the students.",6 months ago,,https://www.google.com/maps/contrib/112987278020163587772/reviews
Jiun Ling,5,"Adeline is a wonderful, cheerful teacher!
She is a very patient teacher; and I, an adult learner, receives lots of encouragement. Greatly appreciated.
Her lessons were never short of joy and laughter!
Thanks 🎹Teacher!",4 months ago,,https://www.google.com/maps/contrib/100348893588704146731/reviews
Sheryl Ho,5,"I cannot recommend Ms. Adeline  enough as a piano teacher for young children. My 4.5 years daughter has been taking lessons with her for the past 1.5 years since she was 3.  Ms. Adeline has a wonderful way of engaging with young children, making the lessons fun and interactive.

She has a nurturing yet firm  approach, which has helped my daughter feel comfortable and confident while learning. My daughter looks forward to her weekly lessons and has developed a true love for playing the piano.",12 months ago,,https://www.google.com/maps/contrib/115365821853045853636/reviews
Anna Kow Geok Neo Kow,5,"I'm 75 and I started piano lessons with Ms Adeline Yeo a few months back. My music reading then, was rather weak. But with her patience & encouragement, I improved tremendously! She has helped me gain much confidence.
Now I enjoy playing the piano. Thank you Adeline!",6 months ago,,https://www.google.com/maps/contrib/116073511736337856212/reviews
