author_name,rating,text,relative_time_description,reviewer_total_reviews,reviewer_profile_url
Cheow Wai Yee,5,"Teacher Monica is a intelligent teacher, she uses types of teaching methods to help my child to learn and achieved the best result.  Trusted that she has a plan for my child learning journey and my child scored well in his grade 3 and 5 examination.  She is not only a great teacher but also a great adviser, I always ask for her advise or suggestions about my child education.  I have no worries to leave my child music learning journey with her, thank you teacher Monica !! 💕",a year ago,,https://www.google.com/maps/contrib/106320165669008565354/reviews
Lingminding,5,"Teacher Monica is a professional and responsible teacher and very patient with children. Under her guidance, my child gradually improved in playing the piano and became more and more fond of music. Thanks a lot!",11 months ago,,https://www.google.com/maps/contrib/105809549462130511739/reviews
Ying Ma,5,"Many thanks to Teacher Monica for her patience and efforts in guiding my girls to appreciate music. I am not someone who chase after piano exams because I think helping the kids sustain their interests in music is more meaningful, but Teacher Monica is good at focusing on the important foundations and making learning fun while covering the exam skills, killing two birds with one stone. This year my girls took their first ever piano exams in life, and both obtained their Distinctions. One of them got almost perfect scores for Grade 3. More importantly, they have enjoyed learning piano and never dread it with all the guidance from Teacher Monica. We are grateful for that!",3 years ago,,https://www.google.com/maps/contrib/113489048355901095028/reviews
Jodie Luu,5,"Teacher Monica has been teaching my kids ever since they started their piano journey when they were around 5 years old. She understands the strengths and weaknesses of each child and knows how to motivate them. More than just learning how to play the piano, the kids are learning how to play elegantly. I also greatly appreciate her flexibility and agility in moving the piano lessons online during the circuit breaker period to minimize any disruption to the kids' learning momentum. My kids enjoy their piano lessons and are also happy to practice almost everyday at home. Overall, it has been a positive experience thus far.",4 years ago,,https://www.google.com/maps/contrib/113204817962053070364/reviews
Xue Bai,5,"As an adult student, I have been learning piano with teacher Monica for 7 years and achieved ABRSM Grade 6 so far. Teacher Monica is not only my piano teacher but also friend who is always encouraging me for my piano study and also sharing with me useful parental tips. Two years ago, my daughter started her piano journey with her too. She enjoys taking lessons with teacher Monica from the very beginning. Her distinct teaching technique keeps my daughter progress steadily. She is a kind and caring teacher who likes to give kids stickers and small rewards whenever they show improvement.

I highly recommend teacher Monica as a music teacher for any adult or child who wishes to learn.",4 years ago,,https://www.google.com/maps/contrib/104308780545892076411/reviews
