author_name,rating,text,relative_time_description,reviewer_total_reviews,reviewer_profile_url
Roxanne,5,Love the teachers here! The teachers are seriously dedicated. My daughter was enrolled in a different student care before and they barely supervised her studies. It just felt like she was playing all day long. The teachers here felt like they are basically mothers supervising their children. They made sure the kids' homework/spelling/ting xie etc are all done which cant have been easy for so many children. Thank you so much!,2 years ago,,https://www.google.com/maps/contrib/100147206044239592283/reviews
Eunice Lim,5,Teachers here are really friendly and nice! There are many students enrolled but the teachers try their best to take note of each student’s needs.,2 years ago,,https://www.google.com/maps/contrib/114378759330813476834/reviews
Ming,5,PlayFACTO School @ West Coast is an excellent student care and enrichment centre. Located in West Coast Community Centre.,6 years ago,,https://www.google.com/maps/contrib/108486631776915056324/reviews
Evelyn Tan,5,Very pleasant and detailed introduction. Would consider to bring my children to Playfacto.,2 years ago,,https://www.google.com/maps/contrib/106024843783100590523/reviews
weixn2006,5,The teacher is patient and the place is beautiful👍,2 years ago,,https://www.google.com/maps/contrib/101176015095832994423/reviews
