author_name,rating,text,relative_time_description,reviewer_total_reviews,reviewer_profile_url
Francis Woo,4,Pleasant eatery that offers Vietnamese and Western snacks and bites.,2 years ago,,https://www.google.com/maps/contrib/101504124736413814465/reviews
mel lee,2,"Business has totally changed for all but in name! Don’t go by the website, which is full of stock photos and lists a shaken, specialty coffee. Now it serves Vietnamese fast food fried bites, banh mi, and drinks, closed Mondays, which also hasn’t changed on their website. So unfortunately I arrived to use a FavePay voucher and it was closed, so didn’t try anything.",2 years ago,,https://www.google.com/maps/contrib/117459033697522837192/reviews
Lucas Liew,5,"love the coffee here. dripped and shaken coffee which has a very unique taste to it !

the beef don is also really good!",3 years ago,,https://www.google.com/maps/contrib/107225042807392011437/reviews
Karthi Sivagnanam,5,Come and enjoy Video Gaming here at 5$ per hr . Drop ur kids and enjoy walking around stadium. Fun place to go in weekend kids will enjoy,2 years ago,,https://www.google.com/maps/contrib/108809839740533630850/reviews
Vikas Waghray,1,Absolute unprofessional behaviour from the staff. Bad attitude and careless attitude. Wanted to rate Zero stars. Please avoid,a year ago,,https://www.google.com/maps/contrib/116316886092398102467/reviews
