author_name,rating,text,relative_time_description,reviewer_total_reviews,reviewer_profile_url
Sarah Halford,5,Boon was really knowledgeable and took great care when treating my feet. He made me feel comfortable and at ease during the sessions and was attentive and thorough. My feet are now in much better condition and pain free. I would highly recommend their services!,a month ago,,https://www.google.com/maps/contrib/100252886668264313595/reviews
Priscilla Tan Hayward,5,"I went to see Boon Kiak for a persistent foot pain from plantar fasciitis. From the first visit, he took the time to listen to my concerns. He then explained, discussed and created a treatment plan for me that included exercises, stretches, a new set of insoles and shockwave therapy. He also recommended appropriate footwear for my condition. I felt supported and at ease throughout the treatment process and most importantly, the pain has reduced significantly.

There is zero pushy sales tactics to any treatment or product. Boon Kiak and his team are very friendly; transparent with treatment prices - they sent me the price list even before my first appointment. Highly recommend to anyone needing a professional, knowledgeable and patient podiatrist!",3 weeks ago,,https://www.google.com/maps/contrib/113146855883196402513/reviews
Darren Lim Zhen Yu,5,"I sought Boon’s expertise for inefficiencies in my cycling and knee pain. He meticulously assessed my feet and crafted custom insoles, which initially were slightly uncomfortable. Responsively, Boon took back the insoles, and created a new pair  which significantly improved my cycling comfort and power. His patience and commitment to his work are commendable, and even with the wait for the perfect insoles, the results were well worth it. Boon is a true professional who values patient satisfaction highly. Highly recommended!",a year ago,,https://www.google.com/maps/contrib/111643719888721104506/reviews
Caleb Lim,5,"Got my custom insoles for cycling from Boon Kiak. He is highly knowledgeable and professional from diagnosis to delivery.

I was assessed to have a leg length discrepancy and fallen arch on my left foot which were causing all sorts of issues from my knees to my lower back.

The custom insoles prescribed are a life (foot) saver - they fit perfectly and provide both feet with incredible stability. They took about two longer rides to get used to, but have since become indispensable, allowing a noticeable increase in power within my power stroke and alleviating discomfort when cycling for longer hours.

Will definitely recommend Boon Kiak for anyone looking to take good care of their feet.",a year ago,,https://www.google.com/maps/contrib/117746892151656935854/reviews
Chen Hu,5,"I had a problem with my right knee from running and cycling, including fitting issues causing numb toes. Despite a decade of running and cycling, I'd never seen a podiatrist until now. Boon quickly identified and solved the root cause, providing custom insoles for cycling and running with minor adjustments. The changes greatly improved my running form, addressing issues with landing on the edge of my foot. Though there's a slight weight increase, I plan to use them for all my training and long-distance races. Boon's expertise and adjustments for my tight plantar fasciitis were valuable. The cycling insoles are amazing; I adapted quickly and won't go back. Overall, a great experience, and I believe these insoles will enhance my athletic pursuits, making them more enjoyable and injury-free. 👍",a year ago,,https://www.google.com/maps/contrib/112136202427202291026/reviews
