author_name,rating,text,relative_time_description,reviewer_total_reviews,reviewer_profile_url
Derek Koh,5,"Waterfront RN cultivates a strong sense of community among its volunteers.  Regular social events and gatherings provide opportunities for connection and friendship, forging bonds that extend beyond the volunteer hours.  This supportive network is a testament to the group's commitment to nurturing not only the community they serve but also the individuals who dedicate their time and energy to it.",2 months ago,,https://www.google.com/maps/contrib/116160938515863486177/reviews
eunice Sng,5,"Loving , vibrant and fun team.",a month ago,,https://www.google.com/maps/contrib/100485782167096962448/reviews
Diederik Karssen,5,Special place for special memories. Great place for community events.,2 months ago,,https://www.google.com/maps/contrib/110575915598066537664/reviews
He Marilynne,5,Very energetic team!,2 months ago,,https://www.google.com/maps/contrib/115996509438687997802/reviews
Jamie Lim,5,Best estate ever!!,2 months ago,,https://www.google.com/maps/contrib/118250332929171805906/reviews
