author_name,rating,text,relative_time_description,reviewer_total_reviews,reviewer_profile_url
craigton gan rong,5,I always come here to buy liquor. They have very good stocks to pick from and very competitive prices. Ive been doing all forms of shopping from this mart since  i was a really young boy probably 14,2 years ago,,https://www.google.com/maps/contrib/114264344618084534006/reviews
Ling Yi Quek,5,"Love the customer service! They remember what are my go-to products and when the cashier saw me, they automatically gave me the product I wanna buy without me saying a word.",4 years ago,,https://www.google.com/maps/contrib/102023581633902058489/reviews
Cm Chan,5,They have cute children over there serving customers!,4 years ago,,https://www.google.com/maps/contrib/106241314530503117080/reviews
Prashanth Eleangovan,4,The cuttle fish snack was very good. But can’t find it anymore,4 years ago,,https://www.google.com/maps/contrib/109515979075185343855/reviews
Hady A. Hamid,1,Horrible service. Staff members don't even want to serve customers properly. And also racist. Don't bother speaking English to non-Chinese customers.,5 years ago,,https://www.google.com/maps/contrib/107734685660464874876/reviews
