author_name,rating,text,relative_time_description,reviewer_total_reviews,reviewer_profile_url
Kelyn Ngui,5,Plenty of seats. The western is of reasonable price. The food is tasty. The service crew is nice. Been a good choice of food for this neighbour hood,a week ago,,https://www.google.com/maps/contrib/117949704571720882889/reviews
Justin Lai,4,"Wife and I had visited this stall twice. The portion is nicely served, not too much, not too less. Fried rice (served with any grilled meat) is great in my opinion.",a month ago,,https://www.google.com/maps/contrib/109126958456873991333/reviews
Albanese Albanese,5,"I had eaten twice from this western food stall, Portion for the Side Dishes Great
The only part of the missing was the Meat Portion Consider Small Part

4/5",2 weeks ago,,https://www.google.com/maps/contrib/101445746630446931166/reviews
Chicken,5,Amzaing food and service workers all friendly,2 weeks ago,,https://www.google.com/maps/contrib/115692279825474333255/reviews
Michelle Hui,5,,4 weeks ago,,https://www.google.com/maps/contrib/102557530756936028129/reviews
