author_name,rating,text,relative_time_description,reviewer_total_reviews,reviewer_profile_url
sook yee Mah,5,"Really impressed with Ren Ci @Woodlands. The environment is very pleasant, surrounded by a lot of greens. The nursing home is very clean. Most of all very thankful to the caregivers/nurses in the household on level 6C. Thank you for your patience, care and understanding for my aunt. The caregivers/nurses are always attentive. Thank you.",a month ago,,https://www.google.com/maps/contrib/107587633172279828875/reviews
Pamela Wong,5,I was admitted to Ren Ci @ Woodlands. Was very thankful to all the nurse who take care of me. I would like to extend my greatest appreciation especially to Preeti (Household 4F) who take care of me for my daily chores from meal to bathing.,5 months ago,,https://www.google.com/maps/contrib/110606116650169217947/reviews
Eu Betty,4,"A brand new NH since Jan 2024, blessed to get a placement for my brother with the help from the social workers. It is a household concept in compare to other NH, they name my brother as a resident instead of a patient. Each ward has a living hall with 4 beded attached with a cardboard at each corner. Though the ward team are foreigners from Myamar, Philippines but we feel their care and most importantly the patience  of coaxing the residents. The Care Manager in- charge of the resident's well being and the ward care team often walk her rounds at the ward.
Renci has outsourced a security team at the entrance also giving their warm smile to welcome new admission and to guide patiently in the registration to the ward. All the best to Renci Woodland NH.",8 months ago,,https://www.google.com/maps/contrib/101726674147201933738/reviews
siapa aku jangan tanya,1,"Is so difficuit to talk with the foreigner nurse as they don't really understand English. Staff nurse stared at me while i talked with her like i owed her 1m dollars. Their Nursing Team is 👎🏻👎🏻👎🏻 as they employ ""nurses"" without working experience in Singapore. I am wondering whether their cert is real, as they don't even really know what is the safety way of NBT feeding and just anyhow feed. They are not caring at all towards bedbound residents and rude to the visitors especially those indian nurses.
The sercuity guards never perform their duties, they allow more than 2 vistors to visit the same residents at 1 time.
Medicial Social Worker also is a very irresponsible person as well as the doctor.

HOPEFULLY THEY WILL CHANGE THEIR WORKING ATTUTIDE AND EMPLOYED MORE RESPONSIBLE AND EXPERIENCE STAFFS.
2 NURSES LOOKING AFTER 16 RESIDENTS IN A HOUSEHOLD AND WITH THE STAFF NURSE WHO CAN'T EVEN REALLY UNDERSTAND ENGLISH AND THOSE ENROLLED NURSES WITHOUT EXPERIENCE WORKING IN SINGAPORE AS WELL AS SAFETY FOR THE RESIDENTS. I BELIEVE THAT THE RESIDENTS AND THEIR FAMILY MEMBERS ARE NOT VERY HAPPY WITH THEIR STAYS OVER HERE. HOWEVER IS JUST BECOS THEY HAVE NO CHOICE.

Feel that the nursing manager really dunno how to manage the team and just anyhow arrange the bed management for the residents too.
So regret to have my next to kin to stay here yet is hard to transfer out with such irresponible MSW working attutide.",11 months ago,,https://www.google.com/maps/contrib/112329491406397614879/reviews
Ninja Leng,5,,11 months ago,,https://www.google.com/maps/contrib/114410006937928117820/reviews
