author_name,rating,text,relative_time_description,reviewer_total_reviews,reviewer_profile_url
Jane Ang,4,"Many food stalls.
Tried the Daily special from the vegetarian stall: Laksa with egg.
Do ask for thick beehoon, if not you will find some yellow mee inside your laksa!",4 months ago,,https://www.google.com/maps/contrib/112683847768823722994/reviews
Faye Teo,5,Hak Kee curry chicken always damn power. Not too spicy but very flavourful.,a year ago,,https://www.google.com/maps/contrib/109338042969401523789/reviews
黃恆星,5,,a year ago,,https://www.google.com/maps/contrib/102395972486127559527/reviews
