author_name,rating,text,relative_time_description,reviewer_total_reviews,reviewer_profile_url
DR. ALVIN TUNG,5,Always a peaceful visit. The rooftop garden is a tranquil retreat in the middle of the city.,2 months ago,,https://www.google.com/maps/contrib/104044951295366590832/reviews
Jeffrey Seidman,5,"Make sure you take the lift to the garden to experience the largest Buddhist prayer wheel and view the buddah's tooth on the fourth floor. There are no pictures allowed in the ""tooth"" area. The room is a masterpiece of gold and red splendor dedicated to Buddah. It's inspiring",5 months ago,,https://www.google.com/maps/contrib/111909346360096919049/reviews
Alan Rawlinson,5,"A very humbling venue, spiritually and visually.",5 months ago,,https://www.google.com/maps/contrib/102074095288627267428/reviews
Worakanok A.,5,"No ticket admission, you can take the elevator on the top floor and walk up some stairs.",9 months ago,,https://www.google.com/maps/contrib/101566556109928120679/reviews
Carolina Almeida Pitta,5,"Pretty place, worth the visit",a year ago,,https://www.google.com/maps/contrib/105121005936890905855/reviews
