author_name,rating,text,relative_time_description,reviewer_total_reviews,reviewer_profile_url
KT,1,"We were hosted in one of the primary school, which is opposite a cemetery. One of the guys mentioned during 1am there is some chanting, very scary. Visit at your own risk!!!!",2 months ago,,https://www.google.com/maps/contrib/100946861019128116286/reviews
Axel,5,My favourite hang out spot with my friends🤙🤪 Great food that comes in unique green packaging! Remember to bring mosquito repellent your own water😝😝,3 months ago,,https://www.google.com/maps/contrib/109108731669676869110/reviews
Ston Tan,5,"Beautiful city!! So many things to do!! such as proning in vegetation and waiting for opfor, would visit sometime soon!",3 months ago,,https://www.google.com/maps/contrib/101087201061902031114/reviews
Qian Le Sze,5,beautiful place!! one of the highlights of my singapore visit!! Better than orchard shopping district IMO,3 months ago,,https://www.google.com/maps/contrib/100925882586885803165/reviews
Timothy Tan,5,"There are actually multiple toilets with running water functions (taps with basins, and multiple toilet cubicles with hoses by the side in each toilet).",2 months ago,,https://www.google.com/maps/contrib/106637167269361079973/reviews
