author_name,rating,text,relative_time_description,reviewer_total_reviews,reviewer_profile_url
Simon Y,4,"Takeaway the Nasi Padang, rice was well cooked as it didn't get soft even consuming it only after two hours and heavily drenched in curry. However, didn't enjoyed their beef rendang as they were full of tendon but I guessed there would be others who like it this way.",5 months ago,,https://www.google.com/maps/contrib/110316451866688483932/reviews
Tham,5,"The Curry Puff (Potato & Sardine) was delicious, well seasoning. The Lopes was nicely cooked. Value for money.",a year ago,,https://www.google.com/maps/contrib/109157459275410778557/reviews
Nope Thanks,5,The potato Epok epok is so good. Mee Rebus is okay.,a year ago,,https://www.google.com/maps/contrib/114697604520200224046/reviews
Tawfeeq,5,Her son very handsome,9 months ago,,https://www.google.com/maps/contrib/114937738823079829774/reviews
tas,5,her daughter very cantik,9 months ago,,https://www.google.com/maps/contrib/107788637285167159114/reviews
