author_name,rating,text,relative_time_description,reviewer_total_reviews,reviewer_profile_url
vonne Tong,5,Thanks to Zikry who helped my husband arranging this surprise birthday experience for me and I have indeed an awesome experience on this trial morning flight within Spore sky.  The pilot has patiently explained how to fly a plane and enjoyed the beautiful scenery in the boundary sky.  The best part is I can participate in landing the plane.,5 months ago,,https://www.google.com/maps/contrib/108102400361349747119/reviews
ting wei liam,5,"Excellent place to learn and experience flying in Singapore. Great instructors, friendly community :)",8 months ago,,https://www.google.com/maps/contrib/113014162879025764610/reviews
Zekeil tay,5,Only Affordable place to get a CAAS PPL in Singapore.  Great instructors and encouraging peers 👍🏻👍🏻,8 months ago,,https://www.google.com/maps/contrib/101566375024614033425/reviews
Dicky Tse,5,"Despite a small wait on tarmac for fuel, it  was overall a wonderful experience, highly recommend this to every flying enthusiast. Very friendly and professional instructor too.",4 months ago,,https://www.google.com/maps/contrib/109456991074825132525/reviews
Jarell Lim,5,Great place to learn and fly in Singapore!,8 months ago,,https://www.google.com/maps/contrib/101533876002527448322/reviews
