author_name,rating,text,relative_time_description,reviewer_total_reviews,reviewer_profile_url
Mark Darren,5,"Been attending the service here , for 15 years . Church members are very friendly . Pastors here as well , the way they preach their sermons , its very heartwarming . Praise God for all of their well-to-do ministries as well . Will recommend this church to those who are looking to attend a Tamil service . God bless . 🙏",5 years ago,,https://www.google.com/maps/contrib/118352186632772189201/reviews
Lawrence William,5,I am a member of STMC and enjoy attending the church. The pastors sermons are lively and i am able to apply the principles taught in my everyday life.,8 years ago,,https://www.google.com/maps/contrib/101654766482203236614/reviews
Daniel Chalke,5,Been here once when i visited Singapore.. Loved it.. Reverence for God is beautiful.. a totally refreshing experience.. I praise God for it,6 years ago,,https://www.google.com/maps/contrib/111510080532241340482/reviews
Neha Kumaran,5,Spiritual area and great for Protestants. The people there are friendly and welcoming so it was a great experience.,6 years ago,,https://www.google.com/maps/contrib/112265742683506139681/reviews
Ruben James,5,Nostalgic atmosphere....gd community....Pastor is very down to earth...Gd choice to worship here,4 years ago,,https://www.google.com/maps/contrib/110933314507758468387/reviews
