author_name,rating,text,relative_time_description,reviewer_total_reviews,reviewer_profile_url
Halis Can Mohur,5,"Dr. Soh is so amazing that I've been keep coming to him even tho my insurance not covered by his clinic and total commute takes me more than  hour. And by far the best doctor I've visited in Singapore.

You would definitely understand how professional and knowledgeable he is. Once you are in his room, you feel that his all  focus is only on you. And he always explain the process/problem calmly and as simple as possible then you just feel that you are in good hands.

I never waited more than 10 minutes for consultation and his staff are nice and kind as well.

I really appreciate Dr. Soh and would recommend to anyone with 100% trust.",4 years ago,,https://www.google.com/maps/contrib/118053892584090563141/reviews
A. Leong,2,"Reception staff was gruff and unfriendly (no acknowledgement when I thanked her after the registration process or after collecting my medication). She took a long time to note down my drug allergies even after numerous repetitions.
Dr. Soh, made the right diagnosis. Yes, I have an outbreak of acne vulgaris, but I already knew that. He took 1 look at my face and said ""you have oily skin"" to which I had to correct him and said, I had applied a ceramide moisturiser, it did indeed have a shiny finish but in reality, I have dry skin. He was dismissive in his response and it showed in his body language as well.
The only positive is that I was in and out in 15 minutes. A lot faster than the time I would have spent at my regular GP. However, I did not get any sense of ""Shalom"" during my visit.",a year ago,,https://www.google.com/maps/contrib/104936908671845043874/reviews
Stephanie Ernest,1,"1 word for these people WOW. They let others cut queue just cos the patients visited them before. Your name/number is not called in sequence. I didn't know that is how you're supposed to treat people.👏🏻

And this is how they respond. From the name you know lah why they respond like that. When I came there was only 2 people outside & 3-4 inside. When someone came after me, they let her go in first. And I'm not talking about the old couple who went before me, because that is totally understandable. They also lied about only accepting cash payments after I asked again they were like oh why not you try to scan this QR code cos just now not working. Wth?? Not happy with your job don't take it out on sick people who come to see doctor because their sick, not see doctor for fun hor.",a year ago,,https://www.google.com/maps/contrib/111261937144513788504/reviews
Jeremiah Tan,5,"Dr. Lawrence Soh observed to be a good and concerned doctor about his patients. His prescription are usually spot on. No need for many follow up treatment. That to me is a mark of a good practitioner.

Highly recommended.",4 years ago,,https://www.google.com/maps/contrib/102149106326775966312/reviews
Lyon Bakes,4,"Dr Soh wasn’t around when I visited but the Dr on duty was very detailed. Medication was good.
If only the staffs mending the counter were just as friendly, I would have given a 5.",2 years ago,,https://www.google.com/maps/contrib/107552928553169969294/reviews
