author_name,rating,text,relative_time_description,reviewer_total_reviews,reviewer_profile_url
Ho Soo kit,3,"Popular Shopping Departmental Store serving Heartlanders in Chin Swee Estate, Jalan Kukoh, Estates as well as the Condominium [s].",4 months ago,,https://www.google.com/maps/contrib/107164542257114146748/reviews
Sarah Pong,3,"""Yes - Google team - Hello - If you have a car, you can come here. There is everything you need, including food, household goods and food. It is open 24 hours a day. You may want to come and see if there is anything you need, including food, furniture, electrical appliances, household goods and cleaning agents. There are two floors in total. The first floor is for food and beverages. There is everything you need. The second floor upstairs is for household goods.",3 months ago,,https://www.google.com/maps/contrib/110280272404288333409/reviews
Ir Nil,1,"Malay trainee was rude, no customer service. Made a black face when say i pay cash instead of the CDC voucher. Please remove her. Else we will ctc the higher authority of your company.",in the last week,,https://www.google.com/maps/contrib/114784691220524923910/reviews
Lissa Helis,5,"There are many shopping options here, except for tissue, you have to buy one package which contains at least 4 packs.  Lots of fresh seafood and vegetables, lots of traditional Chinese spices as well as snacks from dried fruits, beer and lots of choices. Recommended for buying daily necessities if you are near this area👍",2 years ago,,https://www.google.com/maps/contrib/113227136233323937808/reviews
Anastasia S,5,"Cool place to find local gems - a bit difficult to navigate yourself since nothing is in English, and it does feel disorganized but cool place to find local snacks, teas etc at low prices!",a month ago,,https://www.google.com/maps/contrib/110042661381474324422/reviews
