author_name,rating,text,relative_time_description,reviewer_total_reviews,reviewer_profile_url
Albert Ng Kong Eng,5,Morning went to fix my shoe which basically everything is falling apart .. the reception service given to me was very welcoming and nice.. and advise my shoe need to be bottom sewing to be more rigid for longer wearing…Collection time was very fast too and quality of repair very good and satisfied.. Good work 👍,3 months ago,,https://www.google.com/maps/contrib/114615525281898907030/reviews
Brendan Tang,3,"fast & quick service but very very steep price of $38 for 2 keys ( padlock key and main door key) both are your regular metal keys.

Better off to go elsewhere if you have time",2 weeks ago,,https://www.google.com/maps/contrib/104414249115805471405/reviews
Andrew Stuart Lee,5,"Life saver! Came just in time 8.29pm and the owner was so kind to help me duplicate my 5 keys. Highly recommend. In case you couldn’t find this place so easily (like me, I was lost), I attach a few photos.

It is in between Pets station and Koo Kee!",2 years ago,,https://www.google.com/maps/contrib/109191682501162544549/reviews
Imre Wessels,5,"I got a reasonable price for my shoe repair and the boss did a great job at fixing them. I’ll be able to walk for many more miles on them.

Note: the shop is located outside the mall at the main road side.",6 months ago,,https://www.google.com/maps/contrib/113474067992639138849/reviews
J,5,Very friendly boss! I called to ask the price of duplicating a key and was asked to WhatsApp the picture of the key first! Went down another day and was honest to give the same as quoted! Unlike another shop at yishun 😠 waited 5-10 mins and was done! Duplicate keys works perfectly!,a year ago,,https://www.google.com/maps/contrib/108836346505805335103/reviews
