author_name,rating,text,relative_time_description,reviewer_total_reviews,reviewer_profile_url
Herman,1,"As a tourist not worth the $10.00 you get charged. No interactions working for children. Nothing to really see for about adult, just avoid. Don't be fooled by the retro soccer balls, they were remakes.",11 months ago,,https://www.google.com/maps/contrib/117118233802000815963/reviews
CP T,5,"Foreigner admission: SGD 10, payable by credit card.

What a surprise to stop by learning about the sports in Singapore, as to its history of development in terms of civilian facilities, physical education, past achievements in international event and some extra diet information by their national athletes.

Knew the famous Olympic gold medalist Joseph Schooling as the first in Singapore history, but it is a pity that not much introduciron about him.

There is a lot of information to see in this nice museum. Glad to be here almost none else around luckily.",2 months ago,,https://www.google.com/maps/contrib/112347567043035531042/reviews
Alec Tang,4,A small museum about Singapore sports achievements and history. Not much interactive things so can be boring for kids. The Shimano gallery next door is great for kids and bike lovers.,5 months ago,,https://www.google.com/maps/contrib/111515986887404730817/reviews
Rubiah Rahim,5,"It's very nice to be there.
See the history of our sports achievements. 👍✨️",a year ago,,https://www.google.com/maps/contrib/106854920303766358709/reviews
Ng Family,4,Modern museum with nostalgic feel. The museum showcases historical sporting events in the world. It also celebrates the triumphs of sports persons from Singapore. There’s displays of equipment used in the old national stadium which is nostalgic. There’s also a fun miniature golf course for the kids to play.,6 years ago,,https://www.google.com/maps/contrib/113590041079133861705/reviews
