author_name,rating,text,relative_time_description,reviewer_total_reviews,reviewer_profile_url
Jen S,5,"Nice drinks and ice cream! Arrived just before closing when the teas were no longer available, and the owner(?) kindly explained this. Looked at the drinks menu and decided to get non-teas instead, and noticed the ice cream range was good too, so got ice cream. Surprised by the good taste and texture for the affordable price! Good service too. Thank you.",2 weeks ago,,https://www.google.com/maps/contrib/117521401971854690666/reviews
cheezey ryan,5,"Bought the Taiwan Milk tea with black pearls
Large was 3.7, medium is 2.7. Pearl was 50 cents
Quite cheap tbh. around same prices as I-tea :)
Very cosy, went after ""afterschool rush"" so no one.
Got the 50% sugar. was quite sweet but not overly sweet.
No ""old tea taste"". milk was decent
Pearl was not sweet which i feel is good as i dl sweet pearls
Very good location outside multiple schools and under hdb so targeting younger crowd.

Saw they have icecream but not that hungry so will try next time

Overall amazing for its price and quality wise is quite good almost as good as the premium places",5 months ago,,https://www.google.com/maps/contrib/115914558954034253366/reviews
Aaron Tan,3,Taro fresh milk not as depicted. Tasted like powdered taro with milk.,a month ago,,https://www.google.com/maps/contrib/104727836802826244424/reviews
jpxsya,5,"Very nice owner & friendly too!! Always come here after work for a good treat of bbt & ice cream :)) Earl grey icecream & earl milk tea are my favvv 🤪. They also available on grabfood, yalls have to try it!! 🧋🍦😍",7 months ago,,https://www.google.com/maps/contrib/102657776475674392426/reviews
mohamad yasin,5,Been here since 2023 and they still remember my order!! This place has make me feel loyal . Another reason is that their Earl grey tea is simply the best. 10/10,11 months ago,,https://www.google.com/maps/contrib/101085763385166574449/reviews
