author_name,rating,text,relative_time_description,reviewer_total_reviews,reviewer_profile_url
Angeline Lam,5,"We chose Sky creation for our new place renovation due to their good reputation. We had worked with Marcus & Yuhan throughout the renovation period , their teamwork was great in supporting our needs & expectations. The renovation started promptly based on the requested date; the contractors (in particular tiling, carpentry, plumbing, glass works) workmenship were good. Overall planning was satisfactory to ensure our expected move in date. Finally, touch up works were followed through & completed timely.
Thanks to Marcus & Yuhan in playing a key role in making our new place a warm & cosy home.",a month ago,,https://www.google.com/maps/contrib/115243778111289482503/reviews
Jing Ying Ng,5,"I recently worked with Anthea Tan to revamp my living space, and I couldn't be more thrilled with the results. From the initial consultation to the final touches, every step of the process was seamless. They took the time to truly understand my style and needs, offering creative solutions that transformed my space into something beyond my expectations.

The attention to detail, from color choices to furniture selection, was impeccable. Not only did they maximize the functionality of the space, but they also brought in a perfect balance of aesthetics and comfort. Communication was always prompt and professional, and they managed to stay within budget while delivering exceptional quality.

My home now feels like a true reflection of who I am, thanks to their expertise!",4 months ago,,https://www.google.com/maps/contrib/112879987313699708577/reviews
Cindy Lim,5,"We had a great experience working with our interior designer, Anthea Tan. She was creative, attentive, and responsive throughout our home renovation, always making an effort to understand and address our concerns. While we truly appreciated the carpentry team's hard work, there were a few areas where the finishing and attention to detail could have been better. These weren’t major issues, but they didn’t quite match the high standard set by the design work. Fortunately, Anthea remained supportive and helped follow up on those points. With a bit more consistency in the workmanship, the experience would have been close to perfect.",a month ago,,https://www.google.com/maps/contrib/110533394012081090491/reviews
Stefan Lee,5,"I recently worked with Eunice from Sky Creation on a renovation project, and I can’t recommend her enough! The level of attention to detail she brought to every part of the job was truly outstanding, and I especially loved her modern luxury design and how she used lighting to make the space feel elegant and inviting.

During the renovation, nothing was overlooked—she made sure every finish, every corner, and every element was done to perfection.

And what stood out most was how willing she is to go the extra mile to address concerns or requests we had along the way. Their follow-up was excellent and made sure I was completely satisfied with every detail.

They kept me updated every step of the process, so I always knew what was happening and what to expect next, which made it so much easier for us. She also offered thoughtful suggestions that improved the overall design while still staying true to my original vision.

The project was completed on time and within budget, which I deeply appreciated. Thanks to her dedication and professionalism, the final result is even better than I imagined.

I’d recommend Sky Creation to anyone looking for a quality work, thoughtful designs and great communication!",4 months ago,,https://www.google.com/maps/contrib/116846415674916721942/reviews
Lin LieZhong,5,"""Patiently waiting for the final result ,🤩""
The firm met my expectations and I was quite satisfied with the final result on how everything turned out the colour, tone, material. Floor tiles, wall paint etc etc. Ness went through everything thoroughly with patience giving his opinions and thoughts when necessary. We met up a few times to slowly go through every small detail of the whole house before proceeding with the full house renovation.

Design
I truly liked how the whole house turned out making me feel like home with the warm lighting and it is more spacious.

Workmanship
Everything went very very smoothly and there wasn't any major problems that needed to be amended after the renovation except for some minor problems like stains etc.

Service
Ness attended to us and replied to our queries as soon as possible giving me a detailed and clear answer toy queries at times.

Value for Money
Yes, I personally think its value for money as everything turned out to what I was hoping for for my newly renovated house.",4 months ago,,https://www.google.com/maps/contrib/111613122683984173207/reviews
