author_name,rating,text,relative_time_description,reviewer_total_reviews,reviewer_profile_url
Christopher Chong,2,"(+)'s:
- good customer service - staff were always responsive via email, attentive at front desk, and the managing boss is always in attendance
- location is walking distance to Little India, MRT and buses
- rooms have air conditioning
- cheap
- luggage can be held on check-in and check-out
- keyed lockers are available at minimum cost - $2 deposit/$1 rental

(-)'s:
- the other reviews already describe the ambience of this place well - in all honesty, I feel that this place has given up its expectation of being a reputable accommodation, and accepted that its place in the ecosystem is as a halfway house for migrant workers, or as a homeless shelter. These reviews appear to have said similar for years, thus my conclusion.
- there is a laissez-faire attitude to ground rules in this place (management don't set firmly, and there's no enforcement) and the overall design has much to be desired. Many areas have fallen into disrepair. Don't come with expectations of comfort or a relaxed stay. This is not the place.
- the dorms are verging on overcrowded (8 pax dorm). The rotating door of travellers has led to disrepair, and clearly some pest problems - bed bugs, cockroaches, mice all evident. The corridors are stacked with disused bedding, furniture - havens for bed bugs, termites to nest and significant fire hazards. Clean it up. The linen had black markings (bed bugs). Wet, damp, dirty or sweaty clothing hangs from beds leading to room hygiene issues.
- surely there are some amenities that the hostel can afford to provide at no added cost like soap or shampoo dispensers in the shower? Just small improvements that could lead to a much better ambience and guest behaviours.
- the demographic of tenants is generally long-term stay migrant workers from the subcontinent. There is little respect for sleep, other travellers or local culture - phone calls and chit-chat in the room take place at all hours. It is what it is, get comfortable. I cannot recommend this place for female travellers.
- dorm rooms will remain unlocked, secure keyed lockers are the main security for personal items
- acknowledging that there is a dearth of low-cost accommodation options for travellers in Singapore, this place fills a role - but some reflective self-assessment is overdue as to whether it meets an adequate level of hospitality standards.",10 months ago,,https://www.google.com/maps/contrib/107064094776222661569/reviews
Citra Yst,2,"I'm not going back to this place. I stayed at this hostel for a night to attend taylor swift concert. But the room is far from what I expected. They put me in a room filled with old man, while I'm the only woman there. It was damp, dark and smelly. I'm too scared to sleep or take a shower that I had to leave the property at 7 am. The only good point is it was in a good location, close to the mrt and bus shelter.",a year ago,,https://www.google.com/maps/contrib/102428101894360014735/reviews
Liyana Nawi,3,"Stayed at 4 beds female only dorm. Bad room ambience (compared to other dorm I stayed before at different dorm-style accommodation, this room was very messy with clothes, towels etc hung everywhere). Other occupants were very friendly tho.

All staffs were very friendly, the receptionist let me check-in early, they communicated well whenever I had enquiries. Location is good too. Surrounded by beautiful shophouses, convenience store is 2 minutes walk, nearby MRT station is 5 minutes walk.",2 years ago,,https://www.google.com/maps/contrib/117607543313610473112/reviews
diani dilia,1,The worst place I visited. There is a lot of animal waste and stuffy. It was so dirty. I never going back.,3 weeks ago,,https://www.google.com/maps/contrib/110972229198168999567/reviews
George Trantas,1,"It was an awful experience. Although we already knew that it is a hostel, the rooms are more like a storage room, without any window, without space to have a shower (although we booked a private family room with toilet) without towels. And we paid 103€ for a night!! It's very close to metro thought.",a year ago,,https://www.google.com/maps/contrib/115950901663902701968/reviews
