author_name,rating,text,relative_time_description,reviewer_total_reviews,reviewer_profile_url
rockerfellas,1,"Rubbish. Newspapers are delivered to the letter boxes and yet subscribers are being charged for delivery charges. So called covid19 precautionary measures. Newspaper man always come in the morning, so there are no contact at all.",4 years ago,,https://www.google.com/maps/contrib/111547668882371006379/reviews
Norazam Sahrol,1,The Grab PMDs sending food & drink items are travelling on the broken pavements. The pavements are very uneven and are dangerous due to the loopholes along with it.,5 years ago,,https://www.google.com/maps/contrib/108720182149340230896/reviews
DHABA 1376,4,"That's the place were news paper has printed for Singapore, the people were working day/night shift there",4 years ago,,https://www.google.com/maps/contrib/104298672679711631320/reviews
Arman Jay,3,Grab drivers who drive in have to wait for the pax to change pass all bwfore u can proceed in.,6 years ago,,https://www.google.com/maps/contrib/101205734159106111954/reviews
Dennis Soh,1,As a shareholder i take umbrage at its declining shareholder value.,4 years ago,,https://www.google.com/maps/contrib/102677330938594342758/reviews
