author_name,rating,text,relative_time_description,reviewer_total_reviews,reviewer_profile_url
Salman Jaffer,5,"Lovely staff, well made coffee, fair prices",5 months ago,,https://www.google.com/maps/contrib/111513448578608312638/reviews
Nan Yang,5,"The best Starbucks in Singapore I ever been. Dropped a drink on floor, was gonna buy a new one but the barista made me a new one for free.
This made my day. ❤️",2 months ago,,https://www.google.com/maps/contrib/103150021714367898893/reviews
S.K.Y Light,1,"I ordered a Java Chip Frappuchino, and was served a watery / melted coffee? I've ordered Frappuchino from many other branches before, and this is the first time I've received a Frappuchino like that. It looked like the Frappuchino had been sitting out for some time, and even had a weird aftertaste.",a month ago,,https://www.google.com/maps/contrib/115940738882222007129/reviews
Michelle Yeoh,5,Best prices in SG with comfy environment and aesthetically appealing surroundings. Only open during weekdays till 7pm,9 months ago,,https://www.google.com/maps/contrib/117223891734424870330/reviews
Y B,1,"Ordered a tea latte, given tea only, ask for a remake, but got a diluted latte, what kind of quality control is this?!",a month ago,,https://www.google.com/maps/contrib/113530511195066288536/reviews
