author_name,rating,text,relative_time_description,reviewer_total_reviews,reviewer_profile_url
Ernest Quek,1,SUPER BAD SECURITY ATTITUDE FROM HENDERSON SECURITY. SECURITY OFFICER NAMED 'FATIMAH' SUDDENLY HAS THE AUTHORITY TO WHEEL CLAMP MY VEHICLE WHILE I WAS OUT OF THEIR BUILDING ON THE MAIN ROAD. JOKE. SUPER HIGH EGO FOR NOTHING. THINKS THAT SHE IS TOP OF THE WORLD. HAHAHAHAHAHAHAHA.,2 months ago,,https://www.google.com/maps/contrib/103558248591132373602/reviews
Alvin Yeo,4,"A long journey to tuas south
Smooth drive in the early morning.",a year ago,,https://www.google.com/maps/contrib/111957270204419439837/reviews
Rasel Hossain,4,Ok for rent,a month ago,,https://www.google.com/maps/contrib/112255721801763300226/reviews
Jhym Marchy,5,The only place around u can call food court for now at tuas lol 😂,3 years ago,,https://www.google.com/maps/contrib/116327984699823301799/reviews
Moturi Satish,4,Nice testy food can available,a year ago,,https://www.google.com/maps/contrib/106146757501047400894/reviews
