author_name,rating,text,relative_time_description,reviewer_total_reviews,reviewer_profile_url
YY,5,Great initiative to host a National Day celebration to bring together the whole estate - with food vouchers that helps to bring about business in the hawker centre! 🇸🇬,a year ago,,https://www.google.com/maps/contrib/108380785134773252341/reviews
Jaslyn Lau,5,"Great facilities and service from the staff here. I also like that they have a book exchange corner for residents to take and give away books.

I took the 1st dose of Pfizer Covid 19 vaccine here on 23 Jun 2021 through Parkway Shenton. it was smooth and orderly and well organized. The air conditioned badminton court was used as the vaccination centre.",3 years ago,,https://www.google.com/maps/contrib/111946244240741359373/reviews
Willy Yang,5,"Screened ,Vaccinated and discharged free gift from MOH 2nd on 05 June 2021",3 years ago,,https://www.google.com/maps/contrib/102119814102451011980/reviews
Kenry69,5,Open  concept CC. Great place to connect the residents,6 years ago,,https://www.google.com/maps/contrib/106475059654156790391/reviews
Arthur Michael,4,A place where you can meet your representative or local MPs.,4 months ago,,https://www.google.com/maps/contrib/112211776445198684393/reviews
