author_name,rating,text,relative_time_description,reviewer_total_reviews,reviewer_profile_url
velyn chia,5,Today I am 1st time here walk in Diana Kate for shoes. Good service and patience . Lady in charge (sales)denim Jumpsuit give me Idea for match my clothes.Will come again.,3 years ago,,https://www.google.com/maps/contrib/116117012595360797663/reviews
Phan Nicholas,1,There were floorboard on the ground and it is very dangerous for kids and elderly. I got injured due to the floorboards sticking out. Please do not do this and solve this immediately,3 years ago,,https://www.google.com/maps/contrib/103983457956874379805/reviews
GK Soh,3,"Not much has changed, f&b variety pretty much the same",a year ago,,https://www.google.com/maps/contrib/108974489109667528901/reviews
Y.C. Chan,4,A bit crowded during lunch time,2 years ago,,https://www.google.com/maps/contrib/110076042452851657476/reviews
phoebe buffay,5,,11 months ago,,https://www.google.com/maps/contrib/114638385703748747758/reviews
