author_name,rating,text,relative_time_description,reviewer_total_reviews,reviewer_profile_url
Karmen,5,"Great place for dim sum. Environment is clean and comfortable. Staff is efficient and helpful. Food ordered served quickly. Other items will be offered to you on a large tray, you can pick and choose. Some of items I wanted were not on rotation. Like porridge, steamed rice rolls and poached lettuce. Waited for a while for them and they never appeared. Had to get other items instead. I noticed the fried items are very ample and keep coming around. The steamed items are less ample and there is less variety. But on the whole there is plenty to eat and they are all very nice. Cheers!",a week ago,,https://www.google.com/maps/contrib/113787103630937842401/reviews
Keon Ng,4,"Place had some super solid dim sum, recommend the egg tart, one of my favourite egg tarts with a crispy and flaky pastry and a soft and creamy interior. liu sha pao is really good too. these two dishes, highly reccomend.

the downside of this restaurant is the decore and atmosphere, felt the place was abit dark, the table cloth was so long that it rests in your leg when you sit, super uncomfortable especially if you value cleanliness.

overall great dimsum place, evident by the consistent flow of customers so do come early if you’re visiting, great food just need to shorten their table clothes",a month ago,,https://www.google.com/maps/contrib/111792490144627244154/reviews
kus popo,5,"My 2nd time here in 2 weeks 😁 Reached before 10am, there are still table available. The service was good & the staff were communicating in a casual non hurry manner.
One by one they came to your table, offering their variety of dimsum.
The prices are very reasonable, we spent RM140+ for a table of 4 persons.
Notable, the orhnee dessert was good & not oily.
Can expect crowds ( need to take queue number) after 10am.
Last order is 3pm.",3 weeks ago,,https://www.google.com/maps/contrib/100231466774373349791/reviews
John Tay,4,"Nice place for dim sum. Came on a weekday, so not too crowded and the serving was fast. Service staffs are helpful and very attentive too. Lots of fried stuffs. Carrot cake is just so so, will order the pan fried version next time. Love the steam pork rib，well balance taste.",2 weeks ago,,https://www.google.com/maps/contrib/111060055064117411673/reviews
dolce bibobi,4,"Very decent selection of dimsum. I thought the staff going around with the trays would meant the food was lukewarm / cold but no, the hot foods were all just nice.

Loved the pork ribs and cheung fun! Highly recommend to try if you’re in the area👍",2 months ago,,https://www.google.com/maps/contrib/113755863430044252682/reviews
