author_name,rating,text,relative_time_description,reviewer_total_reviews,reviewer_profile_url
Jerry Lim,5,"I just took a moment to count my blessings—how wonderful it is to have a church right below my workplace, Frasers Tower. Although I am member from another church, these Cross and God's Word on the wall serve as constant reminders of God’s nearness and presence in my daily life.",in the last week,,https://www.google.com/maps/contrib/102939785905523724529/reviews
Yellow Bear,4,Church with interesting facade. Currently closed for a revamp.,3 months ago,,https://www.google.com/maps/contrib/104489311735261065689/reviews
ADRIAN TAN,5,Historic Church being restored. A space craved out for God in the midst of a busy city.,a month ago,,https://www.google.com/maps/contrib/111624534794893367251/reviews
ဇေယျာ တင့်ဝေ,5,The post colonial chinese style building does not have any symbol of a church.,7 years ago,,https://www.google.com/maps/contrib/117115940810093111297/reviews
Grace P (Pilates Grace),3,"I did not enter the church, only admired the building from the outside.

Restored building in the CBD housing a church established in 1889.

It's amazing how the areas immediately around it is redeveloped while maintaining the integrity of buildings like these which are more than a century old! In this case, there are new buildings all around, and of course the MRT system underground.

The ingenuity of humans! Engineers are so essential in making lives easier, but are usually unnoticed 👍🏼",6 years ago,,https://www.google.com/maps/contrib/118092098550137803231/reviews
