author_name,rating,text,relative_time_description,reviewer_total_reviews,reviewer_profile_url
Alan Teo,4,"Truly a hidden gem tucked away in a corner of the city which few people know about this historical building. Built in 1934 and was first used for the Sikh Contingent of the Straits Settlement Police Officers. Later used for Sikh officers and their families and became a barrack. During WWII, it was disbanded in 1945. After the war it was used by many government ministries including the Ministry of Interior and Defence. It was also last used as the Police Headquarters. There is also a Museum there and it's worth a visit.",3 years ago,,https://www.google.com/maps/contrib/108110685973303951841/reviews
Sam,5,A hidden gem to learn more about how police used to function in the past. The guide (Mdm Evelyn) was very passionate in her delivery and made the whole experience very worthwhile.,5 years ago,,https://www.google.com/maps/contrib/103900136672878292177/reviews
Cheng Ji -CJ,5,"Tucked at the corner of 195 Pearl's Hill, its a place where our hardworking police officers were safeguarding the law and order during the turbulence of chaos in the 60s. Kudos to guide George for the wonderful tour with information and stories! We totally enjoy it. 😄😄",4 years ago,,https://www.google.com/maps/contrib/110042832675321708289/reviews
Marcus Koh,5,"Cool experience. Didn't even know it was there, George Matthews was a great host!
Fun and informative!",2 years ago,,https://www.google.com/maps/contrib/104504948249755376195/reviews
Stef K,5,awesome hidden gem about the former police headquarters where everything was coordinated in the 50s to late 80s. recommended. have to prebook appointment to go. it is free. great guide.,5 years ago,,https://www.google.com/maps/contrib/100381716105426001895/reviews
