author_name,rating,text,relative_time_description,reviewer_total_reviews,reviewer_profile_url
Wesley Wong,5,"The chocolate shops located within Changi Airport Terminal 3’s airside area are a paradise for candy and chocolate lovers, offering an impressive selection that caters to all tastes and preferences. These shops are a fantastic destination for travelers looking to pick up last-minute gifts or indulge in a sweet treat before their flight.

The variety available is remarkable, ranging from premium international brands to locally made delicacies, ensuring there’s something for everyone. Whether you’re a fan of artisanal chocolates, creamy truffles, or nostalgic candy classics, these stores have you covered. Many of the items come in beautifully designed packaging, making them ideal as souvenirs or thoughtful gifts for loved ones.",4 months ago,,https://www.google.com/maps/contrib/107433449088212182977/reviews
Rinny Ermiyanti,5,"I would like to express my deepest gratitude to the entire staff for the exceptional service I received. I was extremely impressed by your patience and dedication in helping me find information about the Halal status of each chocolate product I purchased. Your friendly and informative service truly made my shopping experience very pleasant.

Thank you very much for your assistance. I greatly appreciate the effort and attention you have provided.",11 months ago,,https://www.google.com/maps/contrib/105473047090830912349/reviews
Sooriya Arachchi,5,"Has lots of chocolate at lower prices.
Staff was very friendly and professional
Recommending  anyone to go this shop  and buy the chocolate for your loved once.
Not much experience compared to other shops. Quite similar to Mustafa centre.
Also the borh staff was on 19th September were brilliant than other Singapore staff in d Airport.",7 months ago,,https://www.google.com/maps/contrib/102675740081959615174/reviews
Flo Yeow,3,"Not my personal favourite choice of gift shopping, but it works. Chocolates, snacks, and gifts that are uniquely Singapore. The prices are generally on the higher side, but if you're departing Singapore and need to get some gifts, this shop may be your life saver. This outlet is located at Terminal 3, departure hall, right after you enter the immigration gantries.",2 years ago,,https://www.google.com/maps/contrib/101597484841229205770/reviews
Sid Rupramka,1,"Be careful with expiry dates, products with higher discounts have immediate expiry...horrible experience",9 months ago,,https://www.google.com/maps/contrib/104089025161415897303/reviews
