author_name,rating,text,relative_time_description,reviewer_total_reviews,reviewer_profile_url
kai loong liew,5,"I have 2 child learning piano from Ms Joanna. I'm so pleased that my elder child have completed her grade 8 (abrsm) with her patient & fruitful guidance. Hopefully my younger child will complete grade 8 in future.
A million thanks to Ms Joanna.",3 months ago,,https://www.google.com/maps/contrib/114668338517393324495/reviews
Dawn Wong,5,"Thank you to Ms Joanna for her kind patience & guidance. From Knowing the ABCs of piano to performing a mini duet with her, I feel very happy. Big thanks to her. 😀",2 months ago,,https://www.google.com/maps/contrib/101754237211160296124/reviews
Kelly Cook Rao,5,Joanna is an amazing teacher. Very patient and kind with my daughter. And she also motivated an old student in me to start back up!,2 months ago,,https://www.google.com/maps/contrib/114725720176132786863/reviews
Melissa Tye,5,"I have been taking beginner’s lesson as an older adult for 2years with Joanna. She is an awesome, utterly patient and an encouraging accredited music teacher. I have been to other piano schools but none of the teachers ever introduced if they are accredited to teach. There was one that left me dreading to return for another lesson. Whereas, after the  1st lesson with Joanna, I have become more interested and reading scores were not as arduous. I need more practice as I am a senior but it has become a joy more than a chore.",11 months ago,,https://www.google.com/maps/contrib/111087383655066505493/reviews
D K,5,My child has been with Joanna for years and she has helped my daughter to obtain Grade 6 ABSRM practical and Grade 5 in theory.  She is a wonderful piano teacher and will guide accordingly to the child's progress.,9 months ago,,https://www.google.com/maps/contrib/113646313530312254896/reviews
