author_name,rating,text,relative_time_description,reviewer_total_reviews,reviewer_profile_url
Ivan Tan,5,"I give credit where credit is due. Honestly, this is one coffeeshop where mostly residents staying around here will visit and eat as the ever popular 505 Jurong west market & food centre is just a walking distance. I love this Bak Chor Mee and potion is good too. Keeps me full and satisfied with a happy smile. Do order the number 2. Uncle may look fierce or arrogant but he is not. He says thank you too. If you are around here, give this a try. If you look at the operating timing, sells till afternoon so it will be a disappointment if you are expecting to open late evening or night. If i come here. It will usually be in the morning so it’s alright.",a month ago,,https://www.google.com/maps/contrib/105865784747329427413/reviews
Benito Linus,5,Discovered this noodle stall after my grocery shopping at the nearby Sheng Siong. Ordered a fishball noodle dry and I really love it. Noodles was springy and the flavours was not too strong or too spicy. Reasonable pricing too.,a year ago,,https://www.google.com/maps/contrib/114106152376985360330/reviews
Vaccine Power,1,The uncle owner attitude is worse act like he don't worry no customers come.after I buy from this stall one time I don't feel go eat again,10 months ago,,https://www.google.com/maps/contrib/115903886416240326600/reviews
Yi,5,Nice fishball noodles that brings me comfort especially during a rainy day.,2 years ago,,https://www.google.com/maps/contrib/104443686865488403108/reviews
Joash Tan,5,,6 months ago,,https://www.google.com/maps/contrib/111788134840722485908/reviews
