author_name,rating,text,relative_time_description,reviewer_total_reviews,reviewer_profile_url
Alvan Smiley,5,Delicious local desserts at affordable prices. Tao Suan had crispy you tiao! Not too sweet and can see many older folks enjoying their desserts at the hawker centre. Worth saving some stomach space for!,6 months ago,,https://www.google.com/maps/contrib/113032710825641803063/reviews
H JM,5,A simple hot bowl of barley beancurd cooked with warmth. Slightly sweetened with generous and soft beancurd sheets. A classic stall that offers 5 other desserts.,a month ago,,https://www.google.com/maps/contrib/115011073902467306286/reviews
Andrew,5,Good old fashion dessert store 5mins walk from the MRT. Tasty and served hot. Their peach gum dessert is very delicious and fresh!,6 months ago,,https://www.google.com/maps/contrib/103150849684490815412/reviews
T greensake,5,"7/8/2024
Had bubur pulut hitam ($1.80) for dessert, was extremely good! Not overly sweet and fresh. I'll be back to try their other items.",9 months ago,,https://www.google.com/maps/contrib/102107525471936198024/reviews
Terry Ong,5,Good dessert on a hot day. Highly recommend their Snow fungus peach gum. Naturally sweet and has generous amount of peach gum and crunchy pear bits. Very reasonable prices.,a year ago,,https://www.google.com/maps/contrib/113935105259840349954/reviews
