author_name,rating,text,relative_time_description,reviewer_total_reviews,reviewer_profile_url
Anu,5,Purchased Kids dress and happy with the quality delivered. Delivery was on time and seller is friendly and responsive. Will come back for further purchase.,a year ago,,https://www.google.com/maps/contrib/101893292105362210519/reviews
Sunia Khan,5,All dresses were as shown on the website and good quality. They fit well. Customer service was highly responsive on WhatsApp for my numerous queries. Will definitely purchase again.,3 years ago,,https://www.google.com/maps/contrib/107304632032901201303/reviews
noor jehan kamal,5,Hi i got 3 suits. Me and my daughter  are super  happy as there's  no alterations  needed.  Perfectly  fits well. Thank you Womensfashionfun. You did are great job.,2 years ago,,https://www.google.com/maps/contrib/114683597049532354825/reviews
Vanisri Naidu,5,Have been shopping with womansfashionfun past 4 years and am a very very satisfied customer with so much of comfort in every of my orders. One of the best services and their material also is so perfectly as wat u see u get .lovely designs and will definitely recommend them for 1 stop shopping for sarees or suits😍,3 years ago,,https://www.google.com/maps/contrib/114426718877781663993/reviews
Shamala Balakrishnan,5,Reliable to purchase from this website.. quality guaranteed. Love all the items and true to size n colours. Btw I m a frequent buyer!,3 years ago,,https://www.google.com/maps/contrib/116552167584877028900/reviews
