author_name,rating,text,relative_time_description,reviewer_total_reviews,reviewer_profile_url
Edmund Teo,3,"Great coffee and toast keeps me returning for more despite multiple price hikes over past 5 years. BUT be warned that they almost always screw up my order. They either forgot or send out my items to others my mistake. T Even with little crowd, they cannot send out the items correctly more than 50% of time, esp the toast. More often than not, my toast or egg turns cold as I wait. Needless the say my coffee too. I recount 8 of 10 times I felt this way. Even if I requested to collect all items all at once, it gets ignored and I get item by item. Then they slip up😭.
Oddly, when they are able and you sit nearby, they serve you the items, dare not ask for more but still the errors persist.",4 months ago,,https://www.google.com/maps/contrib/104389708992440712775/reviews
Roselly,5,"Their Kaya toast really rocks! The fragrance of kaya is totally different from others! You can definitely tell it when you take a bite! For coffee, it's quite rich which is more suitable for morning.
I also tried another type of kaya bun but was a bit disappointed because the bun itself is quite moist and less airy.",9 months ago,,https://www.google.com/maps/contrib/112449177187040416323/reviews
John Sujono,4,"My favorite place to have a traditional Singapore breakfast sets. Although price is at higher side than other stalls selling the same sets, this stall is never lack of patrons. Do expect long queue on weekends and public holidays.
The coffee here is good and strong. Half-boiled eggs was cooked in perfection, still juicy but not too watery. Must try here is their kaya butter toast: a crispy toasted bread, spread with fragrant kaya jam and tops with slices of butter that melts in your mouth. Yummy!",a year ago,,https://www.google.com/maps/contrib/117351837615052438634/reviews
CK CK,5,"One of our favorite traditional kopi place. They make the best Kaya toast, French toast which is freshly toasted on order and toasted to a crispy texture which is outstanding. Kopi is great and the owner and staff and really friendly and cheerful. It has a nice vibe to it and always a pleasant experience. Thumbs up 👍🏽",2 weeks ago,,https://www.google.com/maps/contrib/116291332023390491227/reviews
Sean Lee,5,The ice coffee is actually Vietnamese as it has a nutty and chocolatey taste. Saw the toast and it looks so good.,5 months ago,,https://www.google.com/maps/contrib/104046677141086501019/reviews
