author_name,rating,text,relative_time_description,reviewer_total_reviews,reviewer_profile_url
Yellow Bear,5,"A good selection of Chinese vegetarian food with vegan options. Reasonably priced with friendly service.

** the other stall at Bukit Panjang Road ( Senja-Cashew CC ) is still in operation.",a month ago,,https://www.google.com/maps/contrib/104489311735261065689/reviews
Lea T,4,"Simple vegetarian hawker fare, the bee hoon is nicely cooked without being too oily",a month ago,,https://www.google.com/maps/contrib/104028033597135584647/reviews
Jasper Teiw,1,"Beehoon was tasteless, mock char siew was very tough, and popiah was super soggy. Prices was also quite steep.. not recommended as there are better vegetarian food around the area",a month ago,,https://www.google.com/maps/contrib/115866313306662601048/reviews
Wen You Thng,4,Lots of vegetarian dishes to choose from when I went to get lunch. The queue moves steady as the uncle cooks while the aunty serves the line of customers.,a month ago,,https://www.google.com/maps/contrib/113396359729963259039/reviews
Jianhui,4,"For $5.6, I rather go next door for vegetarian food",a week ago,,https://www.google.com/maps/contrib/105490891348066663472/reviews
