author_name,rating,text,relative_time_description,reviewer_total_reviews,reviewer_profile_url
SP C.,5,Hearty bowl of spicy goodness with all the hotpot ingredients u can choose from. Though the throat feels abit thirsty afterwards...still worth it. Price approx ~$8 with a bowl of rice,2 weeks ago,,https://www.google.com/maps/contrib/114265703504741937719/reviews
weeleong yap,5,"Whoa this is good!
I didnt go for the choose-and-by-weight , and ordered the ""pork set"" as recommended by the owner.
The ma la soup , although i only ordered less spicy, but was rich and have both the 麻  and the 辣, at the right portion! And the ingredients..! Wow i didnt expect such a large bowl of pearl-grain rice and the soup was brimming with the food!
Value for money indeed!
Will come again to try the Collagen soup base next 😋",5 months ago,,https://www.google.com/maps/contrib/116314773919649067930/reviews
f T,5,"This is sooooo amazing. Seller is super generous, I ordered $7 chicken set meal (not by weigh kind, can't chose ingredients ), portion alot, variety of ingredients given ok too. (my Pic look like alot green veg, but inside alot chicken slices and diff type non meat ingredient) N it's delicious. The instant noodle (set can chose noodle or rice) also very tasty, mala taste lu wei. I'm really hook.

I drink the soup even though I'm on diet. (I so far did not almost finish other places mala soup). This Mala soup is drinkable kind and not over salty (some other China ones over salty or super duper oily). I even use my son pizza crust to dip the soup as shown in picture🤣

I've eaten those China mala tang diff outlet, always eat diff China food. I did ask young stall helper guy what's in the set B4 purchase, he doesn't sound like China. No matter China or sg seller, this definitely suits me, and definitely 100% will go back again. This stall really thumbs up.",5 months ago,,https://www.google.com/maps/contrib/106180603413005070287/reviews
LaMisT Neo,5,"Went down a few times at weekday evenings. No queue at the shop. You can eother choose the sets on the menu or pick your own choice of ingredients in the display fridge and pay by weight picked. After which you will have to choose the soup base and spicy level if you chose mala.

We chose our own ingredients and went with Mala Collagen soup base since that is their the name of the shop. The price was around $12 for what we picked. Rice can be added (forgot the price) on request. A wireless pager will be given to inform when the food is ready.

Food is cooked on the spot and ready within minutes. The portion of soup was generous and covered the ingredients.

The collagen and mala combination went well with the other ingredients and perfect when poured onto the rice.

Highly recommended during the recent cold weather.

A hidden gem with great price value and short queue.",2 years ago,,https://www.google.com/maps/contrib/105572043659599664076/reviews
Baby.Monster,5,"The soup is the soul that is freaking on point.
It’s the best in sg after I had ate so much mala tang restaurants before. Will always empty the soup no matter how full I were. Thumbs up👍
Keep on going please🙏🙏🙏

Lady boss is a China lady and is very nice & pretty. Will always peel off the prawn shell for u.",2 months ago,,https://www.google.com/maps/contrib/112598682252323847223/reviews
