author_name,rating,text,relative_time_description,reviewer_total_reviews,reviewer_profile_url
Isabelle Tay,4,"Overdue review~

Food was ok and didnt have to wait long on a weekend lunch. Price slightly higher but still acceptable.",5 months ago,,https://www.google.com/maps/contrib/104140455507701408773/reviews
KiM BooN LeE,4,"Not as ""authentic"" Taiwan taste but do come close... The fried chicken, 鸡排, tenders and nice... Osyter noodles lack of strong favour like in Taiwan but eatable, maybe Singapore is more healthy choice lifestyle??? 🤔🤔... Overall recommended thou ...",2 years ago,,https://www.google.com/maps/contrib/104527916285751902034/reviews
snoringpillow,5,recently renovated taiwanese eatery at ehub! with great ambience and deli food & drinks 🥡🧋,a year ago,,https://www.google.com/maps/contrib/102442356995474806424/reviews
张凯满,5,Very friendly stall.,2 months ago,,https://www.google.com/maps/contrib/117005613764871860317/reviews
Haiyan Zhao,5,"I like the food very much, especially the shrimp XO scallop egg fried rice. All the dishes are delicious, and the price is reasonable.",a year ago,,https://www.google.com/maps/contrib/114188088296094267451/reviews
